tcpdump: data link type LINUX_SLL2
tcpdump: verbose output suppressed, use -v[v]... for full protocol decode
listening on any, link-type LINUX_SLL2 (Linux cooked v2), snapshot length 262144 bytes
05:09:44.532754 ens5  In  IP 104.236.110.97.9651 > 172.31.24.48.51034: Flags [P.], seq 3929535155:3929535254, ack 1237517095, win 501, options [nop,nop,TS val 1740955534 ecr 3854343309], length 99
05:09:44.532769 ens5  Out IP 172.31.24.48.51034 > 104.236.110.97.9651: Flags [.], ack 99, win 679, options [nop,nop,TS val 3854343316 ecr 1740955534], length 0
05:09:44.546993 ens5  In  IP 65.108.78.194.58094 > 172.31.24.48.9651: Flags [P.], seq 1786545165:1786545275, ack 3511000588, win 574, options [nop,nop,TS val 2611380980 ecr 160114632], length 110
05:09:44.547003 ens5  Out IP 172.31.24.48.9651 > 65.108.78.194.58094: Flags [.], ack 110, win 610, options [nop,nop,TS val 160114748 ecr 2611380980], length 0
05:09:44.567294 ens5  In  IP 65.108.78.194.58094 > 172.31.24.48.9651: Flags [P.], seq 110:623, ack 1, win 574, options [nop,nop,TS val 2611381000 ecr 160114632], length 513
05:09:44.567304 ens5  Out IP 172.31.24.48.9651 > 65.108.78.194.58094: Flags [.], ack 623, win 614, options [nop,nop,TS val 160114768 ecr 2611381000], length 0
05:09:44.591235 ens5  In  IP 3.225.79.249.55192 > 172.31.24.48.9651: Flags [P.], seq 1524373554:1524373665, ack 2405179101, win 443, options [nop,nop,TS val 3056909535 ecr 3247321403], length 111
05:09:44.591245 ens5  Out IP 172.31.24.48.9651 > 3.225.79.249.55192: Flags [.], ack 111, win 605, options [nop,nop,TS val 3247323411 ecr 3056909535], length 0
05:09:44.600767 ens5  In  IP 3.230.225.34.9651 > 172.31.24.48.52272: Flags [P.], seq 535420302:535420413, ack 2231368868, win 442, options [nop,nop,TS val 2259380484 ecr 1239839908], length 111
05:09:44.600780 ens5  Out IP 172.31.24.48.52272 > 3.230.225.34.9651: Flags [.], ack 111, win 636, options [nop,nop,TS val 1239841917 ecr 2259380484], length 0
05:09:44.661669 ens5  In  IP 65.108.78.194.58094 > 172.31.24.48.9651: Flags [P.], seq 623:733, ack 1, win 574, options [nop,nop,TS val 2611381095 ecr 160114748], length 110
05:09:44.661682 ens5  Out IP 172.31.24.48.9651 > 65.108.78.194.58094: Flags [.], ack 733, win 614, options [nop,nop,TS val 160114863 ecr 2611381095], length 0
05:09:44.663703 ens5  In  IP 18.215.213.100.9651 > 172.31.24.48.35730: Flags [.], seq 1943287444:1943288892, ack 3331182629, win 442, options [nop,nop,TS val 3397934214 ecr 3359054614], length 1448
05:09:44.663712 ens5  Out IP 172.31.24.48.35730 > 18.215.213.100.9651: Flags [.], ack 1448, win 630, options [nop,nop,TS val 3359055312 ecr 3397934214], length 0
05:09:44.663791 ens5  In  IP 18.215.213.100.9651 > 172.31.24.48.35730: Flags [P.], seq 1448:2983, ack 1, win 442, options [nop,nop,TS val 3397934214 ecr 3359054614], length 1535
05:09:44.663797 ens5  Out IP 172.31.24.48.35730 > 18.215.213.100.9651: Flags [.], ack 2983, win 625, options [nop,nop,TS val 3359055312 ecr 3397934214], length 0
05:09:44.730304 ens5  In  IP 3.227.69.165.9651 > 172.31.24.48.58596: Flags [P.], seq 424110746:424117986, ack 1288562394, win 442, options [nop,nop,TS val 213039219 ecr 1638966388], length 7240
05:09:44.730304 ens5  In  IP 3.227.69.165.9651 > 172.31.24.48.58596: Flags [P.], seq 7240:8214, ack 1, win 442, options [nop,nop,TS val 213039219 ecr 1638966388], length 974
05:09:44.730342 ens5  Out IP 172.31.24.48.58596 > 3.227.69.165.9651: Flags [.], ack 7240, win 629, options [nop,nop,TS val 1638967192 ecr 213039219], length 0
05:09:44.730347 ens5  Out IP 172.31.24.48.58596 > 3.227.69.165.9651: Flags [.], ack 8214, win 622, options [nop,nop,TS val 1638967192 ecr 213039219], length 0
05:09:44.730366 ens5  In  IP 3.227.69.165.9651 > 172.31.24.48.58596: Flags [P.], seq 8214:9577, ack 1, win 442, options [nop,nop,TS val 213039219 ecr 1638966388], length 1363
05:09:44.730370 ens5  Out IP 172.31.24.48.58596 > 3.227.69.165.9651: Flags [.], ack 9577, win 612, options [nop,nop,TS val 1638967193 ecr 213039219], length 0
05:09:45.146464 ens5  In  IP 3.232.45.182.55180 > 172.31.24.48.9651: Flags [P.], seq 1870993107:1870993218, ack 3997145153, win 443, options [nop,nop,TS val 3954177579 ecr 1926175055], length 111
05:09:45.146491 ens5  Out IP 172.31.24.48.9651 > 3.232.45.182.55180: Flags [.], ack 111, win 604, options [nop,nop,TS val 1926175679 ecr 3954177579], length 0
05:09:45.185827 ens5  In  IP 23.22.195.89.45882 > 172.31.24.48.9651: Flags [P.], seq 1369106842:1369107355, ack 3062897266, win 443, options [nop,nop,TS val 3078059761 ecr 2111146065], length 513
05:09:45.185855 ens5  Out IP 172.31.24.48.9651 > 23.22.195.89.45882: Flags [.], ack 513, win 614, options [nop,nop,TS val 2111147302 ecr 3078059761], length 0
05:09:45.263387 ens5  In  IP 107.21.238.130.54072 > 172.31.24.48.9651: Flags [P.], seq 2532318351:2532318881, ack 3088523257, win 630, options [nop,nop,TS val 162458921 ecr 1932032682], length 530
05:09:45.263414 ens5  Out IP 172.31.24.48.9651 > 107.21.238.130.54072: Flags [.], ack 530, win 614, options [nop,nop,TS val 1932033420 ecr 162458921], length 0
05:09:45.350911 ens5  In  IP 23.21.204.131.9651 > 172.31.24.48.52362: Flags [P.], seq 722322888:722322999, ack 3738250634, win 442, options [nop,nop,TS val 2939334532 ecr 47343166], length 111
05:09:45.350937 ens5  Out IP 172.31.24.48.52362 > 23.21.204.131.9651: Flags [.], ack 111, win 623, options [nop,nop,TS val 47345167 ecr 2939334532], length 0
05:09:45.571375 ens5  Out IP 172.31.24.48.54308 > 184.72.215.0.9651: Flags [S], seq 4094733028, win 62727, options [mss 8961,sackOK,TS val 1810152506 ecr 0,nop,wscale 7], length 0
05:09:45.571375 ens5  Out IP 172.31.24.48.50030 > 54.221.6.21.9651: Flags [S], seq 3783588232, win 62727, options [mss 8961,sackOK,TS val 2799054190 ecr 0,nop,wscale 7], length 0
05:09:45.571382 ens5  Out IP 172.31.24.48.48756 > 3.90.187.225.9651: Flags [S], seq 2763888998, win 62727, options [mss 8961,sackOK,TS val 3546480642 ecr 0,nop,wscale 7], length 0
05:09:45.571383 ens5  Out IP 172.31.24.48.54516 > 34.224.61.184.9651: Flags [S], seq 3167277833, win 62727, options [mss 8961,sackOK,TS val 3626390874 ecr 0,nop,wscale 7], length 0
05:09:45.571383 ens5  Out IP 172.31.24.48.56952 > 54.147.2.72.9651: Flags [S], seq 2772588783, win 62727, options [mss 8961,sackOK,TS val 3966113298 ecr 0,nop,wscale 7], length 0
05:09:45.571388 ens5  Out IP 172.31.24.48.46938 > 34.229.174.199.9651: Flags [S], seq 1033458795, win 62727, options [mss 8961,sackOK,TS val 3548059258 ecr 0,nop,wscale 7], length 0
05:09:45.571389 ens5  Out IP 172.31.24.48.39710 > 35.175.195.72.9651: Flags [S], seq 4165819569, win 62727, options [mss 8961,sackOK,TS val 1742751694 ecr 0,nop,wscale 7], length 0
05:09:45.571391 ens5  Out IP 172.31.24.48.34858 > 54.198.126.194.9651: Flags [S], seq 2989608897, win 62727, options [mss 8961,sackOK,TS val 2097485380 ecr 0,nop,wscale 7], length 0
05:09:45.571393 ens5  Out IP 172.31.24.48.46104 > 34.229.171.184.9651: Flags [S], seq 1415683296, win 62727, options [mss 8961,sackOK,TS val 2647761300 ecr 0,nop,wscale 7], length 0
05:09:45.571395 ens5  Out IP 172.31.24.48.33138 > 54.87.77.58.9651: Flags [S], seq 2249441293, win 62727, options [mss 8961,sackOK,TS val 256414704 ecr 0,nop,wscale 7], length 0
05:09:45.571395 ens5  Out IP 172.31.24.48.48788 > 54.242.159.101.9651: Flags [S], seq 2273889666, win 62727, options [mss 8961,sackOK,TS val 3502795920 ecr 0,nop,wscale 7], length 0
05:09:45.571397 ens5  Out IP 172.31.24.48.35722 > 52.201.248.173.9651: Flags [S], seq 2998822149, win 62727, options [mss 8961,sackOK,TS val 1603196984 ecr 0,nop,wscale 7], length 0
05:09:45.571399 ens5  Out IP 172.31.24.48.46600 > 98.81.86.168.9651: Flags [S], seq 2197557432, win 62727, options [mss 8961,sackOK,TS val 4000903275 ecr 0,nop,wscale 7], length 0
05:09:45.571399 ens5  Out IP 172.31.24.48.56088 > 3.90.221.85.9651: Flags [S], seq 2817675718, win 62727, options [mss 8961,sackOK,TS val 3381847282 ecr 0,nop,wscale 7], length 0
05:09:45.571401 ens5  Out IP 172.31.24.48.42442 > 3.90.104.106.9651: Flags [S], seq 1851506523, win 62727, options [mss 8961,sackOK,TS val 2594460164 ecr 0,nop,wscale 7], length 0
05:09:45.571403 ens5  Out IP 172.31.24.48.40200 > 3.80.154.255.9651: Flags [S], seq 2770956832, win 62727, options [mss 8961,sackOK,TS val 1359588743 ecr 0,nop,wscale 7], length 0
05:09:45.571404 ens5  Out IP 172.31.24.48.52446 > 3.87.158.142.9651: Flags [S], seq 2644443939, win 62727, options [mss 8961,sackOK,TS val 4080302106 ecr 0,nop,wscale 7], length 0
05:09:45.571406 ens5  Out IP 172.31.24.48.35992 > 54.157.16.159.9651: Flags [S], seq 3473142108, win 62727, options [mss 8961,sackOK,TS val 3070927482 ecr 0,nop,wscale 7], length 0
05:09:45.571408 ens5  Out IP 172.31.24.48.41726 > 54.221.69.39.9651: Flags [S], seq 4251138672, win 62727, options [mss 8961,sackOK,TS val 2602487803 ecr 0,nop,wscale 7], length 0
05:09:45.571409 ens5  Out IP 172.31.24.48.58242 > 54.221.172.83.9651: Flags [S], seq 18473667, win 62727, options [mss 8961,sackOK,TS val 3103785538 ecr 0,nop,wscale 7], length 0
05:09:45.571411 ens5  Out IP 172.31.24.48.33834 > 54.237.32.172.9651: Flags [S], seq 2146866766, win 62727, options [mss 8961,sackOK,TS val 4265086331 ecr 0,nop,wscale 7], length 0
05:09:45.571413 ens5  Out IP 172.31.24.48.39860 > 54.163.45.115.9651: Flags [S], seq 4060701244, win 62727, options [mss 8961,sackOK,TS val 1763224329 ecr 0,nop,wscale 7], length 0
05:09:45.571413 ens5  Out IP 172.31.24.48.36220 > 204.236.209.96.9651: Flags [S], seq 3023310102, win 62727, options [mss 8961,sackOK,TS val 2442684044 ecr 0,nop,wscale 7], length 0
05:09:45.571415 ens5  Out IP 172.31.24.48.48326 > 52.23.172.153.9651: Flags [S], seq 1176149055, win 62727, options [mss 8961,sackOK,TS val 1308340385 ecr 0,nop,wscale 7], length 0
05:09:45.571417 ens5  Out IP 172.31.24.48.47270 > 34.230.11.118.9651: Flags [S], seq 4174152088, win 62727, options [mss 8961,sackOK,TS val 291210706 ecr 0,nop,wscale 7], length 0
05:09:45.571418 ens5  Out IP 172.31.24.48.41814 > 34.230.5.22.9651: Flags [S], seq 3195136165, win 62727, options [mss 8961,sackOK,TS val 2906176160 ecr 0,nop,wscale 7], length 0
05:09:45.571420 ens5  Out IP 172.31.24.48.37442 > 3.82.24.77.9651: Flags [S], seq 1625994698, win 62727, options [mss 8961,sackOK,TS val 2161594997 ecr 0,nop,wscale 7], length 0
05:09:45.571421 ens5  Out IP 172.31.24.48.36334 > 54.160.143.105.9651: Flags [S], seq 3333616015, win 62727, options [mss 8961,sackOK,TS val 1329706972 ecr 0,nop,wscale 7], length 0
05:09:45.571422 ens5  Out IP 172.31.24.48.44010 > 18.215.143.87.9651: Flags [S], seq 2767568017, win 62727, options [mss 8961,sackOK,TS val 503286978 ecr 0,nop,wscale 7], length 0
05:09:45.571427 ens5  Out IP 172.31.24.48.55152 > 54.173.66.105.9651: Flags [S], seq 1499624154, win 62727, options [mss 8961,sackOK,TS val 1450910819 ecr 0,nop,wscale 7], length 0
05:09:45.571430 ens5  Out IP 172.31.24.48.34084 > 54.80.191.177.9651: Flags [S], seq 3004831715, win 62727, options [mss 8961,sackOK,TS val 1116855017 ecr 0,nop,wscale 7], length 0
05:09:45.571431 ens5  Out IP 172.31.24.48.52876 > 18.208.194.23.9651: Flags [S], seq 3280394659, win 62727, options [mss 8961,sackOK,TS val 4205833061 ecr 0,nop,wscale 7], length 0
05:09:45.571432 ens5  Out IP 172.31.24.48.51334 > 35.174.15.171.9651: Flags [S], seq 709196861, win 62727, options [mss 8961,sackOK,TS val 350704966 ecr 0,nop,wscale 7], length 0
05:09:45.571435 ens5  Out IP 172.31.24.48.44790 > 54.226.181.43.9651: Flags [S], seq 4226821901, win 62727, options [mss 8961,sackOK,TS val 3368057382 ecr 0,nop,wscale 7], length 0
05:09:45.571438 ens5  Out IP 172.31.24.48.58964 > 54.210.155.46.9651: Flags [S], seq 4202053777, win 62727, options [mss 8961,sackOK,TS val 2138049688 ecr 0,nop,wscale 7], length 0
05:09:45.571439 ens5  Out IP 172.31.24.48.45914 > 34.224.26.52.9651: Flags [S], seq 2709390557, win 62727, options [mss 8961,sackOK,TS val 3158395322 ecr 0,nop,wscale 7], length 0
05:09:45.571439 ens5  Out IP 172.31.24.48.48226 > 3.89.29.153.9651: Flags [S], seq 4223353780, win 62727, options [mss 8961,sackOK,TS val 2228813404 ecr 0,nop,wscale 7], length 0
05:09:45.571443 ens5  Out IP 172.31.24.48.56468 > 3.91.255.179.9651: Flags [S], seq 2252939047, win 62727, options [mss 8961,sackOK,TS val 1206161995 ecr 0,nop,wscale 7], length 0
05:09:45.571438 ens5  Out IP 172.31.24.48.49350 > 54.172.169.61.9651: Flags [S], seq 2510225617, win 62727, options [mss 8961,sackOK,TS val 970567265 ecr 0,nop,wscale 7], length 0
05:09:45.571446 ens5  Out IP 172.31.24.48.43892 > 54.90.128.202.9651: Flags [S], seq 1450618282, win 62727, options [mss 8961,sackOK,TS val 3739595765 ecr 0,nop,wscale 7], length 0
05:09:45.571446 ens5  Out IP 172.31.24.48.34224 > 100.27.214.253.9651: Flags [S], seq 68614327, win 62727, options [mss 8961,sackOK,TS val 1521145162 ecr 0,nop,wscale 7], length 0
05:09:45.571448 ens5  Out IP 172.31.24.48.55566 > 54.147.21.122.9651: Flags [S], seq 3781813114, win 62727, options [mss 8961,sackOK,TS val 1564943320 ecr 0,nop,wscale 7], length 0
05:09:45.571450 ens5  Out IP 172.31.24.48.55792 > 98.84.132.90.9651: Flags [S], seq 791694598, win 62727, options [mss 8961,sackOK,TS val 432095748 ecr 0,nop,wscale 7], length 0
05:09:45.571451 ens5  Out IP 172.31.24.48.44614 > 54.196.131.164.9651: Flags [S], seq 1723328408, win 62727, options [mss 8961,sackOK,TS val 2592579626 ecr 0,nop,wscale 7], length 0
05:09:45.571452 ens5  Out IP 172.31.24.48.44142 > 34.203.240.48.9651: Flags [S], seq 2661968824, win 62727, options [mss 8961,sackOK,TS val 1631362103 ecr 0,nop,wscale 7], length 0
05:09:45.571454 ens5  Out IP 172.31.24.48.49264 > 54.161.3.14.9651: Flags [S], seq 3380350644, win 62727, options [mss 8961,sackOK,TS val 4096837798 ecr 0,nop,wscale 7], length 0
05:09:45.571455 ens5  Out IP 172.31.24.48.50348 > 34.236.152.163.9651: Flags [S], seq 4102515258, win 62727, options [mss 8961,sackOK,TS val 1152590833 ecr 0,nop,wscale 7], length 0
05:09:45.571457 ens5  Out IP 172.31.24.48.52994 > 54.221.187.97.9651: Flags [S], seq 1213127910, win 62727, options [mss 8961,sackOK,TS val 3721345849 ecr 0,nop,wscale 7], length 0
05:09:45.571460 ens5  Out IP 172.31.24.48.37402 > 54.234.230.97.9651: Flags [S], seq 2524405370, win 62727, options [mss 8961,sackOK,TS val 454197810 ecr 0,nop,wscale 7], length 0
05:09:45.571460 ens5  Out IP 172.31.24.48.40204 > 18.207.128.162.9651: Flags [S], seq 432294580, win 62727, options [mss 8961,sackOK,TS val 4095853340 ecr 0,nop,wscale 7], length 0
05:09:45.571465 ens5  Out IP 172.31.24.48.60094 > 18.215.156.233.9651: Flags [S], seq 3817343734, win 62727, options [mss 8961,sackOK,TS val 1235091861 ecr 0,nop,wscale 7], length 0
05:09:45.571468 ens5  Out IP 172.31.24.48.58872 > 54.234.119.150.9651: Flags [S], seq 2553933892, win 62727, options [mss 8961,sackOK,TS val 3590948077 ecr 0,nop,wscale 7], length 0
05:09:45.572531 ens5  In  IP 34.206.59.82.51592 > 172.31.24.48.9651: Flags [P.], seq 1888164208:1888164738, ack 310528537, win 471, options [nop,nop,TS val 1776914172 ecr 325696685], length 530
05:09:45.572548 ens5  Out IP 172.31.24.48.9651 > 34.206.59.82.51592: Flags [.], ack 530, win 614, options [nop,nop,TS val 325697735 ecr 1776914172], length 0
05:09:45.620926 ens5  In  IP 65.108.122.32.40910 > 172.31.24.48.9651: Flags [P.], seq 358091558:358092071, ack 1502250679, win 574, options [nop,nop,TS val 1218455694 ecr 3574791947], length 513
05:09:45.635369 ens5  Out IP 172.31.24.48.43314 > 3.90.207.111.9651: Flags [S], seq 3985260748, win 62727, options [mss 8961,sackOK,TS val 212865691 ecr 0,nop,wscale 7], length 0
05:09:45.635369 ens5  Out IP 172.31.24.48.41406 > 34.203.223.245.9651: Flags [S], seq 2089806770, win 62727, options [mss 8961,sackOK,TS val 1662402068 ecr 0,nop,wscale 7], length 0
05:09:45.635375 ens5  Out IP 172.31.24.48.34888 > 35.172.181.243.9651: Flags [S], seq 2905933385, win 62727, options [mss 8961,sackOK,TS val 2835241816 ecr 0,nop,wscale 7], length 0
05:09:45.661364 ens5  Out IP 172.31.24.48.9651 > 65.108.122.32.40910: Flags [.], ack 513, win 614, options [nop,nop,TS val 3574802039 ecr 1218455694], length 0
05:09:45.699369 ens5  Out IP 172.31.24.48.43582 > 54.167.7.201.9651: Flags [S], seq 3983247621, win 62727, options [mss 8961,sackOK,TS val 4178928753 ecr 0,nop,wscale 7], length 0
05:09:45.699368 ens5  Out IP 172.31.24.48.57420 > 18.215.176.28.9651: Flags [S], seq 937031023, win 62727, options [mss 8961,sackOK,TS val 985635425 ecr 0,nop,wscale 7], length 0
05:09:45.699373 ens5  Out IP 172.31.24.48.34608 > 54.163.196.28.9651: Flags [S], seq 1668130423, win 62727, options [mss 8961,sackOK,TS val 3531005010 ecr 0,nop,wscale 7], length 0
05:09:45.763368 ens5  Out IP 172.31.24.48.45458 > 98.81.215.25.9651: Flags [S], seq 1907342853, win 62727, options [mss 8961,sackOK,TS val 3969578030 ecr 0,nop,wscale 7], length 0
05:09:45.763370 ens5  Out IP 172.31.24.48.37554 > 54.86.101.46.9651: Flags [S], seq 3302511868, win 62727, options [mss 8961,sackOK,TS val 3435873655 ecr 0,nop,wscale 7], length 0
05:09:45.763377 ens5  Out IP 172.31.24.48.35930 > 54.87.63.62.9651: Flags [S], seq 1886980464, win 62727, options [mss 8961,sackOK,TS val 3511819515 ecr 0,nop,wscale 7], length 0
05:09:45.786103 ens5  In  IP 54.197.55.84.9651 > 172.31.24.48.35284: Flags [P.], seq 889358531:889364265, ack 1678124396, win 442, options [nop,nop,TS val 425525299 ecr 1367383419], length 5734
05:09:45.786131 ens5  Out IP 172.31.24.48.35284 > 54.197.55.84.9651: Flags [.], ack 5734, win 602, options [nop,nop,TS val 1367384682 ecr 425525299], length 0
05:09:45.827366 ens5  Out IP 172.31.24.48.49632 > 3.91.33.2.9651: Flags [S], seq 4235103269, win 62727, options [mss 8961,sackOK,TS val 2103901209 ecr 0,nop,wscale 7], length 0
05:09:45.827366 ens5  Out IP 172.31.24.48.45788 > 35.174.7.108.9651: Flags [S], seq 3754590125, win 62727, options [mss 8961,sackOK,TS val 2525268820 ecr 0,nop,wscale 7], length 0
05:09:45.827366 ens5  Out IP 172.31.24.48.60140 > 18.204.226.135.9651: Flags [S], seq 3300192940, win 62727, options [mss 8961,sackOK,TS val 274356907 ecr 0,nop,wscale 7], length 0
05:09:45.827375 ens5  Out IP 172.31.24.48.40308 > 54.224.175.1.9651: Flags [S], seq 3483708900, win 62727, options [mss 8961,sackOK,TS val 3454330961 ecr 0,nop,wscale 7], length 0
05:09:45.891364 ens5  Out IP 172.31.24.48.55190 > 54.209.249.221.9651: Flags [S], seq 3131164244, win 62727, options [mss 8961,sackOK,TS val 1544077870 ecr 0,nop,wscale 7], length 0
05:09:45.891365 ens5  Out IP 172.31.24.48.36978 > 52.90.236.235.9651: Flags [S], seq 2958107433, win 62727, options [mss 8961,sackOK,TS val 545461343 ecr 0,nop,wscale 7], length 0
05:09:45.891365 ens5  Out IP 172.31.24.48.35384 > 23.20.191.128.9651: Flags [S], seq 3824417686, win 62727, options [mss 8961,sackOK,TS val 3122503654 ecr 0,nop,wscale 7], length 0
05:09:45.919025 ens5  In  IP 54.225.236.76.40132 > 172.31.24.48.9651: Flags [P.], seq 3378172773:3378172883, ack 779245041, win 443, options [nop,nop,TS val 3278154770 ecr 1030038768], length 110
05:09:45.919045 ens5  Out IP 172.31.24.48.9651 > 54.225.236.76.40132: Flags [.], ack 110, win 614, options [nop,nop,TS val 1030040762 ecr 3278154770], length 0
05:09:45.919217 ens5  In  IP 54.225.236.76.40132 > 172.31.24.48.9651: Flags [P.], seq 110:220, ack 1, win 443, options [nop,nop,TS val 3278154770 ecr 1030038768], length 110
05:09:45.919223 ens5  Out IP 172.31.24.48.9651 > 54.225.236.76.40132: Flags [.], ack 220, win 614, options [nop,nop,TS val 1030040762 ecr 3278154770], length 0
05:09:45.923909 ens5  In  IP 98.82.251.216.57246 > 172.31.24.48.9651: Flags [P.], seq 82219261:82219372, ack 3216779573, win 443, options [nop,nop,TS val 2429135693 ecr 1484861782], length 111
05:09:45.923923 ens5  Out IP 172.31.24.48.9651 > 98.82.251.216.57246: Flags [.], ack 111, win 604, options [nop,nop,TS val 1484863183 ecr 2429135693], length 0
05:09:45.924900 ens5  In  IP 18.206.17.246.9651 > 172.31.24.48.60676: Flags [P.], seq 8659584:8659695, ack 1741478242, win 442, options [nop,nop,TS val 544189811 ecr 1591368913], length 111
05:09:45.924918 ens5  Out IP 172.31.24.48.60676 > 18.206.17.246.9651: Flags [.], ack 111, win 634, options [nop,nop,TS val 1591370315 ecr 544189811], length 0
05:09:45.925218 ens5  In  IP 54.225.236.76.40132 > 172.31.24.48.9651: Flags [P.], seq 220:330, ack 1, win 443, options [nop,nop,TS val 3278154776 ecr 1030040762], length 110
05:09:45.925225 ens5  Out IP 172.31.24.48.9651 > 54.225.236.76.40132: Flags [.], ack 330, win 614, options [nop,nop,TS val 1030040768 ecr 3278154776], length 0
05:09:45.926516 ens5  In  IP 3.227.69.165.9651 > 172.31.24.48.58596: Flags [P.], seq 9577:9688, ack 1, win 442, options [nop,nop,TS val 213040415 ecr 1638967193], length 111
05:09:45.926526 ens5  Out IP 172.31.24.48.58596 > 3.227.69.165.9651: Flags [.], ack 9688, win 674, options [nop,nop,TS val 1638968389 ecr 213040415], length 0
05:09:45.932753 ens5  In  IP 18.235.227.173.55446 > 172.31.24.48.9651: Flags [P.], seq 2757304215:2757304325, ack 1022421518, win 443, options [nop,nop,TS val 3205976710 ecr 1277951259], length 110
05:09:45.932767 ens5  Out IP 172.31.24.48.9651 > 18.235.227.173.55446: Flags [.], ack 110, win 614, options [nop,nop,TS val 1277953260 ecr 3205976710], length 0
05:09:45.936561 ens5  In  IP 18.207.171.20.9651 > 172.31.24.48.34372: Flags [P.], seq 2070959218:2070959329, ack 4175764815, win 442, options [nop,nop,TS val 2053963300 ecr 3188500375], length 111
05:09:45.936573 ens5  Out IP 172.31.24.48.34372 > 18.207.171.20.9651: Flags [.], ack 111, win 623, options [nop,nop,TS val 3188501789 ecr 2053963300], length 0
05:09:45.936773 ens5  In  IP 18.207.171.20.9651 > 172.31.24.48.34372: Flags [P.], seq 111:222, ack 1, win 442, options [nop,nop,TS val 2053963300 ecr 3188500375], length 111
05:09:45.936778 ens5  Out IP 172.31.24.48.34372 > 18.207.171.20.9651: Flags [.], ack 222, win 623, options [nop,nop,TS val 3188501789 ecr 2053963300], length 0
05:09:45.937486 ens5  In  IP 34.197.125.83.9651 > 172.31.24.48.49896: Flags [P.], seq 2122520577:2122520688, ack 1996429844, win 442, options [nop,nop,TS val 3548227592 ecr 2656346123], length 111
05:09:45.937497 ens5  Out IP 172.31.24.48.49896 > 34.197.125.83.9651: Flags [.], ack 111, win 633, options [nop,nop,TS val 2656348124 ecr 3548227592], length 0
05:09:45.937577 ens5  In  IP 107.23.180.98.59190 > 172.31.24.48.9651: Flags [P.], seq 2605119777:2605119887, ack 860498317, win 443, options [nop,nop,TS val 506928629 ecr 1540686924], length 110
05:09:45.937589 ens5  Out IP 172.31.24.48.9651 > 107.23.180.98.59190: Flags [.], ack 110, win 614, options [nop,nop,TS val 1540688918 ecr 506928629], length 0
05:09:45.937629 ens5  In  IP 34.197.125.83.9651 > 172.31.24.48.49896: Flags [P.], seq 111:222, ack 1, win 442, options [nop,nop,TS val 3548227592 ecr 2656346123], length 111
05:09:45.937637 ens5  Out IP 172.31.24.48.49896 > 34.197.125.83.9651: Flags [.], ack 222, win 633, options [nop,nop,TS val 2656348124 ecr 3548227592], length 0
05:09:45.938145 ens5  In  IP 98.83.188.107.52904 > 172.31.24.48.9651: Flags [P.], seq 2246657659:2246657770, ack 943181687, win 443, options [nop,nop,TS val 158790532 ecr 3354270138], length 111
05:09:45.938152 ens5  Out IP 172.31.24.48.9651 > 98.83.188.107.52904: Flags [.], ack 111, win 604, options [nop,nop,TS val 3354272132 ecr 158790532], length 0
05:09:45.938423 ens5  In  IP 34.205.163.144.33606 > 172.31.24.48.9651: Flags [P.], seq 2564388364:2564388475, ack 348215287, win 443, options [nop,nop,TS val 611100331 ecr 1500462490], length 111
05:09:45.938432 ens5  Out IP 172.31.24.48.9651 > 34.205.163.144.33606: Flags [.], ack 111, win 604, options [nop,nop,TS val 1500464484 ecr 611100331], length 0
05:09:45.939269 ens5  In  IP 35.169.66.196.36316 > 172.31.24.48.9651: Flags [P.], seq 600629697:600629808, ack 2281382010, win 443, options [nop,nop,TS val 3700557118 ecr 3522195218], length 111
05:09:45.939269 ens5  In  IP 54.86.40.233.55752 > 172.31.24.48.9651: Flags [P.], seq 410032107:410032218, ack 1092440332, win 443, options [nop,nop,TS val 1470722227 ecr 2948770162], length 111
05:09:45.939279 ens5  Out IP 172.31.24.48.9651 > 35.169.66.196.36316: Flags [.], ack 111, win 613, options [nop,nop,TS val 3522197219 ecr 3700557118], length 0
05:09:45.939284 ens5  Out IP 172.31.24.48.9651 > 54.86.40.233.55752: Flags [.], ack 111, win 612, options [nop,nop,TS val 2948771864 ecr 1470722227], length 0
05:09:45.939287 ens5  In  IP 18.235.227.173.55446 > 172.31.24.48.9651: Flags [P.], seq 110:220, ack 1, win 443, options [nop,nop,TS val 3205976716 ecr 1277953260], length 110
05:09:45.939294 ens5  Out IP 172.31.24.48.9651 > 18.235.227.173.55446: Flags [.], ack 220, win 614, options [nop,nop,TS val 1277953266 ecr 3205976716], length 0
05:09:45.939769 ens5  In  IP 18.235.227.173.55446 > 172.31.24.48.9651: Flags [P.], seq 220:330, ack 1, win 443, options [nop,nop,TS val 3205976717 ecr 1277953266], length 110
05:09:45.939778 ens5  Out IP 172.31.24.48.9651 > 18.235.227.173.55446: Flags [.], ack 330, win 614, options [nop,nop,TS val 1277953267 ecr 3205976717], length 0
05:09:45.944365 ens5  In  IP 18.233.204.144.40720 > 172.31.24.48.9651: Flags [P.], seq 1729415007:1729415118, ack 3879575786, win 443, options [nop,nop,TS val 2689253133 ecr 2280649596], length 111
05:09:45.944375 ens5  Out IP 172.31.24.48.9651 > 18.233.204.144.40720: Flags [.], ack 111, win 610, options [nop,nop,TS val 2280651598 ecr 2689253133], length 0
05:09:45.944475 ens5  In  IP 107.23.180.98.59190 > 172.31.24.48.9651: Flags [P.], seq 110:220, ack 1, win 443, options [nop,nop,TS val 506928636 ecr 1540688918], length 110
05:09:45.944479 ens5  Out IP 172.31.24.48.9651 > 107.23.180.98.59190: Flags [.], ack 220, win 614, options [nop,nop,TS val 1540688925 ecr 506928636], length 0
05:09:45.944573 ens5  In  IP 107.20.201.207.41162 > 172.31.24.48.9651: Flags [P.], seq 3329500680:3329500791, ack 845794842, win 443, options [nop,nop,TS val 1247808961 ecr 2353572173], length 111
05:09:45.944583 ens5  Out IP 172.31.24.48.9651 > 107.20.201.207.41162: Flags [.], ack 111, win 616, options [nop,nop,TS val 2353573595 ecr 1247808961], length 0
05:09:45.944708 ens5  In  IP 18.233.204.144.40720 > 172.31.24.48.9651: Flags [P.], seq 111:222, ack 1, win 443, options [nop,nop,TS val 2689253134 ecr 2280651598], length 111
05:09:45.944713 ens5  Out IP 172.31.24.48.9651 > 18.233.204.144.40720: Flags [.], ack 222, win 610, options [nop,nop,TS val 2280651598 ecr 2689253134], length 0
05:09:45.945204 ens5  In  IP 3.228.129.216.9651 > 172.31.24.48.52970: Flags [P.], seq 204001154:204001265, ack 2968454727, win 442, options [nop,nop,TS val 1816767390 ecr 1643745494], length 111
05:09:45.945213 ens5  Out IP 172.31.24.48.52970 > 3.228.129.216.9651: Flags [.], ack 111, win 634, options [nop,nop,TS val 1643747502 ecr 1816767390], length 0
05:09:45.945454 ens5  In  IP 3.228.129.216.9651 > 172.31.24.48.52970: Flags [P.], seq 111:222, ack 1, win 442, options [nop,nop,TS val 1816767390 ecr 1643745494], length 111
05:09:45.945460 ens5  Out IP 172.31.24.48.52970 > 3.228.129.216.9651: Flags [.], ack 222, win 634, options [nop,nop,TS val 1643747503 ecr 1816767390], length 0
05:09:45.945760 ens5  In  IP 35.169.66.196.36316 > 172.31.24.48.9651: Flags [P.], seq 111:222, ack 1, win 443, options [nop,nop,TS val 3700557125 ecr 3522197219], length 111
05:09:45.945768 ens5  Out IP 172.31.24.48.9651 > 35.169.66.196.36316: Flags [.], ack 222, win 613, options [nop,nop,TS val 3522197226 ecr 3700557125], length 0
05:09:45.946031 ens5  In  IP 107.23.226.228.55738 > 172.31.24.48.9651: Flags [P.], seq 2329016079:2329016190, ack 1677593463, win 443, options [nop,nop,TS val 3865130194 ecr 3099386359], length 111
05:09:45.946032 ens5  In  IP 107.23.226.228.55738 > 172.31.24.48.9651: Flags [P.], seq 111:222, ack 1, win 443, options [nop,nop,TS val 3865130194 ecr 3099386359], length 111
05:09:45.946032 ens5  In  IP 23.21.27.140.34406 > 172.31.24.48.9651: Flags [P.], seq 3341281843:3341281954, ack 3003772, win 443, options [nop,nop,TS val 3804672870 ecr 4163317228], length 111
05:09:45.946032 ens5  In  IP 35.169.66.196.36316 > 172.31.24.48.9651: Flags [P.], seq 222:333, ack 1, win 443, options [nop,nop,TS val 3700557125 ecr 3522197219], length 111
05:09:45.946042 ens5  Out IP 172.31.24.48.9651 > 107.23.226.228.55738: Flags [.], ack 111, win 604, options [nop,nop,TS val 3099388360 ecr 3865130194], length 0
05:09:45.946045 ens5  Out IP 172.31.24.48.9651 > 107.23.226.228.55738: Flags [.], ack 222, win 604, options [nop,nop,TS val 3099388360 ecr 3865130194], length 0
05:09:45.946050 ens5  Out IP 172.31.24.48.9651 > 23.21.27.140.34406: Flags [.], ack 111, win 604, options [nop,nop,TS val 4163319257 ecr 3804672870], length 0
05:09:45.946054 ens5  Out IP 172.31.24.48.9651 > 35.169.66.196.36316: Flags [.], ack 333, win 613, options [nop,nop,TS val 3522197226 ecr 3700557125], length 0
05:09:45.947191 ens5  In  IP 52.200.197.163.50754 > 172.31.24.48.9651: Flags [P.], seq 2026900573:2026900684, ack 955119817, win 443, options [nop,nop,TS val 1611275919 ecr 1991454625], length 111
05:09:45.947201 ens5  Out IP 172.31.24.48.9651 > 52.200.197.163.50754: Flags [.], ack 111, win 604, options [nop,nop,TS val 1991456046 ecr 1611275919], length 0
05:09:45.949180 ens5  In  IP 23.22.195.89.45882 > 172.31.24.48.9651: Flags [P.], seq 513:624, ack 1, win 443, options [nop,nop,TS val 3078060525 ecr 2111147302], length 111
05:09:45.949191 ens5  Out IP 172.31.24.48.9651 > 23.22.195.89.45882: Flags [.], ack 624, win 614, options [nop,nop,TS val 2111148065 ecr 3078060525], length 0
05:09:45.951115 ens5  In  IP 18.235.252.133.54112 > 172.31.24.48.9651: Flags [P.], seq 288329190:288329301, ack 177893015, win 443, options [nop,nop,TS val 235306549 ecr 170727519], length 111
05:09:45.951124 ens5  Out IP 172.31.24.48.9651 > 18.235.252.133.54112: Flags [.], ack 111, win 613, options [nop,nop,TS val 170729519 ecr 235306549], length 0
05:09:45.951343 ens5  In  IP 18.215.11.46.9651 > 172.31.24.48.54896: Flags [P.], seq 2305565979:2305566090, ack 53559634, win 442, options [nop,nop,TS val 2186958313 ecr 3087703476], length 111
05:09:45.951352 ens5  Out IP 172.31.24.48.54896 > 18.215.11.46.9651: Flags [.], ack 111, win 634, options [nop,nop,TS val 3087705476 ecr 2186958313], length 0
05:09:45.951569 ens5  In  IP 54.197.102.41.56702 > 172.31.24.48.9651: Flags [P.], seq 4272005251:4272005361, ack 3477734072, win 443, options [nop,nop,TS val 4264343183 ecr 1551853429], length 110
05:09:45.951577 ens5  Out IP 172.31.24.48.9651 > 54.197.102.41.56702: Flags [.], ack 110, win 616, options [nop,nop,TS val 1551855216 ecr 4264343183], length 0
05:09:45.952276 ens5  In  IP 34.206.59.82.51592 > 172.31.24.48.9651: Flags [P.], seq 530:641, ack 1, win 471, options [nop,nop,TS val 1776914551 ecr 325697735], length 111
05:09:45.952285 ens5  Out IP 172.31.24.48.9651 > 34.206.59.82.51592: Flags [.], ack 641, win 614, options [nop,nop,TS val 325698114 ecr 1776914551], length 0
05:09:45.952464 ens5  In  IP 52.71.181.255.9651 > 172.31.24.48.51004: Flags [P.], seq 3965252475:3965252586, ack 1243829789, win 442, options [nop,nop,TS val 3255529060 ecr 2846275816], length 111
05:09:45.952473 ens5  Out IP 172.31.24.48.51004 > 52.71.181.255.9651: Flags [.], ack 111, win 636, options [nop,nop,TS val 2846277816 ecr 3255529060], length 0
05:09:45.952724 ens5  In  IP 52.71.181.255.9651 > 172.31.24.48.51004: Flags [P.], seq 111:222, ack 1, win 442, options [nop,nop,TS val 3255529060 ecr 2846275816], length 111
05:09:45.952731 ens5  Out IP 172.31.24.48.51004 > 52.71.181.255.9651: Flags [.], ack 222, win 636, options [nop,nop,TS val 2846277816 ecr 3255529060], length 0
05:09:45.953112 ens5  In  IP 3.218.45.144.58424 > 172.31.24.48.9651: Flags [P.], seq 684584166:684584277, ack 3652899496, win 443, options [nop,nop,TS val 3318425496 ecr 1787413795], length 111
05:09:45.953120 ens5  Out IP 172.31.24.48.9651 > 3.218.45.144.58424: Flags [.], ack 111, win 614, options [nop,nop,TS val 1787415788 ecr 3318425496], length 0
05:09:45.953920 ens5  In  IP 34.234.4.103.59458 > 172.31.24.48.9651: Flags [P.], seq 1739567348:1739567459, ack 1031694179, win 443, options [nop,nop,TS val 2655219133 ecr 1176710678], length 111
05:09:45.953925 ens5  Out IP 172.31.24.48.9651 > 34.234.4.103.59458: Flags [.], ack 111, win 613, options [nop,nop,TS val 1176712686 ecr 2655219133], length 0
05:09:45.954476 ens5  In  IP 18.207.74.220.53056 > 172.31.24.48.9651: Flags [P.], seq 930592141:930592252, ack 2860990878, win 443, options [nop,nop,TS val 2726487206 ecr 677811318], length 111
05:09:45.954484 ens5  Out IP 172.31.24.48.9651 > 18.207.74.220.53056: Flags [.], ack 111, win 604, options [nop,nop,TS val 677813319 ecr 2726487206], length 0
05:09:45.955362 ens5  Out IP 172.31.24.48.57220 > 54.167.30.131.9651: Flags [S], seq 3038842274, win 62727, options [mss 8961,sackOK,TS val 2432085624 ecr 0,nop,wscale 7], length 0
05:09:45.955362 ens5  Out IP 172.31.24.48.50810 > 3.90.56.127.9651: Flags [S], seq 2729001419, win 62727, options [mss 8961,sackOK,TS val 1230312275 ecr 0,nop,wscale 7], length 0
05:09:45.955365 ens5  Out IP 172.31.24.48.47378 > 3.88.14.60.9651: Flags [S], seq 1350702603, win 62727, options [mss 8961,sackOK,TS val 2900891370 ecr 0,nop,wscale 7], length 0
05:09:45.955973 ens5  In  IP 54.174.93.130.9651 > 172.31.24.48.38730: Flags [P.], seq 2578714604:2578714715, ack 692167720, win 442, options [nop,nop,TS val 1726700764 ecr 3231171106], length 111
05:09:45.955983 ens5  Out IP 172.31.24.48.38730 > 54.174.93.130.9651: Flags [.], ack 111, win 634, options [nop,nop,TS val 3231172911 ecr 1726700764], length 0
05:09:45.956187 ens5  In  IP 54.174.93.130.9651 > 172.31.24.48.38730: Flags [P.], seq 111:222, ack 1, win 442, options [nop,nop,TS val 1726700765 ecr 3231171106], length 111
05:09:45.956193 ens5  Out IP 172.31.24.48.38730 > 54.174.93.130.9651: Flags [.], ack 222, win 634, options [nop,nop,TS val 3231172911 ecr 1726700765], length 0
05:09:45.956660 ens5  In  IP 3.230.225.34.9651 > 172.31.24.48.52272: Flags [P.], seq 111:624, ack 1, win 442, options [nop,nop,TS val 2259381840 ecr 1239841917], length 513
05:09:45.956671 ens5  Out IP 172.31.24.48.52272 > 3.230.225.34.9651: Flags [.], ack 624, win 634, options [nop,nop,TS val 1239843273 ecr 2259381840], length 0
05:09:45.957870 ens5  In  IP 54.236.131.114.45150 > 172.31.24.48.9651: Flags [P.], seq 3686050336:3686050447, ack 1389367503, win 443, options [nop,nop,TS val 1607762160 ecr 2357155399], length 111
05:09:45.957870 ens5  In  IP 3.230.225.34.9651 > 172.31.24.48.52272: Flags [P.], seq 624:7864, ack 1, win 442, options [nop,nop,TS val 2259381841 ecr 1239843273], length 7240
05:09:45.957883 ens5  Out IP 172.31.24.48.9651 > 54.236.131.114.45150: Flags [.], ack 111, win 616, options [nop,nop,TS val 2357157406 ecr 1607762160], length 0
05:09:45.957888 ens5  Out IP 172.31.24.48.52272 > 3.230.225.34.9651: Flags [.], ack 7864, win 592, options [nop,nop,TS val 1239843274 ecr 2259381841], length 0
05:09:45.957932 ens5  In  IP 3.230.225.34.9651 > 172.31.24.48.52272: Flags [P.], seq 7864:8838, ack 1, win 442, options [nop,nop,TS val 2259381841 ecr 1239843273], length 974
05:09:45.957932 ens5  In  IP 3.230.225.34.9651 > 172.31.24.48.52272: Flags [P.], seq 8838:14630, ack 1, win 442, options [nop,nop,TS val 2259381841 ecr 1239843273], length 5792
05:09:45.957941 ens5  Out IP 172.31.24.48.52272 > 3.230.225.34.9651: Flags [.], ack 8838, win 632, options [nop,nop,TS val 1239843274 ecr 2259381841], length 0
05:09:45.957945 ens5  Out IP 172.31.24.48.52272 > 3.230.225.34.9651: Flags [.], ack 14630, win 595, options [nop,nop,TS val 1239843274 ecr 2259381841], length 0
05:09:45.958177 ens5  In  IP 3.230.225.34.9651 > 172.31.24.48.52272: Flags [P.], seq 14630:23703, ack 1, win 442, options [nop,nop,TS val 2259381841 ecr 1239843274], length 9073
05:09:45.958186 ens5  Out IP 172.31.24.48.52272 > 3.230.225.34.9651: Flags [.], ack 23703, win 579, options [nop,nop,TS val 1239843274 ecr 2259381841], length 0
05:09:45.958500 ens5  Out IP 172.31.24.48.52272 > 3.230.225.34.9651: Flags [P.], seq 1:72, ack 23703, win 636, options [nop,nop,TS val 1239843275 ecr 2259381841], length 71
05:09:45.958963 ens5  In  IP 52.3.189.202.9651 > 172.31.24.48.51140: Flags [P.], seq 2225259002:2225259113, ack 3364261490, win 442, options [nop,nop,TS val 2013789084 ecr 3022153556], length 111
05:09:45.958973 ens5  Out IP 172.31.24.48.51140 > 52.3.189.202.9651: Flags [.], ack 111, win 623, options [nop,nop,TS val 3022155549 ecr 2013789084], length 0
05:09:45.959127 ens5  In  IP 34.197.104.250.9651 > 172.31.24.48.56916: Flags [P.], seq 694218225:694218336, ack 567713983, win 442, options [nop,nop,TS val 1197011002 ecr 1476741243], length 111
05:09:45.959134 ens5  Out IP 172.31.24.48.56916 > 34.197.104.250.9651: Flags [.], ack 111, win 634, options [nop,nop,TS val 1476743238 ecr 1197011002], length 0
05:09:45.959290 ens5  In  IP 44.218.214.164.41732 > 172.31.24.48.9651: Flags [P.], seq 3743019647:3743019758, ack 3585163390, win 443, options [nop,nop,TS val 848200937 ecr 669781628], length 111
05:09:45.959301 ens5  Out IP 172.31.24.48.9651 > 44.218.214.164.41732: Flags [.], ack 111, win 604, options [nop,nop,TS val 669783060 ecr 848200937], length 0
05:09:45.959401 ens5  In  IP 34.206.59.82.51592 > 172.31.24.48.9651: Flags [P.], seq 641:752, ack 1, win 471, options [nop,nop,TS val 1776914559 ecr 325698114], length 111
05:09:45.959409 ens5  Out IP 172.31.24.48.9651 > 34.206.59.82.51592: Flags [.], ack 752, win 614, options [nop,nop,TS val 325698122 ecr 1776914559], length 0
05:09:45.960501 ens5  In  IP 107.21.238.130.54072 > 172.31.24.48.9651: Flags [P.], seq 530:641, ack 1, win 630, options [nop,nop,TS val 162459619 ecr 1932033420], length 111
05:09:45.960509 ens5  Out IP 172.31.24.48.9651 > 107.21.238.130.54072: Flags [.], ack 641, win 614, options [nop,nop,TS val 1932034117 ecr 162459619], length 0
05:09:45.960755 ens5  In  IP 34.202.51.225.58710 > 172.31.24.48.9651: Flags [P.], seq 1518467280:1518467391, ack 1861549515, win 471, options [nop,nop,TS val 1096612026 ecr 12642871], length 111
05:09:45.960761 ens5  Out IP 172.31.24.48.9651 > 34.202.51.225.58710: Flags [.], ack 111, win 616, options [nop,nop,TS val 12644310 ecr 1096612026], length 0
05:09:45.960808 ens5  In  IP 54.227.196.194.41606 > 172.31.24.48.9651: Flags [P.], seq 1320627573:1320627684, ack 1155324828, win 443, options [nop,nop,TS val 1303616491 ecr 2720915466], length 111
05:09:45.960812 ens5  Out IP 172.31.24.48.9651 > 54.227.196.194.41606: Flags [.], ack 111, win 612, options [nop,nop,TS val 2720917481 ecr 1303616491], length 0
05:09:45.961011 ens5  In  IP 3.223.220.64.36420 > 172.31.24.48.9651: Flags [P.], seq 1995592221:1995592332, ack 1384162732, win 443, options [nop,nop,TS val 624061721 ecr 3055984739], length 111
05:09:45.961018 ens5  Out IP 172.31.24.48.9651 > 3.223.220.64.36420: Flags [.], ack 111, win 604, options [nop,nop,TS val 3055986739 ecr 624061721], length 0
05:09:45.961284 ens5  In  IP 34.227.72.239.54280 > 172.31.24.48.9651: Flags [P.], seq 3876315540:3876315651, ack 3599977275, win 443, options [nop,nop,TS val 2181728943 ecr 607638629], length 111
05:09:45.961292 ens5  Out IP 172.31.24.48.9651 > 34.227.72.239.54280: Flags [.], ack 111, win 604, options [nop,nop,TS val 607640629 ecr 2181728943], length 0
05:09:45.961512 ens5  In  IP 54.227.196.194.41606 > 172.31.24.48.9651: Flags [P.], seq 111:222, ack 1, win 443, options [nop,nop,TS val 1303616492 ecr 2720917481], length 111
05:09:45.961518 ens5  Out IP 172.31.24.48.9651 > 54.227.196.194.41606: Flags [.], ack 222, win 612, options [nop,nop,TS val 2720917482 ecr 1303616492], length 0
05:09:45.961567 ens5  In  IP 34.227.72.239.54280 > 172.31.24.48.9651: Flags [P.], seq 111:222, ack 1, win 443, options [nop,nop,TS val 2181728943 ecr 607638629], length 111
05:09:45.961573 ens5  Out IP 172.31.24.48.9651 > 34.227.72.239.54280: Flags [.], ack 222, win 604, options [nop,nop,TS val 607640630 ecr 2181728943], length 0
