tcpdump: data link type LINUX_SLL2
tcpdump: verbose output suppressed, use -v[v]... for full protocol decode
listening on any, link-type LINUX_SLL2 (Linux cooked v2), snapshot length 262144 bytes
05:27:22.417057 ens5  In  IP 23.23.81.139.9651 > 172.31.29.29.54662: Flags [P.], seq 957157287:957157398, ack 674145286, win 442, options [nop,nop,TS val 757288080 ecr 1176657331], length 111
05:27:22.417085 ens5  In  IP 165.227.179.96.35002 > 172.31.29.29.9651: Flags [P.], seq 2298427343:2298427480, ack 4013245869, win 2786, options [nop,nop,TS val 2516809398 ecr 1600446559], length 137
05:27:22.417086 ens5  Out IP 172.31.29.29.54662 > 23.23.81.139.9651: Flags [.], ack 111, win 443, options [nop,nop,TS val 1176657338 ecr 757288073], length 0
05:27:22.417144 ens5  In  IP 107.21.238.130.9651 > 172.31.29.29.52988: Flags [P.], seq 15349757:15349868, ack 4169046149, win 660, options [nop,nop,TS val 192308138 ecr 707390833], length 111
05:27:22.417149 ens5  Out IP 172.31.29.29.54662 > 23.23.81.139.9651: Flags [P.], seq 1:138, ack 111, win 443, options [nop,nop,TS val 1176657338 ecr 757288073], length 137
05:27:22.417190 ens5  Out IP 172.31.29.29.52988 > 107.21.238.130.9651: Flags [P.], seq 1:138, ack 111, win 443, options [nop,nop,TS val 707390840 ecr 192308138], length 137
05:27:22.417437 ens5  Out IP 172.31.29.29.9651 > 34.202.51.225.55254: Flags [P.], seq 2999215910:2999216021, ack 574888078, win 442, options [nop,nop,TS val 1061132929 ecr 892857935], length 111
05:27:22.417439 ens5  Out IP 172.31.29.29.9651 > 54.226.62.214.55486: Flags [P.], seq 1647330507:1647330618, ack 7911246, win 442, options [nop,nop,TS val 499423301 ecr 1943625263], length 111
05:27:22.417441 ens5  Out IP 172.31.29.29.9651 > 18.233.204.144.40796: Flags [P.], seq 1265058525:1265058636, ack 624521231, win 442, options [nop,nop,TS val 1391673767 ecr 3045677837], length 111
05:27:22.417451 ens5  Out IP 172.31.29.29.9651 > 34.197.104.250.42168: Flags [P.], seq 480975315:480975426, ack 3604411443, win 442, options [nop,nop,TS val 3294444313 ecr 41224535], length 111
05:27:22.417454 ens5  Out IP 172.31.29.29.9651 > 50.19.151.55.57148: Flags [P.], seq 2860357088:2860357199, ack 394965191, win 442, options [nop,nop,TS val 2511453771 ecr 1968103358], length 111
05:27:22.417456 ens5  Out IP 172.31.29.29.47744 > 34.206.101.137.9651: Flags [P.], seq 256669719:256669830, ack 745850022, win 443, options [nop,nop,TS val 4994534 ecr 1922448616], length 111
05:27:22.417529 ens5  In  IP 3.232.45.182.37336 > 172.31.29.29.9651: Flags [.], ack 932311985, win 2560, options [nop,nop,TS val 814949210 ecr 1292739643], length 0
05:27:22.417549 ens5  In  IP 34.202.51.225.55254 > 172.31.29.29.9651: Flags [.], ack 111, win 443, options [nop,nop,TS val 892857938 ecr 1061132925], length 0
05:27:22.417589 ens5  In  IP 34.203.168.140.53994 > 172.31.29.29.9651: Flags [.], ack 162982120, win 2315, options [nop,nop,TS val 1552758852 ecr 44398091], length 0
05:27:22.417590 ens5  In  IP 34.203.168.140.53994 > 172.31.29.29.9651: Flags [P.], seq 0:137, ack 1, win 2315, options [nop,nop,TS val 1552758852 ecr 44398091], length 137
05:27:22.417623 ens5  In  IP 34.202.51.225.55254 > 172.31.29.29.9651: Flags [P.], seq 1:138, ack 111, win 443, options [nop,nop,TS val 892857938 ecr 1061132925], length 137
05:27:22.417624 ens5  In  IP 50.19.116.199.9651 > 172.31.29.29.48890: Flags [P.], seq 2043081362:2043081473, ack 3987305063, win 442, options [nop,nop,TS val 1474778765 ecr 1773884300], length 111
05:27:22.417624 ens5  In  IP 18.233.204.144.40796 > 172.31.29.29.9651: Flags [P.], seq 1:138, ack 111, win 443, options [nop,nop,TS val 3045677865 ecr 1391673767], length 137
05:27:22.417653 ens5  In  IP 3.232.45.182.37336 > 172.31.29.29.9651: Flags [P.], seq 0:137, ack 1, win 2560, options [nop,nop,TS val 814949210 ecr 1292739643], length 137
05:27:22.417720 ens5  In  IP 52.45.71.227.9651 > 172.31.29.29.56906: Flags [P.], seq 2616097589:2616097726, ack 789306379, win 4410, options [nop,nop,TS val 3085030898 ecr 676040741], length 137
05:27:22.417740 ens5  In  IP 98.82.240.103.51246 > 172.31.29.29.9651: Flags [P.], seq 3872362893:3872363004, ack 2198874722, win 2429, options [nop,nop,TS val 2776989464 ecr 1326378815], length 111
05:27:22.417754 ens5  In  IP 34.197.104.250.42168 > 172.31.29.29.9651: Flags [P.], seq 1:138, ack 111, win 443, options [nop,nop,TS val 41224543 ecr 3294444313], length 137
05:27:22.417779 ens5  In  IP 34.202.198.117.34782 > 172.31.29.29.9651: Flags [P.], seq 2012104629:2012104766, ack 586354470, win 443, options [nop,nop,TS val 55566496 ecr 3203003757], length 137
05:27:22.417779 ens5  In  IP 35.169.184.86.37708 > 172.31.29.29.9651: Flags [P.], seq 3288035322:3288035433, ack 4174342044, win 3455, options [nop,nop,TS val 27789961 ecr 1373135906], length 111
05:27:22.417786 ens5  Out IP 172.31.29.29.48890 > 50.19.116.199.9651: Flags [P.], seq 1:138, ack 111, win 443, options [nop,nop,TS val 1773884314 ecr 1474778765], length 137
05:27:22.417895 ens5  Out IP 172.31.29.29.9651 > 35.169.184.86.37708: Flags [P.], seq 1:138, ack 111, win 442, options [nop,nop,TS val 1373135913 ecr 27789961], length 137
05:27:22.417900 ens5  Out IP 172.31.29.29.9651 > 98.82.240.103.51246: Flags [P.], seq 1:138, ack 111, win 442, options [nop,nop,TS val 1326378818 ecr 2776989464], length 137
05:27:22.417908 ens5  In  IP 98.80.46.175.42342 > 172.31.29.29.9651: Flags [P.], seq 125969380:125969517, ack 3375126362, win 443, options [nop,nop,TS val 3131183083 ecr 1578183555], length 137
05:27:22.418040 ens5  In  IP 3.93.84.116.9651 > 172.31.29.29.48920: Flags [P.], seq 2634249520:2634249631, ack 3268089653, win 442, options [nop,nop,TS val 845189642 ecr 2584566935], length 111
05:27:22.418042 ens5  In  IP 50.19.151.55.57148 > 172.31.29.29.9651: Flags [.], ack 111, win 443, options [nop,nop,TS val 1968103395 ecr 2511453760], length 0
05:27:22.418042 ens5  In  IP 50.19.151.55.57148 > 172.31.29.29.9651: Flags [P.], seq 1:138, ack 111, win 443, options [nop,nop,TS val 1968103395 ecr 2511453760], length 137
05:27:22.418090 ens5  In  IP 34.206.101.137.9651 > 172.31.29.29.47744: Flags [P.], seq 1:138, ack 111, win 2943, options [nop,nop,TS val 1922448624 ecr 4994534], length 137
05:27:22.418146 ens5  Out IP 172.31.29.29.48920 > 3.93.84.116.9651: Flags [P.], seq 1:138, ack 111, win 443, options [nop,nop,TS val 2584566948 ecr 845189642], length 137
05:27:22.418378 ens5  In  IP 98.82.251.216.9651 > 172.31.29.29.55056: Flags [P.], seq 3840185693:3840185804, ack 2719070842, win 442, options [nop,nop,TS val 1988532669 ecr 164022699], length 111
05:27:22.418394 ens5  Out IP 172.31.29.29.55056 > 98.82.251.216.9651: Flags [.], ack 111, win 443, options [nop,nop,TS val 164022704 ecr 1988532669], length 0
05:27:22.418444 ens5  In  IP 34.202.198.117.34782 > 172.31.29.29.9651: Flags [P.], seq 137:248, ack 1, win 443, options [nop,nop,TS val 55566496 ecr 3203003757], length 111
05:27:22.418458 ens5  Out IP 172.31.29.29.9651 > 34.202.198.117.34782: Flags [.], ack 248, win 442, options [nop,nop,TS val 3203003758 ecr 55566496], length 0
05:27:22.418474 ens5  Out IP 172.31.29.29.55056 > 98.82.251.216.9651: Flags [P.], seq 1:138, ack 111, win 443, options [nop,nop,TS val 164022705 ecr 1988532669], length 137
05:27:22.418506 ens5  Out IP 172.31.29.29.9651 > 34.202.198.117.34782: Flags [P.], seq 1:138, ack 248, win 442, options [nop,nop,TS val 3203003758 ecr 55566496], length 137
05:27:22.418525 ens5  In  IP 54.226.62.214.55486 > 172.31.29.29.9651: Flags [P.], seq 1:138, ack 111, win 2919, options [nop,nop,TS val 1943625271 ecr 499423301], length 137
05:27:22.418577 ens5  In  IP 34.206.248.174.9651 > 172.31.29.29.36052: Flags [P.], seq 3646154776:3646154887, ack 2258524696, win 3694, options [nop,nop,TS val 3513449078 ecr 3441861675], length 111
05:27:22.418593 ens5  Out IP 172.31.29.29.36052 > 34.206.248.174.9651: Flags [.], ack 111, win 443, options [nop,nop,TS val 3441861690 ecr 3513449063], length 0
05:27:22.418650 ens5  Out IP 172.31.29.29.36052 > 34.206.248.174.9651: Flags [P.], seq 1:138, ack 111, win 443, options [nop,nop,TS val 3441861690 ecr 3513449063], length 137
05:27:22.419437 ens5  In  IP 52.3.189.202.52346 > 172.31.29.29.9651: Flags [P.], seq 1902702357:1902702468, ack 4057215434, win 2848, options [nop,nop,TS val 2231945048 ecr 368978498], length 111
05:27:22.419457 ens5  Out IP 172.31.29.29.9651 > 52.3.189.202.52346: Flags [.], ack 111, win 442, options [nop,nop,TS val 368978530 ecr 2231945039], length 0
05:27:22.419487 ens5  In  IP 104.236.110.97.9651 > 172.31.29.29.60222: Flags [.], ack 3520792627, win 1632, options [nop,nop,TS val 3877953089 ecr 4270885041], length 0
05:27:22.419521 ens5  Out IP 172.31.29.29.9651 > 52.3.189.202.52346: Flags [P.], seq 1:138, ack 111, win 442, options [nop,nop,TS val 368978530 ecr 2231945039], length 137
05:27:22.419674 ens5  In  IP 165.227.179.96.35002 > 172.31.29.29.9651: Flags [.], ack 334, win 2786, options [nop,nop,TS val 2516809402 ecr 1600446565], length 0
05:27:22.420282 ens5  In  IP 44.214.160.107.9651 > 172.31.29.29.48338: Flags [P.], seq 2665897616:2665897727, ack 105190257, win 442, options [nop,nop,TS val 4179017119 ecr 2168956310], length 111
05:27:22.420290 ens5  Out IP 172.31.29.29.48338 > 44.214.160.107.9651: Flags [.], ack 111, win 443, options [nop,nop,TS val 2168956341 ecr 4179017089], length 0
05:27:22.420351 ens5  Out IP 172.31.29.29.48338 > 44.214.160.107.9651: Flags [P.], seq 1:138, ack 111, win 443, options [nop,nop,TS val 2168956341 ecr 4179017089], length 137
05:27:22.420537 ens5  In  IP 23.22.195.89.35376 > 172.31.29.29.9651: Flags [P.], seq 752120626:752120737, ack 681105281, win 443, options [nop,nop,TS val 1464506683 ecr 3561901354], length 111
05:27:22.420541 ens5  In  IP 52.3.189.202.52346 > 172.31.29.29.9651: Flags [P.], seq 111:222, ack 138, win 2848, options [nop,nop,TS val 2231945050 ecr 368978530], length 111
05:27:22.420553 ens5  In  IP 104.236.110.97.9651 > 172.31.29.29.60222: Flags [P.], seq 0:367, ack 1, win 1632, options [nop,nop,TS val 3877953090 ecr 4270885041], length 367
05:27:22.420571 ens5  Out IP 172.31.29.29.9651 > 23.22.195.89.35376: Flags [.], ack 111, win 442, options [nop,nop,TS val 3561901370 ecr 1464506673], length 0
05:27:22.420574 ens5  In  IP 54.174.93.130.53264 > 172.31.29.29.9651: Flags [P.], seq 4210143721:4210143832, ack 852339654, win 2940, options [nop,nop,TS val 3373775768 ecr 1962823501], length 111
05:27:22.420616 ens5  In  IP 3.227.69.165.53606 > 172.31.29.29.9651: Flags [P.], seq 1422486528:1422486639, ack 16436590, win 3520, options [nop,nop,TS val 649561039 ecr 635146380], length 111
05:27:22.420672 ens5  Out IP 172.31.29.29.9651 > 52.3.189.202.52346: Flags [P.], seq 138:275, ack 222, win 442, options [nop,nop,TS val 368978531 ecr 2231945050], length 137
05:27:22.420684 ens5  Out IP 172.31.29.29.9651 > 23.22.195.89.35376: Flags [P.], seq 1:138, ack 111, win 442, options [nop,nop,TS val 3561901370 ecr 1464506673], length 137
05:27:22.420724 ens5  Out IP 172.31.29.29.9651 > 3.227.69.165.53606: Flags [P.], seq 1:138, ack 111, win 4631, options [nop,nop,TS val 635146394 ecr 649561039], length 137
05:27:22.420737 ens5  Out IP 172.31.29.29.9651 > 54.174.93.130.53264: Flags [P.], seq 1:138, ack 111, win 442, options [nop,nop,TS val 1962823532 ecr 3373775768], length 137
05:27:22.421083 ens5  In  IP 54.236.131.114.9651 > 172.31.29.29.44990: Flags [P.], seq 408885292:408885403, ack 3913886046, win 2940, options [nop,nop,TS val 2020063828 ecr 144501846], length 111
05:27:22.421104 ens5  Out IP 172.31.29.29.44990 > 54.236.131.114.9651: Flags [.], ack 111, win 443, options [nop,nop,TS val 144501857 ecr 2020063817], length 0
05:27:22.421153 ens5  Out IP 172.31.29.29.44990 > 54.236.131.114.9651: Flags [P.], seq 1:138, ack 111, win 443, options [nop,nop,TS val 144501857 ecr 2020063817], length 137
05:27:22.423238 ens5  In  IP 107.21.238.130.9651 > 172.31.29.29.52988: Flags [P.], seq 111:222, ack 138, win 660, options [nop,nop,TS val 192308144 ecr 707390840], length 111
05:27:22.423307 ens5  Out IP 172.31.29.29.52988 > 107.21.238.130.9651: Flags [P.], seq 138:275, ack 222, win 443, options [nop,nop,TS val 707390846 ecr 192308144], length 137
05:27:22.423347 ens5  In  IP 165.227.179.96.35002 > 172.31.29.29.9651: Flags [P.], seq 137:504, ack 334, win 2786, options [nop,nop,TS val 2516809405 ecr 1600446565], length 367
05:27:22.423363 ens5  In  IP 50.19.151.55.57148 > 172.31.29.29.9651: Flags [P.], seq 138:249, ack 111, win 443, options [nop,nop,TS val 1968103401 ecr 2511453760], length 111
05:27:22.423375 ens5  Out IP 172.31.29.29.9651 > 50.19.151.55.57148: Flags [.], ack 249, win 442, options [nop,nop,TS val 2511453776 ecr 1968103395], length 0
05:27:22.423552 ens5  Out IP 172.31.29.29.9651 > 18.215.213.100.53208: Flags [P.], seq 3773823602:3773823713, ack 2015870811, win 442, options [nop,nop,TS val 403912740 ecr 2697682812], length 111
05:27:22.423568 ens5  Out IP 172.31.29.29.9651 > 107.20.201.207.58582: Flags [P.], seq 173241753:173241864, ack 2846429227, win 442, options [nop,nop,TS val 2463805820 ecr 1480040883], length 111
05:27:22.423574 ens5  Out IP 172.31.29.29.9651 > 165.227.179.96.35002: Flags [P.], seq 445:556, ack 504, win 4631, options [nop,nop,TS val 1600446579 ecr 2516809405], length 111
05:27:22.423575 ens5  Out IP 172.31.29.29.9651 > 34.203.168.140.53994: Flags [P.], seq 1:112, ack 137, win 2521, options [nop,nop,TS val 44398116 ecr 1552758852], length 111
05:27:22.423582 ens5  Out IP 172.31.29.29.9651 > 3.218.45.144.58526: Flags [P.], seq 1753573916:1753574027, ack 609812290, win 442, options [nop,nop,TS val 1603267922 ecr 608748994], length 111
05:27:22.423589 ens5  Out IP 172.31.29.29.9651 > 23.21.204.131.45034: Flags [P.], seq 1023207020:1023207131, ack 345527992, win 442, options [nop,nop,TS val 2478978580 ecr 615928044], length 111
05:27:22.423592 ens5  Out IP 172.31.29.29.9651 > 54.197.102.41.55330: Flags [P.], seq 3902242670:3902242781, ack 556186031, win 2574, options [nop,nop,TS val 3078573240 ecr 1425065347], length 111
05:27:22.423596 ens5  In  IP 35.169.184.86.37708 > 172.31.29.29.9651: Flags [P.], seq 111:222, ack 138, win 3455, options [nop,nop,TS val 27789967 ecr 1373135913], length 111
05:27:22.423602 ens5  Out IP 172.31.29.29.9651 > 44.210.177.215.60188: Flags [P.], seq 2558946841:2558946952, ack 2317350923, win 442, options [nop,nop,TS val 3115199361 ecr 290274795], length 111
05:27:22.423603 ens5  Out IP 172.31.29.29.60222 > 104.236.110.97.9651: Flags [P.], seq 112:223, ack 367, win 443, options [nop,nop,TS val 4270885055 ecr 3877953090], length 111
05:27:22.423617 ens5  Out IP 172.31.29.29.9651 > 54.85.9.116.50190: Flags [P.], seq 2765934956:2765935067, ack 1314887025, win 442, options [nop,nop,TS val 3446716894 ecr 894130901], length 111
05:27:22.423617 ens5  Out IP 172.31.29.29.9651 > 34.234.4.103.51360: Flags [P.], seq 1693414895:1693415006, ack 2673719513, win 442, options [nop,nop,TS val 3468170873 ecr 1642875031], length 111
05:27:22.423621 ens5  In  IP 18.206.17.246.55882 > 172.31.29.29.9651: Flags [P.], seq 2978681756:2978681867, ack 691153080, win 2816, options [nop,nop,TS val 2845170275 ecr 2287681174], length 111
05:27:22.423627 ens5  Out IP 172.31.29.29.9651 > 50.19.151.55.57148: Flags [P.], seq 111:248, ack 249, win 442, options [nop,nop,TS val 2511453777 ecr 1968103395], length 137
05:27:22.423630 ens5  Out IP 172.31.29.29.44990 > 54.236.131.114.9651: Flags [P.], seq 138:249, ack 111, win 443, options [nop,nop,TS val 144501860 ecr 2020063817], length 111
05:27:22.423633 ens5  Out IP 172.31.29.29.9651 > 34.202.51.225.55254: Flags [P.], seq 111:222, ack 138, win 442, options [nop,nop,TS val 1061132935 ecr 892857938], length 111
05:27:22.423708 ens5  In  IP 54.85.9.116.50190 > 172.31.29.29.9651: Flags [.], ack 111, win 443, options [nop,nop,TS val 894130953 ecr 3446716857], length 0
05:27:22.423744 ens5  In  IP 54.85.9.116.50190 > 172.31.29.29.9651: Flags [P.], seq 1:138, ack 111, win 443, options [nop,nop,TS val 894130953 ecr 3446716857], length 137
05:27:22.423756 ens5  Out IP 172.31.29.29.9651 > 34.234.4.103.51360: Flags [P.], seq 111:222, ack 1, win 442, options [nop,nop,TS val 3468170873 ecr 1642875031], length 111
05:27:22.423762 ens5  In  IP 35.169.66.196.38146 > 172.31.29.29.9651: Flags [P.], seq 22306687:22306798, ack 3977169287, win 4173, options [nop,nop,TS val 2821450720 ecr 3222091325], length 111
05:27:22.423772 ens5  Out IP 172.31.29.29.9651 > 18.206.17.246.55882: Flags [P.], seq 1:112, ack 111, win 442, options [nop,nop,TS val 2287681192 ecr 2845170275], length 111
05:27:22.423773 ens5  Out IP 172.31.29.29.9651 > 23.21.204.131.45034: Flags [P.], seq 111:222, ack 1, win 442, options [nop,nop,TS val 2478978580 ecr 615928044], length 111
05:27:22.423773 ens5  In  IP 34.203.168.140.53994 > 172.31.29.29.9651: Flags [P.], seq 137:274, ack 112, win 2315, options [nop,nop,TS val 1552758859 ecr 44398116], length 137
05:27:22.423785 ens5  In  IP 54.158.175.165.47700 > 172.31.29.29.9651: Flags [P.], seq 656887261:656887372, ack 1754157340, win 688, options [nop,nop,TS val 4228222424 ecr 4069969720], length 111
05:27:22.423790 ens5  Out IP 172.31.29.29.9651 > 98.80.46.175.42342: Flags [P.], seq 1:112, ack 137, win 442, options [nop,nop,TS val 1578183562 ecr 3131183083], length 111
05:27:22.423791 ens5  Out IP 172.31.29.29.55056 > 98.82.251.216.9651: Flags [P.], seq 138:249, ack 111, win 443, options [nop,nop,TS val 164022710 ecr 1988532669], length 111
05:27:22.423803 ens5  Out IP 172.31.29.29.39538 > 23.22.40.156.9651: Flags [P.], seq 2149961238:2149961349, ack 4125287107, win 443, options [nop,nop,TS val 3770987698 ecr 2219909019], length 111
05:27:22.423808 ens5  Out IP 172.31.29.29.9651 > 34.197.148.157.39988: Flags [P.], seq 1999735459:1999735570, ack 3934864760, win 442, options [nop,nop,TS val 1621845449 ecr 2284499952], length 111
05:27:22.423813 ens5  Out IP 172.31.29.29.9651 > 44.211.0.202.41076: Flags [P.], seq 1364072145:1364072256, ack 1430356172, win 442, options [nop,nop,TS val 90204227 ecr 655955338], length 111
05:27:22.423816 ens5  Out IP 172.31.29.29.9651 > 18.235.252.133.56194: Flags [P.], seq 1537102329:1537102440, ack 3504321475, win 442, options [nop,nop,TS val 3559413623 ecr 191028107], length 111
05:27:22.423821 ens5  Out IP 172.31.29.29.9651 > 34.206.59.82.51184: Flags [P.], seq 2717309883:2717309994, ack 2568667761, win 442, options [nop,nop,TS val 1309041116 ecr 2051423996], length 111
05:27:22.423827 ens5  Out IP 172.31.29.29.9651 > 18.215.213.100.53208: Flags [P.], seq 111:222, ack 1, win 442, options [nop,nop,TS val 403912740 ecr 2697682812], length 111
05:27:22.423827 ens5  Out IP 172.31.29.29.60222 > 104.236.110.97.9651: Flags [P.], seq 223:334, ack 367, win 443, options [nop,nop,TS val 4270885055 ecr 3877953090], length 111
05:27:22.423836 ens5  In  IP 18.215.213.100.53208 > 172.31.29.29.9651: Flags [P.], seq 1:138, ack 111, win 443, options [nop,nop,TS val 2697682826 ecr 403912740], length 137
05:27:22.423845 ens5  Out IP 172.31.29.29.9651 > 23.22.195.89.35376: Flags [P.], seq 138:249, ack 111, win 442, options [nop,nop,TS val 3561901373 ecr 1464506673], length 111
05:27:22.423847 ens5  Out IP 172.31.29.29.48920 > 3.93.84.116.9651: Flags [P.], seq 138:249, ack 111, win 443, options [nop,nop,TS val 2584566954 ecr 845189642], length 111
05:27:22.423860 ens5  Out IP 172.31.29.29.48338 > 44.214.160.107.9651: Flags [P.], seq 138:249, ack 111, win 443, options [nop,nop,TS val 2168956345 ecr 4179017089], length 111
05:27:22.423878 ens5  In  IP 54.197.102.41.55330 > 172.31.29.29.9651: Flags [P.], seq 1:138, ack 111, win 443, options [nop,nop,TS val 1425065361 ecr 3078573240], length 137
05:27:22.423884 ens5  Out IP 172.31.29.29.9651 > 165.227.179.96.35002: Flags [P.], seq 556:667, ack 504, win 4631, options [nop,nop,TS val 1600446579 ecr 2516809405], length 111
05:27:22.423902 ens5  In  IP 34.234.4.103.51360 > 172.31.29.29.9651: Flags [.], ack 111, win 443, options [nop,nop,TS val 1642875051 ecr 3468170859], length 0
05:27:22.423904 ens5  In  IP 54.236.131.114.9651 > 172.31.29.29.44990: Flags [.], ack 249, win 2940, options [nop,nop,TS val 2020063831 ecr 144501857], length 0
05:27:22.423904 ens5  In  IP 23.21.204.131.45034 > 172.31.29.29.9651: Flags [P.], seq 1:138, ack 111, win 443, options [nop,nop,TS val 615928058 ecr 2478978580], length 137
05:27:22.423904 ens5  In  IP 52.70.38.106.58350 > 172.31.29.29.9651: Flags [.], ack 1844117423, win 2986, options [nop,nop,TS val 3476336555 ecr 844151601], length 0
05:27:22.423904 ens5  In  IP 3.218.45.144.58526 > 172.31.29.29.9651: Flags [P.], seq 1:138, ack 111, win 443, options [nop,nop,TS val 608749028 ecr 1603267922], length 137
05:27:22.423917 ens5  Out IP 172.31.29.29.48890 > 50.19.116.199.9651: Flags [P.], seq 138:249, ack 111, win 443, options [nop,nop,TS val 1773884320 ecr 1474778765], length 111
05:27:22.423932 ens5  In  IP 44.210.177.215.60188 > 172.31.29.29.9651: Flags [.], ack 111, win 680, options [nop,nop,TS val 290274837 ecr 3115199351], length 0
05:27:22.423948 ens5  Out IP 172.31.29.29.9651 > 52.200.197.163.39696: Flags [P.], seq 1981464893:1981465004, ack 952912988, win 442, options [nop,nop,TS val 436507016 ecr 3335542307], length 111
05:27:22.423966 ens5  In  IP 18.206.17.246.55882 > 172.31.29.29.9651: Flags [P.], seq 111:222, ack 112, win 2816, options [nop,nop,TS val 2845170276 ecr 2287681192], length 111
05:27:22.423971 ens5  Out IP 172.31.29.29.44990 > 54.236.131.114.9651: Flags [P.], seq 249:360, ack 111, win 443, options [nop,nop,TS val 144501860 ecr 2020063831], length 111
05:27:22.423986 ens5  In  IP 54.236.131.114.9651 > 172.31.29.29.44990: Flags [P.], seq 111:248, ack 249, win 2940, options [nop,nop,TS val 2020063831 ecr 144501857], length 137
05:27:22.423986 ens5  In  IP 44.214.160.107.9651 > 172.31.29.29.48338: Flags [.], ack 249, win 442, options [nop,nop,TS val 4179017123 ecr 2168956341], length 0
05:27:22.423989 ens5  In  IP 44.210.177.215.60188 > 172.31.29.29.9651: Flags [P.], seq 1:138, ack 111, win 680, options [nop,nop,TS val 290274837 ecr 3115199351], length 137
05:27:22.423995 ens5  Out IP 172.31.29.29.9651 > 34.203.168.140.53994: Flags [P.], seq 112:223, ack 274, win 2521, options [nop,nop,TS val 44398116 ecr 1552758859], length 111
05:27:22.423999 ens5  Out IP 172.31.29.29.9651 > 35.169.184.86.37708: Flags [P.], seq 138:275, ack 222, win 442, options [nop,nop,TS val 1373135919 ecr 27789967], length 137
05:27:22.424000 ens5  Out IP 172.31.29.29.9651 > 98.80.46.175.42342: Flags [P.], seq 112:223, ack 137, win 442, options [nop,nop,TS val 1578183562 ecr 3131183083], length 111
05:27:22.424006 ens5  Out IP 172.31.29.29.60222 > 104.236.110.97.9651: Flags [P.], seq 334:445, ack 367, win 443, options [nop,nop,TS val 4270885055 ecr 3877953090], length 111
05:27:22.424014 ens5  Out IP 172.31.29.29.48920 > 3.93.84.116.9651: Flags [P.], seq 249:360, ack 111, win 443, options [nop,nop,TS val 2584566954 ecr 845189642], length 111
05:27:22.424015 ens5  Out IP 172.31.29.29.9651 > 3.232.45.182.37336: Flags [P.], seq 1:112, ack 137, win 3528, options [nop,nop,TS val 1292739662 ecr 814949210], length 111
05:27:22.424017 ens5  Out IP 172.31.29.29.9651 > 165.227.179.96.35002: Flags [P.], seq 667:778, ack 504, win 4631, options [nop,nop,TS val 1600446579 ecr 2516809405], length 111
05:27:22.424027 ens5  Out IP 172.31.29.29.48206 > 52.54.223.196.9651: Flags [P.], seq 1668789505:1668789616, ack 3680859072, win 443, options [nop,nop,TS val 2222008183 ecr 2379255036], length 111
05:27:22.424048 ens5  Out IP 172.31.29.29.9651 > 3.223.220.64.47902: Flags [P.], seq 2532296104:2532296215, ack 3971577070, win 442, options [nop,nop,TS val 3325312287 ecr 3638100987], length 111
05:27:22.424053 ens5  In  IP 44.214.160.107.9651 > 172.31.29.29.48338: Flags [P.], seq 111:248, ack 249, win 442, options [nop,nop,TS val 4179017123 ecr 2168956341], length 137
05:27:22.424053 ens5  In  IP 23.22.195.89.35376 > 172.31.29.29.9651: Flags [.], ack 249, win 443, options [nop,nop,TS val 1464506687 ecr 3561901370], length 0
05:27:22.424053 ens5  In  IP 98.80.46.175.42342 > 172.31.29.29.9651: Flags [P.], seq 137:274, ack 112, win 443, options [nop,nop,TS val 3131183090 ecr 1578183562], length 137
05:27:22.424060 ens5  Out IP 172.31.29.29.45950 > 52.3.14.29.9651: Flags [P.], seq 2917409234:2917409345, ack 4074217052, win 443, options [nop,nop,TS val 856880991 ecr 2257523459], length 111
05:27:22.424074 ens5  Out IP 172.31.29.29.9651 > 52.70.38.106.58350: Flags [P.], seq 1:112, ack 0, win 442, options [nop,nop,TS val 844151642 ecr 3476336555], length 111
05:27:22.424087 ens5  In  IP 23.21.204.131.45034 > 172.31.29.29.9651: Flags [P.], seq 138:275, ack 222, win 443, options [nop,nop,TS val 615928058 ecr 2478978580], length 137
05:27:22.424093 ens5  Out IP 172.31.29.29.9651 > 18.206.17.246.55882: Flags [P.], seq 112:249, ack 222, win 442, options [nop,nop,TS val 2287681192 ecr 2845170276], length 137
05:27:22.424103 ens5  Out IP 172.31.29.29.9651 > 23.21.204.131.45034: Flags [.], ack 275, win 442, options [nop,nop,TS val 2478978580 ecr 615928058], length 0
05:27:22.424111 ens5  In  IP 34.197.148.157.39988 > 172.31.29.29.9651: Flags [P.], seq 1:138, ack 111, win 443, options [nop,nop,TS val 2284499966 ecr 1621845449], length 137
05:27:22.424113 ens5  Out IP 172.31.29.29.9651 > 35.169.66.196.38146: Flags [P.], seq 1:138, ack 111, win 442, options [nop,nop,TS val 3222091339 ecr 2821450720], length 137
05:27:22.424116 ens5  Out IP 172.31.29.29.9651 > 54.158.175.165.47700: Flags [P.], seq 1:138, ack 111, win 442, options [nop,nop,TS val 4069969754 ecr 4228222424], length 137
05:27:22.424124 ens5  In  IP 3.93.84.116.9651 > 172.31.29.29.48920: Flags [.], ack 249, win 442, options [nop,nop,TS val 845189649 ecr 2584566948], length 0
05:27:22.424131 ens5  In  IP 34.206.59.82.51184 > 172.31.29.29.9651: Flags [.], ack 111, win 443, options [nop,nop,TS val 2051424010 ecr 1309041103], length 0
05:27:22.424131 ens5  In  IP 23.22.195.89.35376 > 172.31.29.29.9651: Flags [P.], seq 111:248, ack 249, win 443, options [nop,nop,TS val 1464506687 ecr 3561901370], length 137
05:27:22.424143 ens5  In  IP 34.234.4.103.51360 > 172.31.29.29.9651: Flags [P.], seq 1:253, ack 222, win 443, options [nop,nop,TS val 1642875052 ecr 3468170873], length 252
05:27:22.424143 ens5  In  IP 18.215.213.100.53208 > 172.31.29.29.9651: Flags [P.], seq 138:275, ack 222, win 443, options [nop,nop,TS val 2697682826 ecr 403912740], length 137
05:27:22.424160 ens5  In  IP 52.200.197.163.39696 > 172.31.29.29.9651: Flags [P.], seq 1:138, ack 111, win 443, options [nop,nop,TS val 3335542321 ecr 436507016], length 137
05:27:22.424160 ens5  In  IP 23.22.40.156.9651 > 172.31.29.29.39538: Flags [P.], seq 1:138, ack 111, win 442, options [nop,nop,TS val 2219909071 ecr 3770987698], length 137
05:27:22.424176 ens5  In  IP 107.20.201.207.58582 > 172.31.29.29.9651: Flags [P.], seq 1:138, ack 111, win 443, options [nop,nop,TS val 1480040897 ecr 2463805820], length 137
05:27:22.424178 ens5  Out IP 172.31.29.29.9651 > 18.215.213.100.53208: Flags [.], ack 275, win 442, options [nop,nop,TS val 403912740 ecr 2697682826], length 0
05:27:22.424185 ens5  In  IP 18.235.252.133.56194 > 172.31.29.29.9651: Flags [P.], seq 1:138, ack 111, win 3402, options [nop,nop,TS val 191028144 ecr 3559413623], length 137
05:27:22.424186 ens5  Out IP 172.31.29.29.39538 > 23.22.40.156.9651: Flags [.], ack 138, win 443, options [nop,nop,TS val 3770987698 ecr 2219909071], length 0
05:27:22.424185 ens5  In  IP 3.93.84.116.9651 > 172.31.29.29.48920: Flags [P.], seq 111:248, ack 249, win 442, options [nop,nop,TS val 845189649 ecr 2584566948], length 137
05:27:22.424199 ens5  In  IP 98.82.251.216.9651 > 172.31.29.29.55056: Flags [.], ack 249, win 442, options [nop,nop,TS val 1988532675 ecr 164022705], length 0
05:27:22.424200 ens5  In  IP 44.211.0.202.41076 > 172.31.29.29.9651: Flags [.], ack 111, win 2565, options [nop,nop,TS val 655955348 ecr 90204217], length 0
05:27:22.424214 ens5  In  IP 52.54.223.196.9651 > 172.31.29.29.48206: Flags [P.], seq 1:138, ack 111, win 442, options [nop,nop,TS val 2379255050 ecr 2222008183], length 137
05:27:22.424214 ens5  In  IP 50.19.116.199.9651 > 172.31.29.29.48890: Flags [.], ack 249, win 442, options [nop,nop,TS val 1474778772 ecr 1773884314], length 0
05:27:22.424245 ens5  Out IP 172.31.29.29.9651 > 18.206.17.246.55882: Flags [P.], seq 249:386, ack 222, win 442, options [nop,nop,TS val 2287681192 ecr 2845170276], length 137
05:27:22.424257 ens5  In  IP 18.206.17.246.55882 > 172.31.29.29.9651: Flags [P.], seq 222:333, ack 112, win 2816, options [nop,nop,TS val 2845170276 ecr 2287681192], length 111
05:27:22.424258 ens5  In  IP 44.211.0.202.41076 > 172.31.29.29.9651: Flags [P.], seq 1:138, ack 111, win 2565, options [nop,nop,TS val 655955348 ecr 90204217], length 137
05:27:22.424260 ens5  In  IP 34.203.168.140.53994 > 172.31.29.29.9651: Flags [P.], seq 274:411, ack 223, win 2315, options [nop,nop,TS val 1552758859 ecr 44398116], length 137
05:27:22.424270 ens5  In  IP 52.3.14.29.9651 > 172.31.29.29.45950: Flags [.], ack 111, win 615, options [nop,nop,TS val 2257523511 ecr 856880956], length 0
05:27:22.424270 ens5  In  IP 50.19.116.199.9651 > 172.31.29.29.48890: Flags [P.], seq 111:248, ack 249, win 442, options [nop,nop,TS val 1474778772 ecr 1773884314], length 137
05:27:22.424333 ens5  In  IP 52.70.38.106.58350 > 172.31.29.29.9651: Flags [.], ack 112, win 2986, options [nop,nop,TS val 3476336555 ecr 844151642], length 0
05:27:22.424335 ens5  In  IP 54.236.131.114.9651 > 172.31.29.29.44990: Flags [P.], seq 248:385, ack 360, win 2940, options [nop,nop,TS val 2020063831 ecr 144501860], length 137
05:27:22.424335 ens5  In  IP 98.82.251.216.9651 > 172.31.29.29.55056: Flags [P.], seq 111:248, ack 249, win 442, options [nop,nop,TS val 1988532675 ecr 164022705], length 137
05:27:22.424335 ens5  In  IP 98.80.46.175.42342 > 172.31.29.29.9651: Flags [P.], seq 274:411, ack 223, win 443, options [nop,nop,TS val 3131183090 ecr 1578183562], length 137
05:27:22.424335 ens5  In  IP 3.232.45.182.37336 > 172.31.29.29.9651: Flags [P.], seq 137:274, ack 112, win 2560, options [nop,nop,TS val 814949217 ecr 1292739662], length 137
05:27:22.424355 ens5  In  IP 18.206.17.246.55882 > 172.31.29.29.9651: Flags [P.], seq 333:470, ack 249, win 2816, options [nop,nop,TS val 2845170276 ecr 2287681192], length 137
05:27:22.424359 ens5  Out IP 172.31.29.29.9651 > 98.80.46.175.42342: Flags [.], ack 411, win 442, options [nop,nop,TS val 1578183562 ecr 3131183090], length 0
05:27:22.424376 ens5  Out IP 172.31.29.29.9651 > 18.206.17.246.55882: Flags [.], ack 470, win 442, options [nop,nop,TS val 2287681192 ecr 2845170276], length 0
05:27:22.424392 ens5  In  IP 3.93.84.116.9651 > 172.31.29.29.48920: Flags [P.], seq 248:385, ack 360, win 442, options [nop,nop,TS val 845189649 ecr 2584566954], length 137
05:27:22.424395 ens5  Out IP 172.31.29.29.44990 > 54.236.131.114.9651: Flags [.], ack 385, win 443, options [nop,nop,TS val 144501860 ecr 2020063831], length 0
05:27:22.424399 ens5  In  IP 52.3.14.29.9651 > 172.31.29.29.45950: Flags [P.], seq 1:138, ack 111, win 616, options [nop,nop,TS val 2257523511 ecr 856880956], length 137
05:27:22.424399 ens5  In  IP 52.70.38.106.58350 > 172.31.29.29.9651: Flags [P.], seq 0:137, ack 112, win 2986, options [nop,nop,TS val 3476336555 ecr 844151642], length 137
05:27:22.424425 ens5  In  IP 34.206.59.82.51184 > 172.31.29.29.9651: Flags [P.], seq 1:138, ack 111, win 443, options [nop,nop,TS val 2051424011 ecr 1309041103], length 137
05:27:22.424425 ens5  In  IP 50.19.151.55.57148 > 172.31.29.29.9651: Flags [P.], seq 249:360, ack 248, win 443, options [nop,nop,TS val 1968103402 ecr 2511453777], length 111
05:27:22.424469 ens5  In  IP 34.202.51.225.55254 > 172.31.29.29.9651: Flags [P.], seq 138:275, ack 222, win 443, options [nop,nop,TS val 892857945 ecr 1061132935], length 137
05:27:22.424486 ens5  Out IP 172.31.29.29.48920 > 3.93.84.116.9651: Flags [.], ack 385, win 443, options [nop,nop,TS val 2584566955 ecr 845189649], length 0
05:27:22.424542 ens5  In  IP 3.223.220.64.47902 > 172.31.29.29.9651: Flags [P.], seq 1:138, ack 111, win 443, options [nop,nop,TS val 3638101002 ecr 3325312287], length 137
05:27:22.424666 ens5  Out IP 172.31.29.29.9651 > 18.206.17.246.55882: Flags [P.], seq 386:523, ack 470, win 442, options [nop,nop,TS val 2287681193 ecr 2845170276], length 137
05:27:22.424678 ens5  Out IP 172.31.29.29.9651 > 50.19.151.55.57148: Flags [P.], seq 248:385, ack 360, win 442, options [nop,nop,TS val 2511453778 ecr 1968103402], length 137
05:27:22.424818 ens5  In  IP 34.202.198.117.34782 > 172.31.29.29.9651: Flags [P.], seq 248:359, ack 138, win 443, options [nop,nop,TS val 55566503 ecr 3203003758], length 111
05:27:22.424862 ens5  In  IP 18.206.17.246.55882 > 172.31.29.29.9651: Flags [.], ack 523, win 2816, options [nop,nop,TS val 2845170276 ecr 2287681192], length 0
05:27:22.424887 ens5  Out IP 172.31.29.29.9651 > 34.202.198.117.34782: Flags [P.], seq 138:275, ack 359, win 442, options [nop,nop,TS val 3203003764 ecr 55566503], length 137
05:27:22.424952 ens5  In  IP 50.19.151.55.57148 > 172.31.29.29.9651: Flags [P.], seq 360:471, ack 248, win 443, options [nop,nop,TS val 1968103402 ecr 2511453777], length 111
05:27:22.425006 ens5  Out IP 172.31.29.29.9651 > 50.19.151.55.57148: Flags [P.], seq 385:522, ack 471, win 442, options [nop,nop,TS val 2511453778 ecr 1968103402], length 137
05:27:22.425149 ens5  In  IP 104.236.110.97.9651 > 172.31.29.29.60222: Flags [P.], seq 367:504, ack 112, win 1632, options [nop,nop,TS val 3877953095 ecr 4270885049], length 137
05:27:22.425461 ens5  In  IP 50.19.151.55.57148 > 172.31.29.29.9651: Flags [.], ack 522, win 443, options [nop,nop,TS val 1968103403 ecr 2511453778], length 0
05:27:22.426518 ens5  In  IP 54.225.236.76.9651 > 172.31.29.29.42418: Flags [P.], seq 1262898565:1262898675, ack 2541704794, win 442, options [nop,nop,TS val 4089821478 ecr 3481394552], length 110
05:27:22.426526 ens5  Out IP 172.31.29.29.42418 > 54.225.236.76.9651: Flags [.], ack 110, win 443, options [nop,nop,TS val 3481394590 ecr 4089821441], length 0
05:27:22.426587 ens5  Out IP 172.31.29.29.42418 > 54.225.236.76.9651: Flags [P.], seq 1:137, ack 110, win 443, options [nop,nop,TS val 3481394590 ecr 4089821441], length 136
05:27:22.426923 ens5  In  IP 35.169.66.196.38146 > 172.31.29.29.9651: Flags [P.], seq 111:222, ack 138, win 4173, options [nop,nop,TS val 2821450723 ecr 3222091339], length 111
05:27:22.426928 ens5  In  IP 54.197.55.84.60110 > 172.31.29.29.9651: Flags [.], ack 3595530686, win 3276, options [nop,nop,TS val 1395579730 ecr 3959098956], length 0
05:27:22.426993 ens5  Out IP 172.31.29.29.9651 > 35.169.66.196.38146: Flags [P.], seq 138:275, ack 222, win 442, options [nop,nop,TS val 3222091342 ecr 2821450723], length 137
05:27:22.427712 ens5  In  IP 3.218.45.144.58526 > 172.31.29.29.9651: Flags [P.], seq 138:249, ack 111, win 443, options [nop,nop,TS val 608749032 ecr 1603267922], length 111
05:27:22.427733 ens5  Out IP 172.31.29.29.9651 > 3.218.45.144.58526: Flags [.], ack 249, win 442, options [nop,nop,TS val 1603267926 ecr 608749028], length 0
05:27:22.427790 ens5  Out IP 172.31.29.29.9651 > 3.218.45.144.58526: Flags [P.], seq 111:248, ack 249, win 442, options [nop,nop,TS val 1603267926 ecr 608749028], length 137
05:27:22.427795 ens5  In  IP 18.233.119.27.53100 > 172.31.29.29.9651: Flags [P.], seq 1643457118:1643457229, ack 3452817345, win 684, options [nop,nop,TS val 2103730517 ecr 3557128760], length 111
05:27:22.427867 ens5  Out IP 172.31.29.29.9651 > 18.233.119.27.53100: Flags [P.], seq 1:138, ack 111, win 442, options [nop,nop,TS val 3557128784 ecr 2103730517], length 137
05:27:22.427927 ens5  In  IP 52.70.38.106.58350 > 172.31.29.29.9651: Flags [P.], seq 137:248, ack 112, win 2986, options [nop,nop,TS val 3476336559 ecr 844151642], length 111
05:27:22.427936 ens5  In  IP 18.215.11.46.9651 > 172.31.29.29.50652: Flags [P.], seq 1667255777:1667255888, ack 671637749, win 442, options [nop,nop,TS val 431838626 ecr 71804650], length 111
05:27:22.427942 ens5  Out IP 172.31.29.29.9651 > 52.70.38.106.58350: Flags [.], ack 248, win 442, options [nop,nop,TS val 844151646 ecr 3476336555], length 0
05:27:22.427978 ens5  Out IP 172.31.29.29.50652 > 18.215.11.46.9651: Flags [.], ack 111, win 443, options [nop,nop,TS val 71804668 ecr 431838608], length 0
05:27:22.427992 ens5  Out IP 172.31.29.29.9651 > 52.70.38.106.58350: Flags [P.], seq 112:249, ack 248, win 442, options [nop,nop,TS val 844151646 ecr 3476336555], length 137
05:27:22.428016 ens5  Out IP 172.31.29.29.50652 > 18.215.11.46.9651: Flags [P.], seq 1:138, ack 111, win 443, options [nop,nop,TS val 71804668 ecr 431838608], length 137
05:27:22.428137 ens5  In  IP 18.207.74.220.9651 > 172.31.29.29.39358: Flags [P.], seq 3154741009:3154741120, ack 3165140945, win 2672, options [nop,nop,TS val 3798438171 ecr 1603004225], length 111
05:27:22.428143 ens5  In  IP 18.215.11.46.9651 > 172.31.29.29.50652: Flags [P.], seq 111:222, ack 1, win 442, options [nop,nop,TS val 431838626 ecr 71804650], length 111
05:27:22.428146 ens5  Out IP 172.31.29.29.39358 > 18.207.74.220.9651: Flags [.], ack 111, win 443, options [nop,nop,TS val 1603004295 ecr 3798438132], length 0
05:27:22.428160 ens5  In  IP 34.197.148.157.39988 > 172.31.29.29.9651: Flags [P.], seq 138:249, ack 111, win 443, options [nop,nop,TS val 2284499970 ecr 1621845449], length 111
05:27:22.428160 ens5  In  IP 54.85.9.116.50190 > 172.31.29.29.9651: Flags [P.], seq 138:249, ack 111, win 443, options [nop,nop,TS val 894130957 ecr 3446716857], length 111
05:27:22.428165 ens5  In  IP 52.71.181.255.33636 > 172.31.29.29.9651: Flags [P.], seq 3020333099:3020333210, ack 4197329881, win 2285, options [nop,nop,TS val 507113612 ecr 1262642666], length 111
05:27:22.428213 ens5  Out IP 172.31.29.29.9651 > 54.85.9.116.50190: Flags [.], ack 249, win 442, options [nop,nop,TS val 3446716898 ecr 894130953], length 0
05:27:22.428218 ens5  Out IP 172.31.29.29.9651 > 34.197.148.157.39988: Flags [.], ack 249, win 442, options [nop,nop,TS val 1621845453 ecr 2284499966], length 0
05:27:22.428257 ens5  Out IP 172.31.29.29.39358 > 18.207.74.220.9651: Flags [P.], seq 1:138, ack 111, win 443, options [nop,nop,TS val 1603004295 ecr 3798438132], length 137
05:27:22.428261 ens5  Out IP 172.31.29.29.50652 > 18.215.11.46.9651: Flags [P.], seq 138:275, ack 222, win 443, options [nop,nop,TS val 71804668 ecr 431838626], length 137
05:27:22.428304 ens5  Out IP 172.31.29.29.9651 > 34.197.148.157.39988: Flags [P.], seq 111:248, ack 249, win 442, options [nop,nop,TS val 1621845453 ecr 2284499966], length 137
05:27:22.428307 ens5  Out IP 172.31.29.29.9651 > 52.71.181.255.33636: Flags [P.], seq 1:138, ack 111, win 442, options [nop,nop,TS val 1262642679 ecr 507113612], length 137
05:27:22.428313 ens5  Out IP 172.31.29.29.9651 > 54.85.9.116.50190: Flags [P.], seq 111:248, ack 249, win 442, options [nop,nop,TS val 3446716898 ecr 894130953], length 137
05:27:22.428347 ens5  In  IP 18.207.74.220.9651 > 172.31.29.29.39358: Flags [P.], seq 111:222, ack 1, win 2672, options [nop,nop,TS val 3798438171 ecr 1603004225], length 111
05:27:22.428420 ens5  Out IP 172.31.29.29.39358 > 18.207.74.220.9651: Flags [P.], seq 138:275, ack 222, win 443, options [nop,nop,TS val 1603004296 ecr 3798438171], length 137
05:27:22.428499 ens5  In  IP 98.82.251.216.9651 > 172.31.29.29.55056: Flags [P.], seq 248:359, ack 249, win 442, options [nop,nop,TS val 1988532680 ecr 164022705], length 111
05:27:22.428499 ens5  In  IP 98.80.46.175.42342 > 172.31.29.29.9651: Flags [P.], seq 411:522, ack 223, win 443, options [nop,nop,TS val 3131183094 ecr 1578183562], length 111
05:27:22.428512 ens5  In  IP 18.215.11.46.9651 > 172.31.29.29.50652: Flags [.], ack 275, win 442, options [nop,nop,TS val 431838626 ecr 71804668], length 0
05:27:22.428528 ens5  Out IP 172.31.29.29.55056 > 98.82.251.216.9651: Flags [.], ack 359, win 443, options [nop,nop,TS val 164022715 ecr 1988532675], length 0
