tcpdump: data link type LINUX_SLL2
tcpdump: verbose output suppressed, use -v[v]... for full protocol decode
listening on any, link-type LINUX_SLL2 (Linux cooked v2), snapshot length 262144 bytes
05:09:14.327499 ens5  Out IP 172.31.24.48.60692 > 3.230.225.34.9651: Flags [P.], seq 1300971594:1300971731, ack 3280961882, win 13092, options [nop,nop,TS val 1239811644 ecr 2259350211], length 137
05:09:14.327699 ens5  In  IP 18.233.204.144.9651 > 172.31.24.48.49366: Flags [P.], seq 4190336951:4190337062, ack 2924054278, win 10320, options [nop,nop,TS val 2689221517 ecr 2280619972], length 111
05:09:14.327728 ens5  Out IP 172.31.24.48.49366 > 18.233.204.144.9651: Flags [.], ack 111, win 7872, options [nop,nop,TS val 2280619981 ecr 2689221508], length 0
05:09:14.327804 ens5  Out IP 172.31.24.48.49366 > 18.233.204.144.9651: Flags [P.], seq 1:138, ack 111, win 7872, options [nop,nop,TS val 2280619981 ecr 2689221508], length 137
05:09:14.327808 ens5  In  IP 23.21.204.131.9651 > 172.31.24.48.53880: Flags [P.], seq 586377235:586377346, ack 631663580, win 10215, options [nop,nop,TS val 2939303509 ecr 47314142], length 111
05:09:14.327828 ens5  Out IP 172.31.24.48.53880 > 23.21.204.131.9651: Flags [.], ack 111, win 11372, options [nop,nop,TS val 47314144 ecr 2939303507], length 0
05:09:14.327885 ens5  Out IP 172.31.24.48.53880 > 23.21.204.131.9651: Flags [P.], seq 1:138, ack 111, win 11372, options [nop,nop,TS val 47314144 ecr 2939303507], length 137
05:09:14.327910 ens5  In  IP 54.86.40.233.9651 > 172.31.24.48.41110: Flags [.], ack 3002924655, win 9086, options [nop,nop,TS val 1470690616 ecr 2948740211], length 0
05:09:14.328058 ens5  In  IP 54.236.131.114.9651 > 172.31.24.48.60760: Flags [P.], seq 2402411860:2402411971, ack 1093257176, win 2719, options [nop,nop,TS val 1607730530 ecr 2357125773], length 111
05:09:14.328082 ens5  Out IP 172.31.24.48.60760 > 54.236.131.114.9651: Flags [.], ack 111, win 640, options [nop,nop,TS val 2357125776 ecr 1607730528], length 0
05:09:14.328148 ens5  Out IP 172.31.24.48.60760 > 54.236.131.114.9651: Flags [P.], seq 1:138, ack 111, win 640, options [nop,nop,TS val 2357125776 ecr 1607730528], length 137
05:09:14.328167 ens5  In  IP 34.203.168.140.9651 > 172.31.24.48.37058: Flags [P.], seq 1806722724:1806722835, ack 2221526189, win 7623, options [nop,nop,TS val 2441869122 ecr 4121503279], length 111
05:09:14.328363 ens5  Out IP 172.31.24.48.45806 > 34.195.184.106.9651: Flags [.], ack 1276150660, win 9558, options [nop,nop,TS val 1738411186 ecr 109780480], length 0
05:09:14.328367 ens5  In  IP 23.23.81.139.9651 > 172.31.24.48.41114: Flags [P.], seq 3296143267:3296143378, ack 249899305, win 13947, options [nop,nop,TS val 1537981420 ecr 3125985957], length 111
05:09:14.328390 ens5  Out IP 172.31.24.48.41114 > 23.23.81.139.9651: Flags [.], ack 111, win 7567, options [nop,nop,TS val 3125985966 ecr 1537981417], length 0
05:09:14.328454 ens5  Out IP 172.31.24.48.41114 > 23.23.81.139.9651: Flags [P.], seq 1:138, ack 111, win 7567, options [nop,nop,TS val 3125985966 ecr 1537981417], length 137
05:09:14.328931 ens5  In  IP 23.22.40.156.9651 > 172.31.24.48.39630: Flags [P.], seq 1995641598:1995641709, ack 1227494004, win 11640, options [nop,nop,TS val 1477477475 ecr 875981111], length 111
05:09:14.328944 ens5  Out IP 172.31.24.48.39630 > 23.22.40.156.9651: Flags [.], ack 111, win 6677, options [nop,nop,TS val 875981120 ecr 1477477473], length 0
05:09:14.328990 ens5  Out IP 172.31.24.48.39630 > 23.22.40.156.9651: Flags [P.], seq 1:138, ack 111, win 6677, options [nop,nop,TS val 875981120 ecr 1477477473], length 137
05:09:14.329189 ens5  In  IP 23.22.40.156.9651 > 172.31.24.48.39630: Flags [P.], seq 111:222, ack 1, win 11640, options [nop,nop,TS val 1477477476 ecr 875981111], length 111
05:09:14.329255 ens5  Out IP 172.31.24.48.39630 > 23.22.40.156.9651: Flags [P.], seq 138:275, ack 222, win 6677, options [nop,nop,TS val 875981120 ecr 1477477476], length 137
05:09:14.329601 ens5  In  IP 23.22.40.156.9651 > 172.31.24.48.39630: Flags [.], ack 275, win 11640, options [nop,nop,TS val 1477477476 ecr 875981120], length 0
05:09:14.329662 ens5  In  IP 54.226.62.214.9651 > 172.31.24.48.38348: Flags [.], ack 1081073511, win 11078, options [nop,nop,TS val 665227424 ecr 417785545], length 0
05:09:14.330029 ens5  In  IP 165.227.179.96.44234 > 172.31.24.48.9651: Flags [.], ack 858836558, win 1073, options [nop,nop,TS val 3972385081 ecr 1612434742], length 0
05:09:14.331738 ens5  In  IP 52.200.197.163.9651 > 172.31.24.48.47136: Flags [P.], seq 2373670562:2373670673, ack 2720605557, win 11462, options [nop,nop,TS val 1611244303 ecr 1991424418], length 111
05:09:14.331755 ens5  Out IP 172.31.24.48.47136 > 52.200.197.163.9651: Flags [.], ack 111, win 9647, options [nop,nop,TS val 1991424431 ecr 1611244295], length 0
05:09:14.331792 ens5  In  IP 34.195.184.106.9651 > 172.31.24.48.45806: Flags [P.], seq 1:112, ack 0, win 11568, options [nop,nop,TS val 109780525 ecr 1738411186], length 111
05:09:14.331808 ens5  Out IP 172.31.24.48.47136 > 52.200.197.163.9651: Flags [P.], seq 1:138, ack 111, win 9647, options [nop,nop,TS val 1991424431 ecr 1611244295], length 137
05:09:14.331810 ens5  Out IP 172.31.24.48.45806 > 34.195.184.106.9651: Flags [.], ack 112, win 9558, options [nop,nop,TS val 1738411189 ecr 109780525], length 0
05:09:14.331864 ens5  Out IP 172.31.24.48.45806 > 34.195.184.106.9651: Flags [P.], seq 0:137, ack 112, win 9558, options [nop,nop,TS val 1738411189 ecr 109780525], length 137
05:09:14.332039 ens5  In  IP 34.202.198.117.9651 > 172.31.24.48.52676: Flags [P.], seq 3124528115:3124528226, ack 2400322000, win 7664, options [nop,nop,TS val 2479180244 ecr 1589093943], length 111
05:09:14.332085 ens5  In  IP 98.82.251.216.9651 > 172.31.24.48.38364: Flags [P.], seq 2246555236:2246555347, ack 2906824576, win 12608, options [nop,nop,TS val 2429104101 ecr 1484831569], length 111
05:09:14.332099 ens5  Out IP 172.31.24.48.52676 > 34.202.198.117.9651: Flags [P.], seq 1:138, ack 111, win 12100, options [nop,nop,TS val 1589093985 ecr 2479180244], length 137
05:09:14.332101 ens5  Out IP 172.31.24.48.38364 > 98.82.251.216.9651: Flags [.], ack 111, win 6914, options [nop,nop,TS val 1484831591 ecr 2429104093], length 0
05:09:14.332148 ens5  In  IP 54.236.131.114.9651 > 172.31.24.48.60760: Flags [P.], seq 111:222, ack 138, win 2719, options [nop,nop,TS val 1607730534 ecr 2357125776], length 111
05:09:14.332158 ens5  Out IP 172.31.24.48.38364 > 98.82.251.216.9651: Flags [P.], seq 1:138, ack 111, win 6914, options [nop,nop,TS val 1484831591 ecr 2429104093], length 137
05:09:14.332199 ens5  Out IP 172.31.24.48.60760 > 54.236.131.114.9651: Flags [P.], seq 138:275, ack 222, win 640, options [nop,nop,TS val 2357125780 ecr 1607730534], length 137
05:09:14.332334 ens5  In  IP 44.219.130.13.42608 > 172.31.24.48.9651: Flags [P.], seq 569611487:569611598, ack 3596865082, win 443, options [nop,nop,TS val 855792899 ecr 2256435376], length 111
05:09:14.332369 ens5  Out IP 172.31.24.48.9651 > 44.219.130.13.42608: Flags [.], ack 111, win 660, options [nop,nop,TS val 2256435420 ecr 855792891], length 0
05:09:14.332416 ens5  Out IP 172.31.24.48.9651 > 44.219.130.13.42608: Flags [P.], seq 1:138, ack 111, win 660, options [nop,nop,TS val 2256435420 ecr 855792891], length 137
05:09:14.332435 ens5  In  IP 3.223.220.64.9651 > 172.31.24.48.38976: Flags [P.], seq 832787216:832787416, ack 3555365494, win 7867, options [nop,nop,TS val 624030092 ecr 3055955102], length 200
05:09:14.332517 ens5  Out IP 172.31.24.48.38976 > 3.223.220.64.9651: Flags [P.], seq 1:253, ack 200, win 9021, options [nop,nop,TS val 3055955111 ecr 624030092], length 252
05:09:14.332686 ens5  In  IP 98.82.251.216.9651 > 172.31.24.48.38364: Flags [P.], seq 111:222, ack 138, win 12608, options [nop,nop,TS val 2429104102 ecr 1484831591], length 111
05:09:14.332740 ens5  Out IP 172.31.24.48.38364 > 98.82.251.216.9651: Flags [P.], seq 138:275, ack 222, win 6914, options [nop,nop,TS val 1484831592 ecr 2429104102], length 137
05:09:14.332839 ens5  In  IP 104.236.110.97.53372 > 172.31.24.48.9651: Flags [.], ack 388601129, win 24576, options [nop,nop,TS val 1740925334 ecr 3854313106], length 0
05:09:14.333268 ens5  In  IP 165.227.179.96.44234 > 172.31.24.48.9651: Flags [P.], seq 0:252, ack 112, win 1073, options [nop,nop,TS val 3972385085 ecr 1612434744], length 252
05:09:14.333452 ens5  In  IP 54.225.236.76.9651 > 172.31.24.48.56632: Flags [P.], seq 4222535286:4222535396, ack 2154740500, win 442, options [nop,nop,TS val 3278123185 ecr 1030009167], length 110
05:09:14.333470 ens5  Out IP 172.31.24.48.56632 > 54.225.236.76.9651: Flags [.], ack 110, win 668, options [nop,nop,TS val 1030009177 ecr 3278123175], length 0
05:09:14.333523 ens5  Out IP 172.31.24.48.56632 > 54.225.236.76.9651: Flags [P.], seq 1:137, ack 110, win 668, options [nop,nop,TS val 1030009177 ecr 3278123175], length 136
05:09:14.333727 ens5  In  IP 34.197.125.83.44700 > 172.31.24.48.9651: Flags [P.], seq 3728204019:3728204130, ack 195624102, win 11732, options [nop,nop,TS val 3548195988 ecr 2656316509], length 111
05:09:14.333787 ens5  Out IP 172.31.24.48.9651 > 34.197.125.83.44700: Flags [P.], seq 1:138, ack 111, win 5636, options [nop,nop,TS val 2656316520 ecr 3548195988], length 137
05:09:14.333797 ens5  In  IP 18.235.252.133.57832 > 172.31.24.48.9651: Flags [P.], seq 402420136:402420247, ack 487837977, win 16568, options [nop,nop,TS val 235274932 ecr 170697875], length 111
05:09:14.333854 ens5  Out IP 172.31.24.48.9651 > 18.235.252.133.57832: Flags [P.], seq 1:138, ack 111, win 11471, options [nop,nop,TS val 170697902 ecr 235274932], length 137
05:09:14.334138 ens5  In  IP 3.232.45.182.9651 > 172.31.24.48.52246: Flags [P.], seq 2095746940:2095747051, ack 176995046, win 11307, options [nop,nop,TS val 3954146767 ecr 1926144856], length 111
05:09:14.334155 ens5  Out IP 172.31.24.48.52246 > 3.232.45.182.9651: Flags [.], ack 111, win 5876, options [nop,nop,TS val 1926144866 ecr 3954146757], length 0
05:09:14.334203 ens5  Out IP 172.31.24.48.52246 > 3.232.45.182.9651: Flags [P.], seq 1:138, ack 111, win 5876, options [nop,nop,TS val 1926144866 ecr 3954146757], length 137
05:09:14.334697 ens5  In  IP 18.207.171.20.9651 > 172.31.24.48.52252: Flags [P.], seq 775817699:775817810, ack 2161509434, win 22948, options [nop,nop,TS val 2053931698 ecr 3188470149], length 111
05:09:14.334718 ens5  Out IP 172.31.24.48.52252 > 18.207.171.20.9651: Flags [.], ack 111, win 20261, options [nop,nop,TS val 3188470187 ecr 2053931688], length 0
05:09:14.334767 ens5  Out IP 172.31.24.48.52252 > 18.207.171.20.9651: Flags [P.], seq 1:138, ack 111, win 20261, options [nop,nop,TS val 3188470187 ecr 2053931688], length 137
05:09:14.334961 ens5  In  IP 35.174.148.147.9651 > 172.31.24.48.51650: Flags [P.], seq 4117779522:4117779633, ack 653101738, win 16341, options [nop,nop,TS val 1621030559 ecr 2907049643], length 111
05:09:14.334980 ens5  Out IP 172.31.24.48.51650 > 35.174.148.147.9651: Flags [.], ack 111, win 7265, options [nop,nop,TS val 2907049652 ecr 1621030550], length 0
05:09:14.335029 ens5  Out IP 172.31.24.48.51650 > 35.174.148.147.9651: Flags [P.], seq 1:138, ack 111, win 7265, options [nop,nop,TS val 2907049652 ecr 1621030550], length 137
05:09:14.335049 ens5  In  IP 3.218.45.144.9651 > 172.31.24.48.59914: Flags [P.], seq 184075061:184075172, ack 3731786515, win 13202, options [nop,nop,TS val 3318393878 ecr 1787384159], length 111
05:09:14.335065 ens5  Out IP 172.31.24.48.59914 > 3.218.45.144.9651: Flags [.], ack 111, win 10454, options [nop,nop,TS val 1787384170 ecr 3318393867], length 0
05:09:14.335119 ens5  Out IP 172.31.24.48.59914 > 3.218.45.144.9651: Flags [P.], seq 1:138, ack 111, win 10454, options [nop,nop,TS val 1787384170 ecr 3318393867], length 137
05:09:14.335263 ens5  In  IP 3.230.225.34.9651 > 172.31.24.48.60692: Flags [P.], seq 1:112, ack 137, win 14539, options [nop,nop,TS val 2259350219 ecr 1239811644], length 111
05:09:14.335322 ens5  Out IP 172.31.24.48.60692 > 3.230.225.34.9651: Flags [P.], seq 137:274, ack 112, win 13092, options [nop,nop,TS val 1239811651 ecr 2259350219], length 137
05:09:14.335409 ens5  In  IP 54.86.40.233.9651 > 172.31.24.48.41110: Flags [P.], seq 0:111, ack 1, win 9086, options [nop,nop,TS val 1470690623 ecr 2948740211], length 111
05:09:14.335458 ens5  In  IP 104.236.110.97.53372 > 172.31.24.48.9651: Flags [P.], seq 0:482, ack 1, win 24576, options [nop,nop,TS val 1740925337 ecr 3854313106], length 482
05:09:14.335480 ens5  Out IP 172.31.24.48.41110 > 54.86.40.233.9651: Flags [P.], seq 1:138, ack 111, win 6964, options [nop,nop,TS val 2948740261 ecr 1470690623], length 137
05:09:14.335660 ens5  Out IP 172.31.24.48.41736 > 107.20.201.207.9651: Flags [P.], seq 2611036160:2611036271, ack 3366652910, win 9165, options [nop,nop,TS val 2353541986 ecr 1247777342], length 111
05:09:14.335671 ens5  Out IP 172.31.24.48.52128 > 3.225.79.249.9651: Flags [P.], seq 1482663025:1482663136, ack 2570100953, win 9582, options [nop,nop,TS val 3247293156 ecr 3056879264], length 111
05:09:14.335680 ens5  Out IP 172.31.24.48.52676 > 34.202.198.117.9651: Flags [P.], seq 138:249, ack 111, win 12100, options [nop,nop,TS val 1589093989 ecr 2479180244], length 111
05:09:14.335682 ens5  Out IP 172.31.24.48.9651 > 104.236.110.97.53372: Flags [P.], seq 1:112, ack 482, win 8315, options [nop,nop,TS val 3854313119 ecr 1740925337], length 111
05:09:14.335687 ens5  Out IP 172.31.24.48.52246 > 3.232.45.182.9651: Flags [P.], seq 138:249, ack 111, win 5876, options [nop,nop,TS val 1926144868 ecr 3954146757], length 111
05:09:14.335689 ens5  Out IP 172.31.24.48.9651 > 165.227.179.96.44234: Flags [P.], seq 112:223, ack 252, win 576, options [nop,nop,TS val 1612434754 ecr 3972385085], length 111
05:09:14.335698 ens5  Out IP 172.31.24.48.38348 > 54.226.62.214.9651: Flags [P.], seq 1:112, ack 0, win 9179, options [nop,nop,TS val 417785592 ecr 665227424], length 111
05:09:14.335702 ens5  Out IP 172.31.24.48.43460 > 54.85.9.116.9651: Flags [P.], seq 2188147424:2188147535, ack 3101364405, win 8351, options [nop,nop,TS val 797049901 ecr 1215847515], length 111
05:09:14.335708 ens5  Out IP 172.31.24.48.50438 > 54.197.55.84.9651: Flags [P.], seq 2345180244:2345180355, ack 1902035539, win 11393, options [nop,nop,TS val 1367353232 ecr 425493836], length 111
05:09:14.335716 ens5  Out IP 172.31.24.48.41854 > 98.83.188.107.9651: Flags [P.], seq 3306502568:3306502679, ack 2370932098, win 11714, options [nop,nop,TS val 3354240530 ecr 158758897], length 111
05:09:14.335719 ens5  Out IP 172.31.24.48.48956 > 54.174.93.130.9651: Flags [P.], seq 2817386497:2817386608, ack 1186804158, win 10558, options [nop,nop,TS val 3231141291 ecr 1726669081], length 111
05:09:14.335727 ens5  In  IP 54.86.40.233.9651 > 172.31.24.48.41110: Flags [.], ack 138, win 9086, options [nop,nop,TS val 1470690623 ecr 2948740261], length 0
05:09:14.335729 ens5  Out IP 172.31.24.48.37448 > 107.21.238.130.9651: Flags [P.], seq 1208417799:1208417910, ack 1724012991, win 9729, options [nop,nop,TS val 1932002492 ecr 162427984], length 111
05:09:14.335735 ens5  In  IP 3.223.220.64.9651 > 172.31.24.48.38976: Flags [P.], seq 200:311, ack 253, win 7867, options [nop,nop,TS val 624030096 ecr 3055955111], length 111
05:09:14.335737 ens5  Out IP 172.31.24.48.60082 > 3.227.69.165.9651: Flags [P.], seq 2691352614:2691352725, ack 115909060, win 10611, options [nop,nop,TS val 1638936798 ecr 213008798], length 111
05:09:14.335742 ens5  Out IP 172.31.24.48.9651 > 165.227.179.96.44234: Flags [P.], seq 223:334, ack 252, win 576, options [nop,nop,TS val 1612434754 ecr 3972385085], length 111
05:09:14.335745 ens5  Out IP 172.31.24.48.52676 > 34.202.198.117.9651: Flags [P.], seq 249:360, ack 111, win 12100, options [nop,nop,TS val 1589093989 ecr 2479180244], length 111
05:09:14.335748 ens5  Out IP 172.31.24.48.9651 > 44.219.130.13.42608: Flags [P.], seq 138:249, ack 111, win 660, options [nop,nop,TS val 2256435423 ecr 855792891], length 111
05:09:14.335753 ens5  Out IP 172.31.24.48.9651 > 104.236.110.97.53372: Flags [P.], seq 112:223, ack 482, win 8315, options [nop,nop,TS val 3854313119 ecr 1740925337], length 111
05:09:14.335759 ens5  Out IP 172.31.24.48.52790 > 44.223.151.51.9651: Flags [P.], seq 1892185117:1892185228, ack 4221738514, win 8133, options [nop,nop,TS val 2866345976 ecr 1540798477], length 111
05:09:14.335873 ens5  In  IP 165.227.179.96.44234 > 172.31.24.48.9651: Flags [P.], seq 252:389, ack 112, win 1073, options [nop,nop,TS val 3972385087 ecr 1612434744], length 137
05:09:14.335885 ens5  In  IP 34.202.198.117.9651 > 172.31.24.48.52676: Flags [.], ack 249, win 7664, options [nop,nop,TS val 2479180248 ecr 1589093985], length 0
05:09:14.335910 ens5  Out IP 172.31.24.48.45788 > 52.71.181.255.9651: Flags [P.], seq 3436342719:3436342830, ack 3534771590, win 11144, options [nop,nop,TS val 2846246199 ecr 3255497431], length 111
05:09:14.335921 ens5  Out IP 172.31.24.48.47728 > 3.228.129.216.9651: Flags [P.], seq 1485776656:1485776767, ack 2700105672, win 9971, options [nop,nop,TS val 1643715893 ecr 1816735771], length 111
05:09:14.335922 ens5  Out IP 172.31.24.48.54802 > 54.224.250.2.9651: Flags [P.], seq 2671334905:2671335016, ack 2163136553, win 5590, options [nop,nop,TS val 1430010488 ecr 293088331], length 111
05:09:14.335923 ens5  In  IP 34.202.198.117.9651 > 172.31.24.48.52676: Flags [P.], seq 111:248, ack 249, win 7664, options [nop,nop,TS val 2479180248 ecr 1589093985], length 137
05:09:14.335935 ens5  In  IP 3.225.79.249.9651 > 172.31.24.48.52128: Flags [.], ack 111, win 8165, options [nop,nop,TS val 3056879280 ecr 3247293140], length 0
05:09:14.335936 ens5  Out IP 172.31.24.48.38130 > 18.206.17.246.9651: Flags [P.], seq 1028101384:1028101495, ack 3757731401, win 8316, options [nop,nop,TS val 1591338726 ecr 544158210], length 111
05:09:14.335944 ens5  Out IP 172.31.24.48.59914 > 3.218.45.144.9651: Flags [P.], seq 138:249, ack 111, win 10454, options [nop,nop,TS val 1787384171 ecr 3318393867], length 111
05:09:14.335946 ens5  Out IP 172.31.24.48.52252 > 18.207.171.20.9651: Flags [P.], seq 138:249, ack 111, win 20261, options [nop,nop,TS val 3188470188 ecr 2053931688], length 111
05:09:14.335952 ens5  In  IP 54.226.62.214.9651 > 172.31.24.48.38348: Flags [.], ack 112, win 11078, options [nop,nop,TS val 665227430 ecr 417785592], length 0
05:09:14.335953 ens5  Out IP 172.31.24.48.47050 > 34.206.59.82.9651: Flags [P.], seq 783833720:783833831, ack 3845097941, win 10441, options [nop,nop,TS val 325666498 ecr 1776882923], length 111
05:09:14.335955 ens5  Out IP 172.31.24.48.9651 > 165.227.179.96.44234: Flags [P.], seq 334:445, ack 389, win 575, options [nop,nop,TS val 1612434754 ecr 3972385087], length 111
05:09:14.335960 ens5  Out IP 172.31.24.48.55352 > 35.169.66.196.9651: Flags [P.], seq 1717989962:1717990073, ack 135133889, win 7448, options [nop,nop,TS val 3522165616 ecr 3700525503], length 111
05:09:14.335964 ens5  In  IP 3.232.45.182.9651 > 172.31.24.48.52246: Flags [.], ack 249, win 11307, options [nop,nop,TS val 3954146769 ecr 1926144866], length 0
05:09:14.335966 ens5  Out IP 172.31.24.48.44028 > 23.21.27.140.9651: Flags [P.], seq 2818768781:2818768892, ack 1420816130, win 12506, options [nop,nop,TS val 4163287647 ecr 3804641250], length 111
05:09:14.335973 ens5  Out IP 172.31.24.48.51650 > 35.174.148.147.9651: Flags [P.], seq 138:249, ack 111, win 7265, options [nop,nop,TS val 2907049653 ecr 1621030550], length 111
05:09:14.335977 ens5  Out IP 172.31.24.48.36776 > 34.202.51.225.9651: Flags [P.], seq 3132944385:3132944496, ack 3283143380, win 11832, options [nop,nop,TS val 12612685 ecr 1096580384], length 111
05:09:14.335977 ens5  In  IP 54.226.62.214.9651 > 172.31.24.48.38348: Flags [P.], seq 0:137, ack 112, win 11078, options [nop,nop,TS val 665227430 ecr 417785592], length 137
05:09:14.335988 ens5  In  IP 44.219.130.13.42608 > 172.31.24.48.9651: Flags [.], ack 249, win 443, options [nop,nop,TS val 855792903 ecr 2256435420], length 0
05:09:14.335988 ens5  In  IP 3.225.79.249.9651 > 172.31.24.48.52128: Flags [P.], seq 1:138, ack 111, win 8165, options [nop,nop,TS val 3056879280 ecr 3247293140], length 137
05:09:14.336000 ens5  In  IP 34.202.198.117.9651 > 172.31.24.48.52676: Flags [P.], seq 248:385, ack 360, win 7664, options [nop,nop,TS val 2479180248 ecr 1589093989], length 137
05:09:14.336008 ens5  Out IP 172.31.24.48.52676 > 34.202.198.117.9651: Flags [.], ack 385, win 12100, options [nop,nop,TS val 1589093989 ecr 2479180248], length 0
05:09:14.336011 ens5  Out IP 172.31.24.48.38976 > 3.223.220.64.9651: Flags [P.], seq 253:479, ack 311, win 9021, options [nop,nop,TS val 3055955114 ecr 624030096], length 226
05:09:14.336021 ens5  Out IP 172.31.24.48.53880 > 23.21.204.131.9651: Flags [P.], seq 138:249, ack 111, win 11372, options [nop,nop,TS val 47314152 ecr 2939303507], length 111
05:09:14.336025 ens5  In  IP 3.227.69.165.9651 > 172.31.24.48.60082: Flags [P.], seq 1:138, ack 111, win 11943, options [nop,nop,TS val 213008824 ecr 1638936798], length 137
05:09:14.336027 ens5  In  IP 107.20.201.207.9651 > 172.31.24.48.41736: Flags [.], ack 111, win 16710, options [nop,nop,TS val 1247777352 ecr 2353541976], length 0
05:09:14.336031 ens5  Out IP 172.31.24.48.9651 > 104.236.110.97.53372: Flags [P.], seq 223:334, ack 482, win 8315, options [nop,nop,TS val 3854313119 ecr 1740925337], length 111
05:09:14.336050 ens5  In  IP 98.83.188.107.9651 > 172.31.24.48.41854: Flags [.], ack 111, win 12040, options [nop,nop,TS val 158758930 ecr 3354240497], length 0
05:09:14.336052 ens5  In  IP 44.219.130.13.42608 > 172.31.24.48.9651: Flags [P.], seq 111:248, ack 249, win 443, options [nop,nop,TS val 855792903 ecr 2256435420], length 137
05:09:14.336052 ens5  In  IP 3.232.45.182.9651 > 172.31.24.48.52246: Flags [P.], seq 111:248, ack 249, win 11307, options [nop,nop,TS val 3954146769 ecr 1926144866], length 137
05:09:14.336067 ens5  In  IP 54.174.93.130.9651 > 172.31.24.48.48956: Flags [.], ack 111, win 15535, options [nop,nop,TS val 1726669144 ecr 3231141265], length 0
05:09:14.336093 ens5  In  IP 54.158.175.165.54866 > 172.31.24.48.9651: Flags [P.], seq 3056566091:3056566202, ack 3576633545, win 7231, options [nop,nop,TS val 1637878408 ecr 333801122], length 111
05:09:14.336111 ens5  Out IP 172.31.24.48.9651 > 54.158.175.165.54866: Flags [.], ack 111, win 12788, options [nop,nop,TS val 333801135 ecr 1637878396], length 0
05:09:14.336112 ens5  In  IP 98.83.188.107.9651 > 172.31.24.48.41854: Flags [P.], seq 1:138, ack 111, win 12040, options [nop,nop,TS val 158758930 ecr 3354240497], length 137
05:09:14.336165 ens5  In  IP 107.20.201.207.9651 > 172.31.24.48.41736: Flags [P.], seq 1:138, ack 111, win 16710, options [nop,nop,TS val 1247777353 ecr 2353541976], length 137
05:09:14.336205 ens5  In  IP 18.207.171.20.9651 > 172.31.24.48.52252: Flags [.], ack 249, win 22948, options [nop,nop,TS val 2053931700 ecr 3188470187], length 0
05:09:14.336226 ens5  In  IP 35.174.148.147.9651 > 172.31.24.48.51650: Flags [.], ack 249, win 16341, options [nop,nop,TS val 1621030560 ecr 2907049652], length 0
05:09:14.336236 ens5  In  IP 18.207.171.20.9651 > 172.31.24.48.52252: Flags [P.], seq 111:248, ack 249, win 22948, options [nop,nop,TS val 2053931700 ecr 3188470187], length 137
05:09:14.336266 ens5  Out IP 172.31.24.48.9651 > 104.236.110.97.53372: Flags [P.], seq 334:445, ack 482, win 8315, options [nop,nop,TS val 3854313119 ecr 1740925337], length 111
05:09:14.336279 ens5  In  IP 52.71.181.255.9651 > 172.31.24.48.45788: Flags [P.], seq 1:138, ack 111, win 20053, options [nop,nop,TS val 3255497443 ecr 2846246199], length 137
05:09:14.336280 ens5  Out IP 172.31.24.48.59914 > 3.218.45.144.9651: Flags [P.], seq 249:360, ack 111, win 10454, options [nop,nop,TS val 1787384171 ecr 3318393867], length 111
05:09:14.336281 ens5  Out IP 172.31.24.48.9651 > 165.227.179.96.44234: Flags [P.], seq 445:556, ack 389, win 576, options [nop,nop,TS val 1612434754 ecr 3972385087], length 111
05:09:14.336288 ens5  In  IP 3.218.45.144.9651 > 172.31.24.48.59914: Flags [.], ack 249, win 13202, options [nop,nop,TS val 3318393880 ecr 1787384170], length 0
05:09:14.336296 ens5  In  IP 35.174.148.147.9651 > 172.31.24.48.51650: Flags [P.], seq 111:248, ack 249, win 16341, options [nop,nop,TS val 1621030560 ecr 2907049652], length 137
05:09:14.336302 ens5  Out IP 172.31.24.48.57046 > 3.93.84.116.9651: Flags [P.], seq 1900685059:1900685170, ack 2772363809, win 11083, options [nop,nop,TS val 2791546772 ecr 461889750], length 111
05:09:14.336303 ens5  Out IP 172.31.24.48.41854 > 98.83.188.107.9651: Flags [P.], seq 111:222, ack 138, win 11714, options [nop,nop,TS val 3354240530 ecr 158758930], length 111
05:09:14.336314 ens5  Out IP 172.31.24.48.46634 > 34.196.243.223.9651: Flags [P.], seq 2108694557:2108694668, ack 3208395299, win 8265, options [nop,nop,TS val 751670357 ecr 2540179115], length 111
05:09:14.336314 ens5  Out IP 172.31.24.48.52676 > 34.202.198.117.9651: Flags [P.], seq 360:471, ack 385, win 12100, options [nop,nop,TS val 1589093989 ecr 2479180248], length 111
05:09:14.336322 ens5  In  IP 34.202.51.225.9651 > 172.31.24.48.36776: Flags [P.], seq 1:138, ack 111, win 14063, options [nop,nop,TS val 1096580402 ecr 12612685], length 137
05:09:14.336325 ens5  Out IP 172.31.24.48.41114 > 23.23.81.139.9651: Flags [P.], seq 138:249, ack 111, win 7567, options [nop,nop,TS val 3125985973 ecr 1537981417], length 111
05:09:14.336327 ens5  Out IP 172.31.24.48.43448 > 18.235.227.173.9651: Flags [P.], seq 816563442:816563553, ack 1894983242, win 648, options [nop,nop,TS val 1277921663 ecr 3205945102], length 111
05:09:14.336329 ens5  In  IP 23.21.204.131.9651 > 172.31.24.48.53880: Flags [.], ack 249, win 10215, options [nop,nop,TS val 2939303517 ecr 47314144], length 0
05:09:14.336336 ens5  Out IP 172.31.24.48.47718 > 52.3.189.202.9651: Flags [P.], seq 2459825659:2459825770, ack 3496499349, win 11985, options [nop,nop,TS val 3022123926 ecr 2013757436], length 111
05:09:14.336340 ens5  In  IP 3.223.220.64.9651 > 172.31.24.48.38976: Flags [P.], seq 311:448, ack 479, win 7867, options [nop,nop,TS val 624030096 ecr 3055955114], length 137
05:09:14.336340 ens5  In  IP 34.206.59.82.9651 > 172.31.24.48.47050: Flags [P.], seq 1:138, ack 111, win 9656, options [nop,nop,TS val 1776882935 ecr 325666498], length 137
05:09:14.336359 ens5  In  IP 18.206.17.246.9651 > 172.31.24.48.38130: Flags [P.], seq 1:138, ack 111, win 9422, options [nop,nop,TS val 544158223 ecr 1591338726], length 137
05:09:14.336363 ens5  Out IP 172.31.24.48.9651 > 54.158.175.165.54866: Flags [P.], seq 1:138, ack 111, win 12788, options [nop,nop,TS val 333801136 ecr 1637878396], length 137
05:09:14.336365 ens5  In  IP 3.218.45.144.9651 > 172.31.24.48.59914: Flags [P.], seq 111:248, ack 249, win 13202, options [nop,nop,TS val 3318393880 ecr 1787384170], length 137
05:09:14.336376 ens5  Out IP 172.31.24.48.44936 > 35.168.79.8.9651: Flags [P.], seq 222422611:222422722, ack 1941989187, win 20326, options [nop,nop,TS val 3579527717 ecr 3814057760], length 111
05:09:14.336391 ens5  In  IP 35.169.66.196.9651 > 172.31.24.48.55352: Flags [.], ack 111, win 5870, options [nop,nop,TS val 3700525516 ecr 3522165604], length 0
05:09:14.336396 ens5  Out IP 172.31.24.48.41664 > 18.215.11.46.9651: Flags [P.], seq 2365715650:2365715761, ack 1149835697, win 12941, options [nop,nop,TS val 3087673862 ecr 2186926686], length 111
05:09:14.336397 ens5  In  IP 44.223.151.51.9651 > 172.31.24.48.52790: Flags [P.], seq 1:138, ack 111, win 10885, options [nop,nop,TS val 1540798490 ecr 2866345976], length 137
05:09:14.336408 ens5  In  IP 23.21.204.131.9651 > 172.31.24.48.53880: Flags [P.], seq 111:248, ack 249, win 10215, options [nop,nop,TS val 2939303517 ecr 47314144], length 137
05:09:14.336411 ens5  In  IP 54.174.93.130.9651 > 172.31.24.48.48956: Flags [P.], seq 1:138, ack 111, win 15535, options [nop,nop,TS val 1726669145 ecr 3231141265], length 137
05:09:14.336417 ens5  Out IP 172.31.24.48.9651 > 98.82.240.103.43392: Flags [P.], seq 2795313314:2795313425, ack 3359228251, win 8907, options [nop,nop,TS val 1147196551 ecr 2775857482], length 111
05:09:14.336429 ens5  In  IP 52.70.38.106.9651 > 172.31.24.48.52202: Flags [P.], seq 1322246849:1322246960, ack 90008179, win 17495, options [nop,nop,TS val 3683436318 ecr 2183010775], length 111
05:09:14.336437 ens5  Out IP 172.31.24.48.52202 > 52.70.38.106.9651: Flags [P.], seq 1:112, ack 111, win 12792, options [nop,nop,TS val 2183010788 ecr 3683436306], length 111
05:09:14.336449 ens5  In  IP 54.85.9.116.9651 > 172.31.24.48.43460: Flags [P.], seq 1:138, ack 111, win 10325, options [nop,nop,TS val 1215847528 ecr 797049901], length 137
05:09:14.336474 ens5  In  IP 23.21.27.140.9651 > 172.31.24.48.44028: Flags [P.], seq 1:138, ack 111, win 9782, options [nop,nop,TS val 3804641260 ecr 4163287647], length 137
05:09:14.336503 ens5  In  IP 54.197.55.84.9651 > 172.31.24.48.50438: Flags [P.], seq 1:138, ack 111, win 16054, options [nop,nop,TS val 425493849 ecr 1367353232], length 137
05:09:14.336560 ens5  Out IP 172.31.24.48.52202 > 52.70.38.106.9651: Flags [P.], seq 112:249, ack 111, win 12793, options [nop,nop,TS val 2183010788 ecr 3683436306], length 137
05:09:14.336567 ens5  In  IP 35.169.66.196.9651 > 172.31.24.48.55352: Flags [P.], seq 1:138, ack 111, win 5870, options [nop,nop,TS val 3700525516 ecr 3522165604], length 137
05:09:14.336589 ens5  In  IP 52.70.38.106.9651 > 172.31.24.48.52202: Flags [P.], seq 111:222, ack 1, win 17495, options [nop,nop,TS val 3683436318 ecr 2183010775], length 111
05:09:14.336599 ens5  In  IP 98.83.188.107.9651 > 172.31.24.48.41854: Flags [P.], seq 138:275, ack 222, win 12040, options [nop,nop,TS val 158758931 ecr 3354240530], length 137
05:09:14.336604 ens5  In  IP 107.21.238.130.9651 > 172.31.24.48.37448: Flags [P.], seq 1:138, ack 111, win 8317, options [nop,nop,TS val 162427995 ecr 1932002492], length 137
05:09:14.336604 ens5  In  IP 52.3.189.202.9651 > 172.31.24.48.47718: Flags [.], ack 111, win 8114, options [nop,nop,TS val 2013757462 ecr 3022123901], length 0
05:09:14.336604 ens5  In  IP 23.23.81.139.9651 > 172.31.24.48.41114: Flags [.], ack 249, win 13947, options [nop,nop,TS val 1537981428 ecr 3125985966], length 0
05:09:14.336605 ens5  In  IP 34.196.243.223.9651 > 172.31.24.48.46634: Flags [.], ack 111, win 8979, options [nop,nop,TS val 2540179126 ecr 751670347], length 0
05:09:14.336604 ens5  In  IP 52.3.189.202.9651 > 172.31.24.48.47718: Flags [P.], seq 1:138, ack 111, win 8114, options [nop,nop,TS val 2013757462 ecr 3022123901], length 137
05:09:14.336622 ens5  In  IP 18.235.227.173.9651 > 172.31.24.48.43448: Flags [.], ack 111, win 442, options [nop,nop,TS val 3205945113 ecr 1277921652], length 0
05:09:14.336635 ens5  In  IP 35.168.79.8.9651 > 172.31.24.48.44936: Flags [.], ack 111, win 10478, options [nop,nop,TS val 3814057769 ecr 3579527708], length 0
05:09:14.336666 ens5  In  IP 3.93.84.116.9651 > 172.31.24.48.57046: Flags [.], ack 111, win 13319, options [nop,nop,TS val 461889768 ecr 2791546755], length 0
05:09:14.336687 ens5  In  IP 3.230.225.34.9651 > 172.31.24.48.60692: Flags [P.], seq 112:223, ack 274, win 14539, options [nop,nop,TS val 2259350220 ecr 1239811651], length 111
05:09:14.336693 ens5  In  IP 34.202.198.117.9651 > 172.31.24.48.52676: Flags [P.], seq 385:522, ack 471, win 7664, options [nop,nop,TS val 2479180249 ecr 1589093989], length 137
05:09:14.336705 ens5  In  IP 34.196.243.223.9651 > 172.31.24.48.46634: Flags [P.], seq 1:138, ack 111, win 8979, options [nop,nop,TS val 2540179126 ecr 751670347], length 137
05:09:14.336716 ens5  In  IP 23.23.81.139.9651 > 172.31.24.48.41114: Flags [P.], seq 111:248, ack 249, win 13947, options [nop,nop,TS val 1537981428 ecr 3125985966], length 137
05:09:14.336717 ens5  In  IP 3.218.45.144.9651 > 172.31.24.48.59914: Flags [P.], seq 248:385, ack 360, win 13202, options [nop,nop,TS val 3318393880 ecr 1787384171], length 137
05:09:14.336718 ens5  In  IP 3.93.84.116.9651 > 172.31.24.48.57046: Flags [P.], seq 1:138, ack 111, win 13319, options [nop,nop,TS val 461889768 ecr 2791546755], length 137
05:09:14.336740 ens5  Out IP 172.31.24.48.52202 > 52.70.38.106.9651: Flags [P.], seq 249:386, ack 222, win 12793, options [nop,nop,TS val 2183010788 ecr 3683436318], length 137
05:09:14.336750 ens5  Out IP 172.31.24.48.59914 > 3.218.45.144.9651: Flags [.], ack 385, win 10454, options [nop,nop,TS val 1787384172 ecr 3318393880], length 0
05:09:14.336764 ens5  In  IP 3.230.225.34.9651 > 172.31.24.48.60692: Flags [P.], seq 223:334, ack 274, win 14539, options [nop,nop,TS val 2259350220 ecr 1239811651], length 111
05:09:14.336777 ens5  Out IP 172.31.24.48.60692 > 3.230.225.34.9651: Flags [P.], seq 274:411, ack 334, win 13091, options [nop,nop,TS val 1239811653 ecr 2259350220], length 137
05:09:14.336780 ens5  In  IP 54.224.250.2.9651 > 172.31.24.48.54802: Flags [P.], seq 1:138, ack 111, win 10636, options [nop,nop,TS val 293088342 ecr 1430010488], length 137
05:09:14.336838 ens5  Out IP 172.31.24.48.60692 > 3.230.225.34.9651: Flags [P.], seq 411:548, ack 334, win 13092, options [nop,nop,TS val 1239811653 ecr 2259350220], length 137
05:09:14.336892 ens5  In  IP 52.70.38.106.9651 > 172.31.24.48.52202: Flags [.], ack 249, win 17495, options [nop,nop,TS val 3683436318 ecr 2183010788], length 0
05:09:14.336927 ens5  In  IP 35.168.79.8.9651 > 172.31.24.48.44936: Flags [P.], seq 1:138, ack 111, win 10478, options [nop,nop,TS val 3814057770 ecr 3579527708], length 137
05:09:14.336929 ens5  In  IP 3.228.129.216.9651 > 172.31.24.48.47728: Flags [P.], seq 1:138, ack 111, win 10409, options [nop,nop,TS val 1816735782 ecr 1643715893], length 137
05:09:14.336945 ens5  In  IP 18.215.11.46.9651 > 172.31.24.48.41664: Flags [P.], seq 1:138, ack 111, win 12391, options [nop,nop,TS val 2186926699 ecr 3087673862], length 137
05:09:14.337134 ens5  In  IP 52.70.38.106.9651 > 172.31.24.48.52202: Flags [P.], seq 222:359, ack 386, win 17495, options [nop,nop,TS val 3683436319 ecr 2183010788], length 137
05:09:14.337157 ens5  In  IP 98.82.240.103.43392 > 172.31.24.48.9651: Flags [.], ack 111, win 8265, options [nop,nop,TS val 2775857494 ecr 1147196539], length 0
05:09:14.337182 ens5  In  IP 3.230.225.34.9651 > 172.31.24.48.60692: Flags [.], ack 548, win 14539, options [nop,nop,TS val 2259350220 ecr 1239811653], length 0
05:09:14.337207 ens5  In  IP 98.82.240.103.43392 > 172.31.24.48.9651: Flags [P.], seq 1:138, ack 111, win 8265, options [nop,nop,TS val 2775857494 ecr 1147196539], length 137
05:09:14.337250 ens5  In  IP 18.235.227.173.9651 > 172.31.24.48.43448: Flags [P.], seq 1:138, ack 111, win 442, options [nop,nop,TS val 3205945114 ecr 1277921652], length 137
05:09:14.337385 ens5  In  IP 44.214.160.107.9651 > 172.31.24.48.43838: Flags [P.], seq 167869449:167869560, ack 631978532, win 8493, options [nop,nop,TS val 1195387689 ecr 3591109619], length 111
05:09:14.337403 ens5  Out IP 172.31.24.48.43838 > 44.214.160.107.9651: Flags [.], ack 111, win 9056, options [nop,nop,TS val 3591109638 ecr 1195387689], length 0
05:09:14.337450 ens5  Out IP 172.31.24.48.43838 > 44.214.160.107.9651: Flags [P.], seq 1:138, ack 111, win 9056, options [nop,nop,TS val 3591109638 ecr 1195387689], length 137
05:09:14.337705 ens5  In  IP 54.146.211.74.9651 > 172.31.24.48.50494: Flags [P.], seq 3827663468:3827663579, ack 3714847899, win 9138, options [nop,nop,TS val 2057970386 ecr 1981789155], length 111
05:09:14.337723 ens5  Out IP 172.31.24.48.50494 > 54.146.211.74.9651: Flags [.], ack 111, win 12288, options [nop,nop,TS val 1981789173 ecr 2057970372], length 0
05:09:14.337795 ens5  Out IP 172.31.24.48.50494 > 54.146.211.74.9651: Flags [P.], seq 1:138, ack 111, win 12288, options [nop,nop,TS val 1981789173 ecr 2057970372], length 137
05:09:14.337818 ens5  In  IP 3.93.84.116.9651 > 172.31.24.48.57046: Flags [P.], seq 138:249, ack 111, win 13319, options [nop,nop,TS val 461889769 ecr 2791546755], length 111
05:09:14.337834 ens5  Out IP 172.31.24.48.57046 > 3.93.84.116.9651: Flags [.], ack 249, win 11083, options [nop,nop,TS val 2791546774 ecr 461889768], length 0
05:09:14.337843 ens5  In  IP 107.21.238.130.9651 > 172.31.24.48.37448: Flags [P.], seq 138:249, ack 111, win 8317, options [nop,nop,TS val 162427996 ecr 1932002492], length 111
05:09:14.337879 ens5  Out IP 172.31.24.48.37448 > 107.21.238.130.9651: Flags [.], ack 249, win 9729, options [nop,nop,TS val 1932002494 ecr 162427995], length 0
05:09:14.337896 ens5  Out IP 172.31.24.48.57046 > 3.93.84.116.9651: Flags [P.], seq 111:248, ack 249, win 11083, options [nop,nop,TS val 2791546774 ecr 461889768], length 137
05:09:14.337900 ens5  In  IP 52.45.71.227.9651 > 172.31.24.48.53982: Flags [P.], seq 2918781436:2918781547, ack 2484193050, win 14806, options [nop,nop,TS val 1760549375 ecr 2876245531], length 111
05:09:14.337912 ens5  In  IP 54.227.196.194.9651 > 172.31.24.48.35878: Flags [P.], seq 445600535:445600646, ack 4153351066, win 9548, options [nop,nop,TS val 1303584868 ecr 2720885818], length 111
05:09:14.337927 ens5  Out IP 172.31.24.48.35878 > 54.227.196.194.9651: Flags [.], ack 111, win 8423, options [nop,nop,TS val 2720885858 ecr 1303584840], length 0
05:09:14.337932 ens5  Out IP 172.31.24.48.53982 > 52.45.71.227.9651: Flags [.], ack 111, win 10418, options [nop,nop,TS val 2876245543 ecr 1760549363], length 0
05:09:14.337939 ens5  Out IP 172.31.24.48.37448 > 107.21.238.130.9651: Flags [P.], seq 111:248, ack 249, win 9729, options [nop,nop,TS val 1932002494 ecr 162427995], length 137
05:09:14.337983 ens5  Out IP 172.31.24.48.53982 > 52.45.71.227.9651: Flags [P.], seq 1:138, ack 111, win 10418, options [nop,nop,TS val 2876245543 ecr 1760549363], length 137
05:09:14.337990 ens5  Out IP 172.31.24.48.35878 > 54.227.196.194.9651: Flags [P.], seq 1:138, ack 111, win 8423, options [nop,nop,TS val 2720885858 ecr 1303584840], length 137
05:09:14.338423 ens5  In  IP 98.80.46.175.9651 > 172.31.24.48.42418: Flags [P.], seq 3705411054:3705411165, ack 4128152417, win 14747, options [nop,nop,TS val 285157462 ecr 2820488122], length 111
05:09:14.338484 ens5  Out IP 172.31.24.48.42418 > 98.80.46.175.9651: Flags [P.], seq 1:138, ack 111, win 8856, options [nop,nop,TS val 2820488155 ecr 285157462], length 137
05:09:14.338640 ens5  In  IP 107.20.201.207.9651 > 172.31.24.48.41736: Flags [P.], seq 138:249, ack 111, win 16710, options [nop,nop,TS val 1247777355 ecr 2353541976], length 111
05:09:14.338657 ens5  Out IP 172.31.24.48.41736 > 107.20.201.207.9651: Flags [.], ack 249, win 9165, options [nop,nop,TS val 2353541989 ecr 1247777353], length 0
05:09:14.338716 ens5  Out IP 172.31.24.48.41736 > 107.20.201.207.9651: Flags [P.], seq 111:248, ack 249, win 9165, options [nop,nop,TS val 2353541989 ecr 1247777353], length 137
05:09:14.338998 ens5  In  IP 54.197.102.41.37078 > 172.31.24.48.9651: Flags [P.], seq 2693868836:2693868946, ack 1369502613, win 443, options [nop,nop,TS val 4264311571 ecr 1551823572], length 110
05:09:14.339055 ens5  Out IP 172.31.24.48.9651 > 54.197.102.41.37078: Flags [P.], seq 1:137, ack 110, win 4110, options [nop,nop,TS val 1551823603 ecr 4264311571], length 136
05:09:14.339362 ens5  In  IP 98.82.251.216.9651 > 172.31.24.48.38364: Flags [P.], seq 222:333, ack 275, win 12608, options [nop,nop,TS val 2429104108 ecr 1484831592], length 111
05:09:14.339431 ens5  Out IP 172.31.24.48.38364 > 98.82.251.216.9651: Flags [P.], seq 275:412, ack 333, win 6914, options [nop,nop,TS val 1484831599 ecr 2429104108], length 137
05:09:14.339539 ens5  In  IP 50.19.151.55.9651 > 172.31.24.48.53180: Flags [P.], seq 3192664806:3192664917, ack 1957559769, win 14365, options [nop,nop,TS val 4271748399 ecr 432498817], length 111
05:09:14.339553 ens5  Out IP 172.31.24.48.53180 > 50.19.151.55.9651: Flags [.], ack 111, win 11149, options [nop,nop,TS val 432498831 ecr 4271748385], length 0
05:09:14.339558 ens5  In  IP 174.129.137.236.60710 > 172.31.24.48.9651: Flags [P.], seq 3312335235:3312335346, ack 1295874065, win 8692, options [nop,nop,TS val 1676952775 ecr 2797048978], length 111
