tcpdump: data link type LINUX_SLL2
tcpdump: verbose output suppressed, use -v[v]... for full protocol decode
listening on any, link-type LINUX_SLL2 (Linux cooked v2), snapshot length 262144 bytes
05:14:07.228158 ens5  In  IP 18.206.17.246.9651 > 172.31.17.110.49992: Flags [P.], seq 3851711467:3851711578, ack 1703204255, win 10191, options [nop,nop,TS val 3912735567 ecr 556490988], length 111
05:14:07.228160 ens5  Out IP 172.31.17.110.47444 > 35.169.184.86.9651: Flags [P.], seq 1959285569:1959285706, ack 4246010085, win 23571, options [nop,nop,TS val 1912350646 ecr 3506495592], length 137
05:14:07.228174 ens5  Out IP 172.31.17.110.49992 > 18.206.17.246.9651: Flags [.], ack 111, win 14310, options [nop,nop,TS val 556490994 ecr 3912735561], length 0
05:14:07.228185 ens5  In  IP 44.223.151.51.9651 > 172.31.17.110.56970: Flags [P.], seq 2732133914:2732134025, ack 1525562733, win 21454, options [nop,nop,TS val 2013444622 ecr 589472811], length 111
05:14:07.228263 ens5  Out IP 172.31.17.110.56970 > 44.223.151.51.9651: Flags [P.], seq 138:275, ack 111, win 31882, options [nop,nop,TS val 589472838 ecr 2013444622], length 137
05:14:07.228276 ens5  Out IP 172.31.17.110.49992 > 18.206.17.246.9651: Flags [P.], seq 1:138, ack 111, win 14310, options [nop,nop,TS val 556490994 ecr 3912735561], length 137
05:14:07.228451 ens5  In  IP 104.236.110.97.49436 > 172.31.17.110.9651: Flags [.], ack 619539826, win 10274, options [nop,nop,TS val 2395134748 ecr 2068376801], length 0
05:14:07.228485 ens5  In  IP 18.206.17.246.9651 > 172.31.17.110.49992: Flags [P.], seq 111:222, ack 1, win 10191, options [nop,nop,TS val 3912735567 ecr 556490994], length 111
05:14:07.228557 ens5  Out IP 172.31.17.110.49992 > 18.206.17.246.9651: Flags [P.], seq 138:275, ack 222, win 14310, options [nop,nop,TS val 556490994 ecr 3912735567], length 137
05:14:07.228564 ens5  In  IP 52.71.181.255.9651 > 172.31.17.110.33626: Flags [P.], seq 1536890698:1536890809, ack 3671584639, win 23966, options [nop,nop,TS val 1436199564 ecr 256505100], length 111
05:14:07.228569 ens5  In  IP 104.236.110.97.49436 > 172.31.17.110.9651: Flags [P.], seq 0:252, ack 112, win 10274, options [nop,nop,TS val 2395134748 ecr 2068376807], length 252
05:14:07.228607 ens5  In  IP 98.83.188.107.9651 > 172.31.17.110.34106: Flags [P.], seq 1660865801:1660865970, ack 3726926668, win 9524, options [nop,nop,TS val 136854372 ecr 3268388466], length 169
05:14:07.228675 ens5  In  IP 44.223.151.51.9651 > 172.31.17.110.56970: Flags [.], ack 275, win 21454, options [nop,nop,TS val 2013444623 ecr 589472838], length 0
05:14:07.228723 ens5  In  IP 104.236.110.97.49436 > 172.31.17.110.9651: Flags [P.], seq 252:389, ack 112, win 10274, options [nop,nop,TS val 2395134748 ecr 2068376807], length 137
05:14:07.228752 ens5  Out IP 172.31.17.110.9651 > 104.236.110.97.49436: Flags [.], ack 389, win 11049, options [nop,nop,TS val 2068376813 ecr 2395134748], length 0
05:14:07.228796 ens5  In  IP 18.206.17.246.9651 > 172.31.17.110.49992: Flags [.], ack 275, win 10191, options [nop,nop,TS val 3912735567 ecr 556490994], length 0
05:14:07.228802 ens5  Out IP 172.31.17.110.9651 > 18.235.227.173.53046: Flags [P.], seq 3166756777:3166756888, ack 285860234, win 442, options [nop,nop,TS val 1266569409 ecr 1872913380], length 111
05:14:07.228817 ens5  Out IP 172.31.17.110.33320 > 54.225.236.76.9651: Flags [P.], seq 2538151717:2538151828, ack 1038208268, win 443, options [nop,nop,TS val 3503456515 ecr 3521363829], length 111
05:14:07.228829 ens5  Out IP 172.31.17.110.9651 > 23.22.40.156.37264: Flags [P.], seq 201622509:201622620, ack 3202736837, win 17653, options [nop,nop,TS val 413163928 ecr 3622428454], length 111
05:14:07.228839 ens5  Out IP 172.31.17.110.42014 > 35.174.148.147.9651: Flags [P.], seq 900171705:900171816, ack 2967071111, win 9621, options [nop,nop,TS val 755555688 ecr 3293456687], length 111
05:14:07.228857 ens5  Out IP 172.31.17.110.37372 > 54.85.9.116.9651: Flags [P.], seq 503993571:503993682, ack 3328761687, win 17661, options [nop,nop,TS val 1229910905 ecr 2497867690], length 111
05:14:07.228861 ens5  Out IP 172.31.17.110.9651 > 52.54.223.196.46000: Flags [P.], seq 2336298999:2336299110, ack 1843189703, win 9053, options [nop,nop,TS val 1271808825 ecr 994341387], length 111
05:14:07.228871 ens5  Out IP 172.31.17.110.9651 > 35.169.66.196.35958: Flags [P.], seq 456822539:456822650, ack 3930872898, win 8678, options [nop,nop,TS val 3309766286 ecr 1670276456], length 111
05:14:07.228872 ens5  Out IP 172.31.17.110.9651 > 104.236.110.97.49436: Flags [P.], seq 223:334, ack 389, win 11049, options [nop,nop,TS val 2068376813 ecr 2395134748], length 111
05:14:07.228883 ens5  Out IP 172.31.17.110.9651 > 34.205.163.144.47656: Flags [P.], seq 2747350495:2747350606, ack 996057711, win 13856, options [nop,nop,TS val 326266377 ecr 532269092], length 111
05:14:07.228885 ens5  Out IP 172.31.17.110.9651 > 3.93.84.116.43788: Flags [P.], seq 2276455875:2276455986, ack 2540143062, win 28007, options [nop,nop,TS val 2282010624 ecr 2766781944], length 111
05:14:07.228894 ens5  Out IP 172.31.17.110.9651 > 165.227.179.96.42862: Flags [P.], seq 1643262513:1643262624, ack 1596230253, win 5830, options [nop,nop,TS val 2103508405 ecr 3261469355], length 111
05:14:07.228909 ens5  Out IP 172.31.17.110.35928 > 54.236.131.114.9651: Flags [P.], seq 3277786654:3277786765, ack 200611727, win 443, options [nop,nop,TS val 3776077619 ecr 4201245354], length 111
05:14:07.228914 ens5  Out IP 172.31.17.110.9651 > 34.202.198.117.55122: Flags [P.], seq 802209562:802209673, ack 718951747, win 6065, options [nop,nop,TS val 1691478108 ecr 1219713402], length 111
05:14:07.228917 ens5  Out IP 172.31.17.110.33626 > 52.71.181.255.9651: Flags [P.], seq 1:138, ack 111, win 20684, options [nop,nop,TS val 256505113 ecr 1436199564], length 137
05:14:07.228936 ens5  Out IP 172.31.17.110.9651 > 3.228.129.216.56382: Flags [P.], seq 2356474204:2356474315, ack 954353704, win 13259, options [nop,nop,TS val 714064995 ecr 2364894063], length 111
05:14:07.228943 ens5  Out IP 172.31.17.110.9651 > 104.236.110.97.49436: Flags [P.], seq 334:445, ack 389, win 11049, options [nop,nop,TS val 2068376813 ecr 2395134748], length 111
05:14:07.228947 ens5  In  IP 3.228.129.216.56382 > 172.31.17.110.9651: Flags [P.], seq 1:112, ack 0, win 13320, options [nop,nop,TS val 2364894069 ecr 714064987], length 111
05:14:07.228951 ens5  Out IP 172.31.17.110.9651 > 3.225.79.249.42904: Flags [P.], seq 3498012125:3498012236, ack 1623733984, win 19575, options [nop,nop,TS val 885829045 ecr 4110648887], length 111
05:14:07.228954 ens5  Out IP 172.31.17.110.9651 > 50.19.151.55.43826: Flags [P.], seq 3738728372:3738728483, ack 2782615882, win 11399, options [nop,nop,TS val 1585314190 ecr 2245023524], length 111
05:14:07.228963 ens5  Out IP 172.31.17.110.34106 > 98.83.188.107.9651: Flags [P.], seq 1:112, ack 169, win 8688, options [nop,nop,TS val 3268388466 ecr 136854372], length 111
05:14:07.228966 ens5  Out IP 172.31.17.110.9651 > 52.200.197.163.50384: Flags [P.], seq 27869794:27869905, ack 2254230094, win 11667, options [nop,nop,TS val 1772393889 ecr 2699514421], length 111
05:14:07.228992 ens5  Out IP 172.31.17.110.52744 > 3.223.220.64.9651: Flags [P.], seq 3140834422:3140834533, ack 410141118, win 8588, options [nop,nop,TS val 1337282923 ecr 2927658677], length 111
05:14:07.229002 ens5  Out IP 172.31.17.110.9651 > 44.214.160.107.47742: Flags [P.], seq 520830137:520830248, ack 2908036131, win 14205, options [nop,nop,TS val 3971807039 ecr 757974356], length 111
05:14:07.229011 ens5  Out IP 172.31.17.110.9651 > 23.22.40.156.37264: Flags [P.], seq 111:222, ack 1, win 17653, options [nop,nop,TS val 413163928 ecr 3622428454], length 111
05:14:07.229030 ens5  In  IP 54.225.236.76.9651 > 172.31.17.110.33320: Flags [.], ack 111, win 442, options [nop,nop,TS val 3521363838 ecr 3503456510], length 0
05:14:07.229040 ens5  Out IP 172.31.17.110.33320 > 54.225.236.76.9651: Flags [P.], seq 111:222, ack 1, win 443, options [nop,nop,TS val 3503456516 ecr 3521363838], length 111
05:14:07.229048 ens5  Out IP 172.31.17.110.9651 > 165.227.179.96.42862: Flags [P.], seq 111:222, ack 1, win 5830, options [nop,nop,TS val 2103508406 ecr 3261469355], length 111
05:14:07.229055 ens5  Out IP 172.31.17.110.34106 > 98.83.188.107.9651: Flags [P.], seq 112:223, ack 169, win 8688, options [nop,nop,TS val 3268388467 ecr 136854372], length 111
05:14:07.229076 ens5  In  IP 54.225.236.76.9651 > 172.31.17.110.33320: Flags [P.], seq 1:138, ack 111, win 442, options [nop,nop,TS val 3521363838 ecr 3503456510], length 137
05:14:07.229077 ens5  In  IP 34.202.198.117.55122 > 172.31.17.110.9651: Flags [.], ack 111, win 7622, options [nop,nop,TS val 1219713426 ecr 1691478100], length 0
05:14:07.229084 ens5  Out IP 172.31.17.110.9651 > 3.228.129.216.56382: Flags [P.], seq 111:248, ack 112, win 13259, options [nop,nop,TS val 714064996 ecr 2364894069], length 137
05:14:07.229087 ens5  In  IP 35.174.148.147.9651 > 172.31.17.110.42014: Flags [.], ack 111, win 28416, options [nop,nop,TS val 3293456696 ecr 755555680], length 0
05:14:07.229155 ens5  In  IP 35.174.148.147.9651 > 172.31.17.110.42014: Flags [P.], seq 1:138, ack 111, win 28416, options [nop,nop,TS val 3293456696 ecr 755555680], length 137
05:14:07.229155 ens5  In  IP 3.93.84.116.43788 > 172.31.17.110.9651: Flags [P.], seq 1:138, ack 111, win 12217, options [nop,nop,TS val 2766781950 ecr 2282010624], length 137
05:14:07.229155 ens5  In  IP 3.225.79.249.42904 > 172.31.17.110.9651: Flags [.], ack 111, win 14685, options [nop,nop,TS val 4110648896 ecr 885829036], length 0
05:14:07.229161 ens5  In  IP 54.85.9.116.9651 > 172.31.17.110.37372: Flags [P.], seq 1:138, ack 111, win 17142, options [nop,nop,TS val 2497867705 ecr 1229910905], length 137
05:14:07.229187 ens5  In  IP 34.202.198.117.55122 > 172.31.17.110.9651: Flags [P.], seq 1:138, ack 111, win 7622, options [nop,nop,TS val 1219713426 ecr 1691478100], length 137
05:14:07.229187 ens5  In  IP 52.54.223.196.46000 > 172.31.17.110.9651: Flags [P.], seq 1:138, ack 111, win 10466, options [nop,nop,TS val 994341393 ecr 1271808825], length 137
05:14:07.229258 ens5  In  IP 98.83.188.107.9651 > 172.31.17.110.34106: Flags [.], ack 223, win 9524, options [nop,nop,TS val 136854372 ecr 3268388466], length 0
05:14:07.229271 ens5  In  IP 54.236.131.114.9651 > 172.31.17.110.35928: Flags [P.], seq 1:138, ack 111, win 442, options [nop,nop,TS val 4201245369 ecr 3776077611], length 137
05:14:07.229284 ens5  In  IP 54.225.236.76.9651 > 172.31.17.110.33320: Flags [P.], seq 138:275, ack 222, win 442, options [nop,nop,TS val 3521363838 ecr 3503456516], length 137
05:14:07.229284 ens5  In  IP 3.223.220.64.9651 > 172.31.17.110.52744: Flags [P.], seq 1:138, ack 111, win 8199, options [nop,nop,TS val 2927658692 ecr 1337282923], length 137
05:14:07.229271 ens5  In  IP 98.83.188.107.9651 > 172.31.17.110.34106: Flags [P.], seq 169:306, ack 223, win 9524, options [nop,nop,TS val 136854372 ecr 3268388466], length 137
05:14:07.229315 ens5  In  IP 18.235.227.173.53046 > 172.31.17.110.9651: Flags [P.], seq 1:138, ack 111, win 443, options [nop,nop,TS val 1872913382 ecr 1266569409], length 137
05:14:07.229315 ens5  In  IP 50.19.151.55.43826 > 172.31.17.110.9651: Flags [P.], seq 1:138, ack 111, win 11984, options [nop,nop,TS val 2245023531 ecr 1585314190], length 137
05:14:07.229349 ens5  In  IP 98.83.188.107.9651 > 172.31.17.110.34106: Flags [P.], seq 306:773, ack 223, win 9524, options [nop,nop,TS val 136854372 ecr 3268388466], length 467
05:14:07.229358 ens5  In  IP 44.214.160.107.47742 > 172.31.17.110.9651: Flags [P.], seq 1:138, ack 111, win 12575, options [nop,nop,TS val 757974357 ecr 3971807039], length 137
05:14:07.229361 ens5  Out IP 172.31.17.110.34106 > 98.83.188.107.9651: Flags [.], ack 773, win 8688, options [nop,nop,TS val 3268388467 ecr 136854372], length 0
05:14:07.229378 ens5  In  IP 3.228.129.216.56382 > 172.31.17.110.9651: Flags [.], ack 248, win 13320, options [nop,nop,TS val 2364894069 ecr 714064995], length 0
05:14:07.229395 ens5  Out IP 172.31.17.110.33320 > 54.225.236.76.9651: Flags [.], ack 275, win 443, options [nop,nop,TS val 3503456516 ecr 3521363838], length 0
05:14:07.229437 ens5  In  IP 35.169.66.196.35958 > 172.31.17.110.9651: Flags [P.], seq 1:138, ack 111, win 7584, options [nop,nop,TS val 1670276465 ecr 3309766286], length 137
05:14:07.229460 ens5  In  IP 23.22.40.156.37264 > 172.31.17.110.9651: Flags [P.], seq 138:275, ack 222, win 9461, options [nop,nop,TS val 3622428460 ecr 413163928], length 137
05:14:07.229487 ens5  Out IP 172.31.17.110.9651 > 23.22.40.156.37264: Flags [.], ack 275, win 17653, options [nop,nop,TS val 413163929 ecr 3622428460], length 0
05:14:07.229515 ens5  In  IP 3.228.129.216.56382 > 172.31.17.110.9651: Flags [P.], seq 112:249, ack 248, win 13320, options [nop,nop,TS val 2364894069 ecr 714064995], length 137
05:14:07.229534 ens5  Out IP 172.31.17.110.34106 > 98.83.188.107.9651: Flags [P.], seq 223:334, ack 773, win 8688, options [nop,nop,TS val 3268388467 ecr 136854372], length 111
05:14:07.229634 ens5  In  IP 34.197.125.83.59934 > 172.31.17.110.9651: Flags [P.], seq 2034637259:2034637370, ack 3239715450, win 10256, options [nop,nop,TS val 2538546272 ecr 2223072023], length 111
05:14:07.229651 ens5  Out IP 172.31.17.110.9651 > 34.197.125.83.59934: Flags [.], ack 111, win 8582, options [nop,nop,TS val 2223072039 ecr 2538546256], length 0
05:14:07.229668 ens5  In  IP 52.200.197.163.50384 > 172.31.17.110.9651: Flags [P.], seq 1:138, ack 111, win 14290, options [nop,nop,TS val 2699514437 ecr 1772393876], length 137
05:14:07.229709 ens5  Out IP 172.31.17.110.9651 > 34.197.125.83.59934: Flags [P.], seq 1:138, ack 111, win 8582, options [nop,nop,TS val 2223072039 ecr 2538546256], length 137
05:14:07.229897 ens5  In  IP 98.83.188.107.9651 > 172.31.17.110.34106: Flags [P.], seq 773:1421, ack 334, win 9524, options [nop,nop,TS val 136854373 ecr 3268388467], length 648
05:14:07.229960 ens5  In  IP 52.70.38.106.9651 > 172.31.17.110.41702: Flags [P.], seq 2820638600:2820638711, ack 1017573898, win 15285, options [nop,nop,TS val 1313751331 ecr 1136903580], length 111
05:14:07.230046 ens5  Out IP 172.31.17.110.34106 > 98.83.188.107.9651: Flags [P.], seq 334:445, ack 1421, win 8688, options [nop,nop,TS val 3268388468 ecr 136854373], length 111
05:14:07.230049 ens5  Out IP 172.31.17.110.41702 > 52.70.38.106.9651: Flags [P.], seq 1:138, ack 111, win 12467, options [nop,nop,TS val 1136903615 ecr 1313751331], length 137
05:14:07.230273 ens5  In  IP 34.206.101.137.41220 > 172.31.17.110.9651: Flags [P.], seq 2630402600:2630402711, ack 4277395898, win 9994, options [nop,nop,TS val 1178173433 ecr 1156375527], length 111
05:14:07.230323 ens5  In  IP 34.196.243.223.9651 > 172.31.17.110.41042: Flags [P.], seq 2138339727:2138339838, ack 3420856966, win 20271, options [nop,nop,TS val 3919919186 ecr 3157374714], length 111
05:14:07.230340 ens5  In  IP 98.83.188.107.9651 > 172.31.17.110.34106: Flags [P.], seq 1421:1888, ack 445, win 9524, options [nop,nop,TS val 136854373 ecr 3268388468], length 467
05:14:07.230346 ens5  Out IP 172.31.17.110.9651 > 34.206.101.137.41220: Flags [P.], seq 1:138, ack 111, win 7903, options [nop,nop,TS val 1156375543 ecr 1178173433], length 137
05:14:07.230353 ens5  Out IP 172.31.17.110.41042 > 34.196.243.223.9651: Flags [.], ack 111, win 13198, options [nop,nop,TS val 3157374730 ecr 3919919178], length 0
05:14:07.230441 ens5  Out IP 172.31.17.110.34106 > 98.83.188.107.9651: Flags [P.], seq 445:556, ack 1888, win 8688, options [nop,nop,TS val 3268388468 ecr 136854373], length 111
05:14:07.230451 ens5  Out IP 172.31.17.110.41042 > 34.196.243.223.9651: Flags [P.], seq 1:138, ack 111, win 13198, options [nop,nop,TS val 3157374730 ecr 3919919178], length 137
05:14:07.230728 ens5  In  IP 98.83.188.107.9651 > 172.31.17.110.34106: Flags [P.], seq 1888:2424, ack 556, win 9524, options [nop,nop,TS val 136854374 ecr 3268388468], length 536
05:14:07.230731 ens5  In  IP 54.174.93.130.9651 > 172.31.17.110.60498: Flags [P.], seq 4027443461:4027443572, ack 3370626540, win 5849, options [nop,nop,TS val 191029147 ecr 2521874128], length 111
05:14:07.230753 ens5  Out IP 172.31.17.110.60498 > 54.174.93.130.9651: Flags [.], ack 111, win 8382, options [nop,nop,TS val 2521874139 ecr 191029136], length 0
05:14:07.230800 ens5  In  IP 34.196.243.223.9651 > 172.31.17.110.41042: Flags [P.], seq 111:222, ack 138, win 20271, options [nop,nop,TS val 3919919186 ecr 3157374730], length 111
05:14:07.230851 ens5  Out IP 172.31.17.110.60498 > 54.174.93.130.9651: Flags [P.], seq 1:138, ack 111, win 8382, options [nop,nop,TS val 2521874139 ecr 191029136], length 137
05:14:07.230967 ens5  Out IP 172.31.17.110.41042 > 34.196.243.223.9651: Flags [P.], seq 138:275, ack 222, win 13198, options [nop,nop,TS val 3157374730 ecr 3919919186], length 137
05:14:07.231040 ens5  In  IP 3.223.220.64.9651 > 172.31.17.110.52744: Flags [P.], seq 138:249, ack 111, win 8199, options [nop,nop,TS val 2927658694 ecr 1337282923], length 111
05:14:07.231059 ens5  Out IP 172.31.17.110.52744 > 3.223.220.64.9651: Flags [.], ack 249, win 8588, options [nop,nop,TS val 1337282926 ecr 2927658692], length 0
05:14:07.231130 ens5  Out IP 172.31.17.110.52744 > 3.223.220.64.9651: Flags [P.], seq 111:337, ack 249, win 8588, options [nop,nop,TS val 1337282926 ecr 2927658692], length 226
05:14:07.231330 ens5  In  IP 165.227.179.96.42862 > 172.31.17.110.9651: Flags [.], ack 0, win 24576, options [nop,nop,TS val 3261469364 ecr 2103508399], length 0
05:14:07.231386 ens5  In  IP 174.129.137.236.44706 > 172.31.17.110.9651: Flags [P.], seq 175660154:175660265, ack 1577706036, win 23670, options [nop,nop,TS val 930409593 ecr 1950467915], length 111
05:14:07.231462 ens5  In  IP 165.227.179.96.42862 > 172.31.17.110.9651: Flags [P.], seq 1:253, ack 0, win 24576, options [nop,nop,TS val 3261469364 ecr 2103508399], length 252
05:14:07.231461 ens5  Out IP 172.31.17.110.9651 > 174.129.137.236.44706: Flags [P.], seq 1:138, ack 111, win 21107, options [nop,nop,TS val 1950467946 ecr 930409593], length 137
05:14:07.231596 ens5  In  IP 52.3.189.202.52154 > 172.31.17.110.9651: Flags [P.], seq 2298771193:2298771304, ack 906845278, win 8302, options [nop,nop,TS val 2368721402 ecr 912487711], length 111
05:14:07.231646 ens5  Out IP 172.31.17.110.9651 > 165.227.179.96.42862: Flags [P.], seq 222:333, ack 253, win 5830, options [nop,nop,TS val 2103508408 ecr 3261469364], length 111
05:14:07.231650 ens5  Out IP 172.31.17.110.40818 > 18.235.252.133.9651: Flags [P.], seq 3661062626:3661062737, ack 3420366336, win 33600, options [nop,nop,TS val 3806100858 ecr 2825749352], length 111
05:14:07.231660 ens5  Out IP 172.31.17.110.9651 > 52.54.223.196.46000: Flags [P.], seq 111:222, ack 138, win 9053, options [nop,nop,TS val 1271808828 ecr 994341393], length 111
05:14:07.231660 ens5  Out IP 172.31.17.110.9651 > 23.22.195.89.46638: Flags [P.], seq 2087226862:2087226973, ack 1087119990, win 12023, options [nop,nop,TS val 2766164526 ecr 1094826498], length 111
05:14:07.231670 ens5  Out IP 172.31.17.110.9651 > 52.3.189.202.52154: Flags [P.], seq 1:112, ack 111, win 9062, options [nop,nop,TS val 912487718 ecr 2368721402], length 111
05:14:07.231675 ens5  Out IP 172.31.17.110.9651 > 3.217.115.114.45030: Flags [P.], seq 4084553786:4084553897, ack 1650176755, win 28608, options [nop,nop,TS val 1479790463 ecr 4048010959], length 111
05:14:07.231676 ens5  Out IP 172.31.17.110.9651 > 34.202.51.225.55416: Flags [P.], seq 724407532:724407643, ack 2637006076, win 10808, options [nop,nop,TS val 3474720570 ecr 2013354459], length 111
05:14:07.231681 ens5  Out IP 172.31.17.110.33320 > 54.225.236.76.9651: Flags [P.], seq 222:333, ack 275, win 443, options [nop,nop,TS val 3503456518 ecr 3521363838], length 111
05:14:07.231686 ens5  Out IP 172.31.17.110.9651 > 34.205.163.144.47656: Flags [P.], seq 111:222, ack 138, win 13856, options [nop,nop,TS val 326266380 ecr 532269098], length 111
05:14:07.231689 ens5  Out IP 172.31.17.110.9651 > 18.233.119.27.36660: Flags [P.], seq 1687758796:1687758907, ack 4267519051, win 6248, options [nop,nop,TS val 2657518166 ecr 2818786942], length 111
05:14:07.231693 ens5  Out IP 172.31.17.110.9651 > 104.236.110.97.49436: Flags [P.], seq 445:556, ack 389, win 11049, options [nop,nop,TS val 2068376816 ecr 2395134748], length 111
05:14:07.231696 ens5  Out IP 172.31.17.110.9651 > 52.3.189.202.52154: Flags [P.], seq 112:249, ack 111, win 9062, options [nop,nop,TS val 912487718 ecr 2368721402], length 137
05:14:07.231701 ens5  Out IP 172.31.17.110.9651 > 35.169.66.196.35958: Flags [P.], seq 111:222, ack 138, win 8678, options [nop,nop,TS val 3309766289 ecr 1670276465], length 111
05:14:07.231713 ens5  Out IP 172.31.17.110.55214 > 34.195.184.106.9651: Flags [P.], seq 3626567110:3626567221, ack 3966906241, win 11296, options [nop,nop,TS val 2050898977 ecr 1740641101], length 111
05:14:07.231817 ens5  In  IP 3.223.220.64.9651 > 172.31.17.110.52744: Flags [P.], seq 249:418, ack 337, win 8199, options [nop,nop,TS val 2927658695 ecr 1337282926], length 169
05:14:07.231820 ens5  In  IP 52.3.189.202.52154 > 172.31.17.110.9651: Flags [.], ack 249, win 8302, options [nop,nop,TS val 2368721402 ecr 912487718], length 0
05:14:07.231866 ens5  In  IP 34.195.184.106.9651 > 172.31.17.110.55214: Flags [.], ack 111, win 9994, options [nop,nop,TS val 1740641120 ecr 2050898971], length 0
05:14:07.231880 ens5  In  IP 18.233.119.27.36660 > 172.31.17.110.9651: Flags [.], ack 111, win 8139, options [nop,nop,TS val 2818786954 ecr 2657518155], length 0
05:14:07.231901 ens5  In  IP 18.235.252.133.9651 > 172.31.17.110.40818: Flags [.], ack 111, win 23616, options [nop,nop,TS val 2825749360 ecr 3806100851], length 0
05:14:07.231922 ens5  In  IP 23.22.195.89.46638 > 172.31.17.110.9651: Flags [P.], seq 1:138, ack 111, win 10673, options [nop,nop,TS val 1094826504 ecr 2766164526], length 137
05:14:07.231936 ens5  In  IP 54.225.236.76.9651 > 172.31.17.110.33320: Flags [P.], seq 275:412, ack 333, win 442, options [nop,nop,TS val 3521363841 ecr 3503456518], length 137
05:14:07.231936 ens5  In  IP 34.202.51.225.55416 > 172.31.17.110.9651: Flags [.], ack 111, win 12795, options [nop,nop,TS val 2013354468 ecr 3474720564], length 0
05:14:07.231936 ens5  In  IP 34.195.184.106.9651 > 172.31.17.110.55214: Flags [P.], seq 1:138, ack 111, win 9994, options [nop,nop,TS val 1740641120 ecr 2050898971], length 137
05:14:07.231937 ens5  In  IP 34.202.51.225.55416 > 172.31.17.110.9651: Flags [P.], seq 1:138, ack 111, win 12795, options [nop,nop,TS val 2013354468 ecr 3474720564], length 137
05:14:07.231955 ens5  Out IP 172.31.17.110.52744 > 3.223.220.64.9651: Flags [P.], seq 337:448, ack 418, win 8588, options [nop,nop,TS val 1337282926 ecr 2927658695], length 111
05:14:07.231971 ens5  In  IP 18.233.119.27.36660 > 172.31.17.110.9651: Flags [P.], seq 1:138, ack 111, win 8139, options [nop,nop,TS val 2818786954 ecr 2657518155], length 137
05:14:07.231971 ens5  In  IP 52.54.223.196.46000 > 172.31.17.110.9651: Flags [P.], seq 138:275, ack 222, win 10466, options [nop,nop,TS val 994341396 ecr 1271808828], length 137
05:14:07.231994 ens5  In  IP 98.82.251.216.40098 > 172.31.17.110.9651: Flags [P.], seq 4097376581:4097376692, ack 3502562253, win 6827, options [nop,nop,TS val 4187868078 ecr 2937254591], length 111
05:14:07.232007 ens5  In  IP 18.235.252.133.9651 > 172.31.17.110.40818: Flags [P.], seq 1:138, ack 111, win 23616, options [nop,nop,TS val 2825749360 ecr 3806100851], length 137
05:14:07.232028 ens5  In  IP 52.3.189.202.52154 > 172.31.17.110.9651: Flags [P.], seq 111:248, ack 249, win 8302, options [nop,nop,TS val 2368721402 ecr 912487718], length 137
05:14:07.232028 ens5  In  IP 34.205.163.144.47656 > 172.31.17.110.9651: Flags [P.], seq 138:275, ack 222, win 11197, options [nop,nop,TS val 532269101 ecr 326266380], length 137
05:14:07.232099 ens5  In  IP 3.217.115.114.45030 > 172.31.17.110.9651: Flags [P.], seq 1:138, ack 111, win 20497, options [nop,nop,TS val 4048010977 ecr 1479790463], length 137
05:14:07.232099 ens5  In  IP 35.169.66.196.35958 > 172.31.17.110.9651: Flags [P.], seq 138:275, ack 222, win 7584, options [nop,nop,TS val 1670276468 ecr 3309766289], length 137
05:14:07.232129 ens5  Out IP 172.31.17.110.9651 > 98.82.251.216.40098: Flags [P.], seq 1:138, ack 111, win 15231, options [nop,nop,TS val 2937254610 ecr 4187868078], length 137
05:14:07.232137 ens5  In  IP 65.108.78.194.56470 > 172.31.17.110.9651: Flags [.], ack 1190815326, win 912, options [nop,nop,TS val 333271041 ecr 2652650002], length 0
05:14:07.232236 ens5  In  IP 104.236.110.97.49436 > 172.31.17.110.9651: Flags [P.], seq 389:526, ack 223, win 10274, options [nop,nop,TS val 2395134751 ecr 2068376807], length 137
05:14:07.232306 ens5  In  IP 3.223.220.64.9651 > 172.31.17.110.52744: Flags [P.], seq 418:885, ack 448, win 8199, options [nop,nop,TS val 2927658695 ecr 1337282926], length 467
05:14:07.232400 ens5  In  IP 52.54.223.196.46000 > 172.31.17.110.9651: Flags [P.], seq 275:386, ack 222, win 10466, options [nop,nop,TS val 994341397 ecr 1271808828], length 111
05:14:07.232403 ens5  Out IP 172.31.17.110.56004 > 107.23.226.228.9651: Flags [P.], seq 2711084281:2711084392, ack 1187526480, win 11607, options [nop,nop,TS val 50860377 ecr 1939705539], length 111
05:14:07.232419 ens5  Out IP 172.31.17.110.36600 > 3.227.69.165.9651: Flags [P.], seq 3129884467:3129884578, ack 148176411, win 25206, options [nop,nop,TS val 448402510 ecr 857093299], length 111
05:14:07.232429 ens5  Out IP 172.31.17.110.9651 > 165.227.179.96.42862: Flags [P.], seq 333:444, ack 253, win 5830, options [nop,nop,TS val 2103508409 ecr 3261469364], length 111
05:14:07.232438 ens5  Out IP 172.31.17.110.56970 > 44.223.151.51.9651: Flags [P.], seq 275:386, ack 111, win 31882, options [nop,nop,TS val 589472842 ecr 2013444623], length 111
05:14:07.232439 ens5  Out IP 172.31.17.110.9651 > 104.236.110.97.49436: Flags [P.], seq 556:667, ack 526, win 11049, options [nop,nop,TS val 2068376817 ecr 2395134751], length 111
05:14:07.232441 ens5  Out IP 172.31.17.110.9651 > 52.54.223.196.46000: Flags [.], ack 386, win 9053, options [nop,nop,TS val 1271808829 ecr 994341396], length 0
05:14:07.232442 ens5  Out IP 172.31.17.110.52744 > 3.223.220.64.9651: Flags [P.], seq 448:559, ack 885, win 8588, options [nop,nop,TS val 1337282927 ecr 2927658695], length 111
05:14:07.232454 ens5  Out IP 172.31.17.110.9651 > 18.207.74.220.40608: Flags [P.], seq 3609899153:3609899264, ack 451273852, win 15830, options [nop,nop,TS val 575125566 ecr 2964861202], length 111
05:14:07.232457 ens5  Out IP 172.31.17.110.39976 > 54.197.55.84.9651: Flags [P.], seq 2354169630:2354169741, ack 610438512, win 10815, options [nop,nop,TS val 1649344088 ecr 2848693319], length 111
05:14:07.232458 ens5  Out IP 172.31.17.110.9651 > 44.219.130.13.36052: Flags [P.], seq 3633702313:3633702424, ack 2239315726, win 3694, options [nop,nop,TS val 3512653892 ecr 3441066484], length 111
05:14:07.232469 ens5  Out IP 172.31.17.110.41702 > 52.70.38.106.9651: Flags [P.], seq 138:249, ack 111, win 12467, options [nop,nop,TS val 1136903617 ecr 1313751331], length 111
05:14:07.232471 ens5  Out IP 172.31.17.110.60498 > 54.174.93.130.9651: Flags [P.], seq 138:249, ack 111, win 8382, options [nop,nop,TS val 2521874141 ecr 191029136], length 111
05:14:07.232473 ens5  Out IP 172.31.17.110.33320 > 54.225.236.76.9651: Flags [P.], seq 333:444, ack 412, win 443, options [nop,nop,TS val 3503456519 ecr 3521363841], length 111
05:14:07.232484 ens5  Out IP 172.31.17.110.9651 > 52.200.197.163.50384: Flags [P.], seq 111:222, ack 138, win 11667, options [nop,nop,TS val 1772393893 ecr 2699514437], length 111
05:14:07.232513 ens5  In  IP 18.215.213.100.33942 > 172.31.17.110.9651: Flags [P.], seq 2118411775:2118411886, ack 2077112521, win 16303, options [nop,nop,TS val 3414784338 ecr 3810487378], length 111
05:14:07.232519 ens5  Out IP 172.31.17.110.9651 > 52.54.223.196.46000: Flags [P.], seq 222:359, ack 386, win 9053, options [nop,nop,TS val 1271808829 ecr 994341396], length 137
05:14:07.232528 ens5  Out IP 172.31.17.110.9651 > 18.215.213.100.33942: Flags [.], ack 111, win 15622, options [nop,nop,TS val 3810487388 ecr 3414784329], length 0
05:14:07.232578 ens5  Out IP 172.31.17.110.9651 > 18.215.213.100.33942: Flags [P.], seq 1:138, ack 111, win 15622, options [nop,nop,TS val 3810487388 ecr 3414784329], length 137
05:14:07.232661 ens5  In  IP 18.207.74.220.40608 > 172.31.17.110.9651: Flags [P.], seq 1:138, ack 111, win 35712, options [nop,nop,TS val 2964861212 ecr 575125566], length 137
05:14:07.232667 ens5  In  IP 52.70.38.106.9651 > 172.31.17.110.41702: Flags [.], ack 249, win 15285, options [nop,nop,TS val 1313751333 ecr 1136903615], length 0
05:14:07.232733 ens5  In  IP 44.223.151.51.9651 > 172.31.17.110.56970: Flags [P.], seq 111:248, ack 386, win 21454, options [nop,nop,TS val 2013444627 ecr 589472842], length 137
05:14:07.232733 ens5  In  IP 52.70.38.106.9651 > 172.31.17.110.41702: Flags [P.], seq 111:248, ack 249, win 15285, options [nop,nop,TS val 1313751333 ecr 1136903615], length 137
05:14:07.232743 ens5  In  IP 3.227.69.165.9651 > 172.31.17.110.36600: Flags [P.], seq 1:138, ack 111, win 22113, options [nop,nop,TS val 857093319 ecr 448402510], length 137
05:14:07.232743 ens5  In  IP 52.200.197.163.50384 > 172.31.17.110.9651: Flags [P.], seq 138:275, ack 222, win 14290, options [nop,nop,TS val 2699514440 ecr 1772393893], length 137
05:14:07.232764 ens5  In  IP 107.23.226.228.9651 > 172.31.17.110.56004: Flags [.], ack 111, win 12872, options [nop,nop,TS val 1939705559 ecr 50860365], length 0
05:14:07.232784 ens5  In  IP 54.174.93.130.9651 > 172.31.17.110.60498: Flags [.], ack 249, win 5849, options [nop,nop,TS val 191029149 ecr 2521874139], length 0
05:14:07.232795 ens5  In  IP 3.223.220.64.9651 > 172.31.17.110.52744: Flags [P.], seq 885:1533, ack 559, win 8199, options [nop,nop,TS val 2927658696 ecr 1337282927], length 648
05:14:07.232796 ens5  In  IP 18.215.213.100.33942 > 172.31.17.110.9651: Flags [P.], seq 111:222, ack 1, win 16303, options [nop,nop,TS val 3414784339 ecr 3810487388], length 111
05:14:07.232864 ens5  In  IP 54.174.93.130.9651 > 172.31.17.110.60498: Flags [P.], seq 111:248, ack 249, win 5849, options [nop,nop,TS val 191029149 ecr 2521874139], length 137
05:14:07.232864 ens5  In  IP 3.232.45.182.9651 > 172.31.17.110.58194: Flags [P.], seq 3358393954:3358394065, ack 3159527205, win 9081, options [nop,nop,TS val 1532647484 ecr 3790104028], length 111
05:14:07.232885 ens5  Out IP 172.31.17.110.58194 > 3.232.45.182.9651: Flags [.], ack 111, win 12091, options [nop,nop,TS val 3790104038 ecr 1532647474], length 0
05:14:07.232895 ens5  In  IP 44.219.130.13.36052 > 172.31.17.110.9651: Flags [P.], seq 1:138, ack 111, win 443, options [nop,nop,TS val 3441066504 ecr 3512653892], length 137
05:14:07.232895 ens5  In  IP 34.197.148.157.49286 > 172.31.17.110.9651: Flags [P.], seq 1420802778:1420802889, ack 2457381690, win 13095, options [nop,nop,TS val 4046847429 ecr 2137299564], length 111
05:14:07.232895 ens5  In  IP 107.23.226.228.9651 > 172.31.17.110.56004: Flags [P.], seq 1:138, ack 111, win 12872, options [nop,nop,TS val 1939705559 ecr 50860365], length 137
05:14:07.232972 ens5  Out IP 172.31.17.110.58194 > 3.232.45.182.9651: Flags [P.], seq 1:138, ack 111, win 12091, options [nop,nop,TS val 3790104038 ecr 1532647474], length 137
05:14:07.232975 ens5  Out IP 172.31.17.110.9651 > 18.215.213.100.33942: Flags [P.], seq 138:275, ack 222, win 15622, options [nop,nop,TS val 3810487388 ecr 3414784339], length 137
05:14:07.232977 ens5  Out IP 172.31.17.110.52744 > 3.223.220.64.9651: Flags [P.], seq 559:670, ack 1533, win 8588, options [nop,nop,TS val 1337282927 ecr 2927658696], length 111
05:14:07.232980 ens5  Out IP 172.31.17.110.9651 > 34.197.148.157.49286: Flags [.], ack 111, win 14646, options [nop,nop,TS val 2137299574 ecr 4046847418], length 0
05:14:07.232997 ens5  In  IP 54.197.55.84.9651 > 172.31.17.110.39976: Flags [P.], seq 1:138, ack 111, win 8927, options [nop,nop,TS val 2848693330 ecr 1649344088], length 137
05:14:07.233070 ens5  Out IP 172.31.17.110.9651 > 34.197.148.157.49286: Flags [P.], seq 1:138, ack 111, win 14646, options [nop,nop,TS val 2137299575 ecr 4046847418], length 137
05:14:07.233108 ens5  In  IP 23.22.40.156.37264 > 172.31.17.110.9651: Flags [P.], seq 275:386, ack 222, win 9461, options [nop,nop,TS val 3622428464 ecr 413163929], length 111
05:14:07.233164 ens5  Out IP 172.31.17.110.9651 > 23.22.40.156.37264: Flags [P.], seq 222:359, ack 386, win 17653, options [nop,nop,TS val 413163933 ecr 3622428464], length 137
05:14:07.233175 ens5  In  IP 54.225.236.76.9651 > 172.31.17.110.33320: Flags [P.], seq 412:549, ack 444, win 442, options [nop,nop,TS val 3521363842 ecr 3503456519], length 137
05:14:07.233193 ens5  In  IP 44.211.0.202.9651 > 172.31.17.110.54468: Flags [P.], seq 3296576813:3296576924, ack 2832647775, win 8878, options [nop,nop,TS val 444144616 ecr 1561758770], length 111
05:14:07.233262 ens5  In  IP 18.215.213.100.33942 > 172.31.17.110.9651: Flags [.], ack 275, win 16303, options [nop,nop,TS val 3414784339 ecr 3810487388], length 0
05:14:07.233265 ens5  Out IP 172.31.17.110.54468 > 44.211.0.202.9651: Flags [P.], seq 1:138, ack 111, win 7758, options [nop,nop,TS val 1561758778 ecr 444144616], length 137
05:14:07.233324 ens5  In  IP 3.223.220.64.9651 > 172.31.17.110.52744: Flags [P.], seq 1533:2000, ack 670, win 8199, options [nop,nop,TS val 2927658696 ecr 1337282927], length 467
05:14:07.233389 ens5  In  IP 44.211.0.202.9651 > 172.31.17.110.54468: Flags [P.], seq 111:222, ack 1, win 8878, options [nop,nop,TS val 444144616 ecr 1561758770], length 111
05:14:07.233445 ens5  Out IP 172.31.17.110.54468 > 44.211.0.202.9651: Flags [P.], seq 138:275, ack 222, win 7758, options [nop,nop,TS val 1561758778 ecr 444144616], length 137
05:14:07.233459 ens5  Out IP 172.31.17.110.52744 > 3.223.220.64.9651: Flags [P.], seq 670:781, ack 2000, win 8588, options [nop,nop,TS val 1337282928 ecr 2927658696], length 111
05:14:07.233462 ens5  In  IP 50.19.151.55.43826 > 172.31.17.110.9651: Flags [P.], seq 138:249, ack 111, win 11984, options [nop,nop,TS val 2245023535 ecr 1585314190], length 111
05:14:07.233480 ens5  Out IP 172.31.17.110.9651 > 50.19.151.55.43826: Flags [.], ack 249, win 11399, options [nop,nop,TS val 1585314195 ecr 2245023531], length 0
05:14:07.233528 ens5  Out IP 172.31.17.110.9651 > 50.19.151.55.43826: Flags [P.], seq 111:248, ack 249, win 11399, options [nop,nop,TS val 1585314195 ecr 2245023531], length 137
05:14:07.233664 ens5  In  IP 50.19.151.55.43826 > 172.31.17.110.9651: Flags [P.], seq 249:360, ack 111, win 11984, options [nop,nop,TS val 2245023535 ecr 1585314190], length 111
05:14:07.233697 ens5  In  IP 44.211.0.202.9651 > 172.31.17.110.54468: Flags [.], ack 275, win 8878, options [nop,nop,TS val 444144616 ecr 1561758778], length 0
05:14:07.233723 ens5  Out IP 172.31.17.110.9651 > 50.19.151.55.43826: Flags [P.], seq 248:385, ack 360, win 11399, options [nop,nop,TS val 1585314195 ecr 2245023535], length 137
05:14:07.233778 ens5  In  IP 3.223.220.64.9651 > 172.31.17.110.52744: Flags [P.], seq 2000:2536, ack 781, win 8199, options [nop,nop,TS val 2927658697 ecr 1337282928], length 536
05:14:07.233809 ens5  In  IP 65.108.78.194.56470 > 172.31.17.110.9651: Flags [P.], seq 0:110, ack 1, win 912, options [nop,nop,TS val 333271043 ecr 2652650002], length 110
05:14:07.233919 ens5  Out IP 172.31.17.110.9651 > 65.108.78.194.56470: Flags [P.], seq 1:137, ack 110, win 442, options [nop,nop,TS val 2652650118 ecr 333271043], length 136
05:14:07.234067 ens5  In  IP 50.19.151.55.43826 > 172.31.17.110.9651: Flags [.], ack 385, win 11984, options [nop,nop,TS val 2245023535 ecr 1585314195], length 0
05:14:07.234624 ens5  In  IP 34.206.59.82.9651 > 172.31.17.110.44576: Flags [P.], seq 890275863:890275974, ack 3385926640, win 8653, options [nop,nop,TS val 3851771709 ecr 2352818413], length 111
05:14:07.234643 ens5  Out IP 172.31.17.110.44576 > 34.206.59.82.9651: Flags [.], ack 111, win 10980, options [nop,nop,TS val 2352818425 ecr 3851771697], length 0
05:14:07.234712 ens5  Out IP 172.31.17.110.44576 > 34.206.59.82.9651: Flags [P.], seq 1:227, ack 111, win 10980, options [nop,nop,TS val 2352818425 ecr 3851771697], length 226
05:14:07.234981 ens5  In  IP 54.86.40.233.9651 > 172.31.17.110.38458: Flags [P.], seq 4089299529:4089299640, ack 1904158764, win 11075, options [nop,nop,TS val 992858896 ecr 1444797921], length 111
05:14:07.235003 ens5  Out IP 172.31.17.110.38458 > 54.86.40.233.9651: Flags [.], ack 111, win 13170, options [nop,nop,TS val 1444797931 ecr 992858885], length 0
05:14:07.235077 ens5  Out IP 172.31.17.110.38458 > 54.86.40.233.9651: Flags [P.], seq 1:138, ack 111, win 13170, options [nop,nop,TS val 1444797932 ecr 992858885], length 137
05:14:07.235113 ens5  In  IP 104.236.110.97.49436 > 172.31.17.110.9651: Flags [.], ack 445, win 10274, options [nop,nop,TS val 2395134754 ecr 2068376813], length 0
05:14:07.235180 ens5  In  IP 104.236.110.97.49436 > 172.31.17.110.9651: Flags [P.], seq 526:663, ack 445, win 10274, options [nop,nop,TS val 2395134754 ecr 2068376813], length 137
05:14:07.235242 ens5  In  IP 34.202.51.225.55416 > 172.31.17.110.9651: Flags [P.], seq 138:249, ack 111, win 12795, options [nop,nop,TS val 2013354472 ecr 3474720564], length 111
05:14:07.235242 ens5  In  IP 104.236.110.97.49436 > 172.31.17.110.9651: Flags [P.], seq 663:800, ack 445, win 10274, options [nop,nop,TS val 2395134754 ecr 2068376813], length 137
05:14:07.235262 ens5  Out IP 172.31.17.110.9651 > 104.236.110.97.49436: Flags [.], ack 800, win 11049, options [nop,nop,TS val 2068376820 ecr 2395134754], length 0
05:14:07.235265 ens5  Out IP 172.31.17.110.9651 > 34.202.51.225.55416: Flags [.], ack 249, win 10808, options [nop,nop,TS val 3474720574 ecr 2013354468], length 0
05:14:07.235340 ens5  Out IP 172.31.17.110.9651 > 34.202.51.225.55416: Flags [P.], seq 111:248, ack 249, win 10808, options [nop,nop,TS val 3474720574 ecr 2013354468], length 137
05:14:07.235483 ens5  In  IP 34.206.59.82.9651 > 172.31.17.110.44576: Flags [P.], seq 111:280, ack 227, win 8653, options [nop,nop,TS val 3851771710 ecr 2352818425], length 169
05:14:07.235569 ens5  In  IP 165.227.179.96.42862 > 172.31.17.110.9651: Flags [.], ack 222, win 24576, options [nop,nop,TS val 3261469368 ecr 2103508405], length 0
05:14:07.235585 ens5  Out IP 172.31.17.110.44576 > 34.206.59.82.9651: Flags [P.], seq 227:338, ack 280, win 10980, options [nop,nop,TS val 2352818426 ecr 3851771710], length 111
05:14:07.235789 ens5  In  IP 44.214.160.107.47742 > 172.31.17.110.9651: Flags [P.], seq 138:249, ack 111, win 12575, options [nop,nop,TS val 757974364 ecr 3971807039], length 111
05:14:07.235809 ens5  Out IP 172.31.17.110.9651 > 44.214.160.107.47742: Flags [.], ack 249, win 14205, options [nop,nop,TS val 3971807046 ecr 757974357], length 0
05:14:07.235866 ens5  Out IP 172.31.17.110.9651 > 44.214.160.107.47742: Flags [P.], seq 111:248, ack 249, win 14205, options [nop,nop,TS val 3971807046 ecr 757974357], length 137
05:14:07.235954 ens5  In  IP 34.206.59.82.9651 > 172.31.17.110.44576: Flags [P.], seq 280:747, ack 338, win 8653, options [nop,nop,TS val 3851771710 ecr 2352818426], length 467
05:14:07.236071 ens5  Out IP 172.31.17.110.44576 > 34.206.59.82.9651: Flags [P.], seq 338:449, ack 747, win 10980, options [nop,nop,TS val 2352818427 ecr 3851771710], length 111
05:14:07.236222 ens5  In  IP 34.202.198.117.55122 > 172.31.17.110.9651: Flags [P.], seq 138:249, ack 111, win 7622, options [nop,nop,TS val 1219713433 ecr 1691478100], length 111
05:14:07.236242 ens5  Out IP 172.31.17.110.9651 > 34.202.198.117.55122: Flags [.], ack 249, win 6065, options [nop,nop,TS val 1691478116 ecr 1219713426], length 0
05:14:07.236297 ens5  Out IP 172.31.17.110.9651 > 34.202.198.117.55122: Flags [P.], seq 111:248, ack 249, win 6065, options [nop,nop,TS val 1691478116 ecr 1219713426], length 137
