tcpdump: data link type LINUX_SLL2
tcpdump: verbose output suppressed, use -v[v]... for full protocol decode
listening on any, link-type LINUX_SLL2 (Linux cooked v2), snapshot length 262144 bytes
05:22:20.719759 ens5  Out IP 172.31.25.213.9651 > 35.174.148.147.41142: Flags [P.], seq 1677457549:1677457686, ack 1102851733, win 12934, options [nop,nop,TS val 240047616 ecr 264990819], length 137
05:22:20.719819 ens5  In  IP 34.196.243.223.9651 > 172.31.25.213.55118: Flags [P.], seq 418268035:418268146, ack 3931653649, win 7061, options [nop,nop,TS val 2021910070 ecr 2358458912], length 111
05:22:20.719843 ens5  Out IP 172.31.25.213.55118 > 34.196.243.223.9651: Flags [.], ack 111, win 12192, options [nop,nop,TS val 2358458916 ecr 2021910066], length 0
05:22:20.719848 ens5  In  IP 18.233.119.27.52330 > 172.31.25.213.9651: Flags [P.], seq 3071728294:3071728405, ack 3886421347, win 12168, options [nop,nop,TS val 2443395218 ecr 3784373330], length 111
05:22:20.719888 ens5  Out IP 172.31.25.213.9651 > 18.233.119.27.52330: Flags [.], ack 111, win 10761, options [nop,nop,TS val 3784373347 ecr 2443395211], length 0
05:22:20.719918 ens5  Out IP 172.31.25.213.55118 > 34.196.243.223.9651: Flags [P.], seq 1:138, ack 111, win 12192, options [nop,nop,TS val 2358458916 ecr 2021910066], length 137
05:22:20.719933 ens5  Out IP 172.31.25.213.9651 > 18.233.119.27.52330: Flags [P.], seq 1:138, ack 111, win 10761, options [nop,nop,TS val 3784373347 ecr 2443395211], length 137
05:22:20.720041 ens5  In  IP 98.82.251.216.9651 > 172.31.25.213.38474: Flags [P.], seq 4100529024:4100529135, ack 3793729350, win 10663, options [nop,nop,TS val 2599729237 ecr 3418155320], length 111
05:22:20.720069 ens5  Out IP 172.31.25.213.38474 > 98.82.251.216.9651: Flags [.], ack 111, win 7108, options [nop,nop,TS val 3418155323 ecr 2599729235], length 0
05:22:20.720136 ens5  Out IP 172.31.25.213.38474 > 98.82.251.216.9651: Flags [P.], seq 1:138, ack 111, win 7108, options [nop,nop,TS val 3418155323 ecr 2599729235], length 137
05:22:20.720204 ens5  In  IP 3.228.129.216.48920 > 172.31.25.213.9651: Flags [P.], seq 418729724:418729835, ack 14166427, win 8214, options [nop,nop,TS val 3020344130 ecr 2443654645], length 111
05:22:20.720288 ens5  Out IP 172.31.25.213.9651 > 3.228.129.216.48920: Flags [P.], seq 1:138, ack 111, win 10589, options [nop,nop,TS val 2443654646 ecr 3020344130], length 137
05:22:20.720339 ens5  In  IP 44.223.151.51.59402 > 172.31.25.213.9651: Flags [P.], seq 2906181491:2906181602, ack 3191507177, win 8853, options [nop,nop,TS val 1531447524 ecr 2860203922], length 111
05:22:20.720360 ens5  Out IP 172.31.25.213.9651 > 44.223.151.51.59402: Flags [.], ack 111, win 7833, options [nop,nop,TS val 2860203926 ecr 1531447520], length 0
05:22:20.720422 ens5  Out IP 172.31.25.213.9651 > 44.223.151.51.59402: Flags [P.], seq 1:138, ack 111, win 7833, options [nop,nop,TS val 2860203926 ecr 1531447520], length 137
05:22:20.720448 ens5  In  IP 3.93.84.116.34796 > 172.31.25.213.9651: Flags [P.], seq 4195536461:4195536572, ack 2114190473, win 15076, options [nop,nop,TS val 3759393075 ecr 1168637398], length 111
05:22:20.720527 ens5  Out IP 172.31.25.213.9651 > 3.93.84.116.34796: Flags [P.], seq 1:138, ack 111, win 9190, options [nop,nop,TS val 1168637412 ecr 3759393075], length 137
05:22:20.720705 ens5  In  IP 34.206.248.174.9651 > 172.31.25.213.41220: Flags [P.], seq 4285124262:4285124373, ack 2642691441, win 7903, options [nop,nop,TS val 1156869033 ecr 1178666912], length 111
05:22:20.720752 ens5  In  IP 18.207.74.220.53268 > 172.31.25.213.9651: Flags [P.], seq 2581586405:2581586516, ack 2552460652, win 7925, options [nop,nop,TS val 3590317159 ecr 3563584139], length 111
05:22:20.720785 ens5  Out IP 172.31.25.213.41220 > 34.206.248.174.9651: Flags [P.], seq 1:138, ack 111, win 9994, options [nop,nop,TS val 1178666924 ecr 1156869033], length 137
05:22:20.720832 ens5  Out IP 172.31.25.213.9651 > 18.207.74.220.53268: Flags [P.], seq 1:138, ack 111, win 7998, options [nop,nop,TS val 3563584163 ecr 3590317159], length 137
05:22:20.720876 ens5  In  IP 34.203.168.140.34832 > 172.31.25.213.9651: Flags [P.], seq 2162408455:2162408566, ack 819242318, win 11515, options [nop,nop,TS val 765146590 ecr 4174312236], length 111
05:22:20.720959 ens5  Out IP 172.31.25.213.9651 > 34.203.168.140.34832: Flags [P.], seq 1:138, ack 111, win 18155, options [nop,nop,TS val 4174312250 ecr 765146590], length 137
05:22:20.721106 ens5  In  IP 23.22.40.156.45426 > 172.31.25.213.9651: Flags [P.], seq 2947850081:2947850192, ack 2183661361, win 11685, options [nop,nop,TS val 877498913 ecr 2077095827], length 111
05:22:20.721149 ens5  In  IP 34.202.51.225.9651 > 172.31.25.213.40856: Flags [P.], seq 2826296064:2826296175, ack 394425924, win 8491, options [nop,nop,TS val 2849178887 ecr 1607070891], length 111
05:22:20.721167 ens5  Out IP 172.31.25.213.40856 > 34.202.51.225.9651: Flags [.], ack 111, win 9464, options [nop,nop,TS val 1607070896 ecr 2849178881], length 0
05:22:20.721172 ens5  Out IP 172.31.25.213.9651 > 23.22.40.156.45426: Flags [P.], seq 1:138, ack 111, win 10445, options [nop,nop,TS val 2077095855 ecr 877498913], length 137
05:22:20.721217 ens5  Out IP 172.31.25.213.40856 > 34.202.51.225.9651: Flags [P.], seq 1:138, ack 111, win 9464, options [nop,nop,TS val 1607070896 ecr 2849178881], length 137
05:22:20.721990 ens5  In  IP 104.236.110.97.9651 > 172.31.25.213.56148: Flags [P.], seq 3422511930:3422512067, ack 1076717962, win 1306, options [nop,nop,TS val 2406915408 ecr 1778892461], length 137
05:22:20.722011 ens5  Out IP 172.31.25.213.56148 > 104.236.110.97.9651: Flags [.], ack 137, win 443, options [nop,nop,TS val 1778892471 ecr 2406915403], length 0
05:22:20.722092 ens5  In  IP 54.224.250.2.52504 > 172.31.25.213.9651: Flags [P.], seq 1618837836:1618837947, ack 1393116171, win 8067, options [nop,nop,TS val 3910919649 ecr 1393044786], length 111
05:22:20.722107 ens5  Out IP 172.31.25.213.9651 > 54.224.250.2.52504: Flags [.], ack 111, win 8387, options [nop,nop,TS val 1393044791 ecr 3910919644], length 0
05:22:20.722224 ens5  Out IP 172.31.25.213.9651 > 44.210.177.215.40994: Flags [P.], seq 283900292:283900403, ack 1337181201, win 11142, options [nop,nop,TS val 1372069136 ecr 2577861106], length 111
05:22:20.722233 ens5  Out IP 172.31.25.213.9651 > 18.233.119.27.52330: Flags [P.], seq 138:249, ack 111, win 10761, options [nop,nop,TS val 3784373349 ecr 2443395211], length 111
05:22:20.722236 ens5  Out IP 172.31.25.213.9651 > 54.146.211.74.60018: Flags [P.], seq 3503712265:3503712376, ack 889314444, win 19889, options [nop,nop,TS val 3448743289 ecr 3082250514], length 111
05:22:20.722244 ens5  Out IP 172.31.25.213.9651 > 54.174.93.130.38004: Flags [P.], seq 2825486761:2825486872, ack 2580134555, win 12033, options [nop,nop,TS val 802227525 ecr 3919926084], length 111
05:22:20.722254 ens5  Out IP 172.31.25.213.9651 > 3.218.45.144.60810: Flags [P.], seq 2220868505:2220868616, ack 1930291336, win 8611, options [nop,nop,TS val 2809680273 ecr 1969809523], length 111
05:22:20.722254 ens5  Out IP 172.31.25.213.9651 > 18.207.74.220.53268: Flags [P.], seq 138:249, ack 111, win 7998, options [nop,nop,TS val 3563584164 ecr 3590317159], length 111
05:22:20.722255 ens5  Out IP 172.31.25.213.9651 > 34.197.125.83.40440: Flags [P.], seq 1130564481:1130564592, ack 1008135257, win 17761, options [nop,nop,TS val 1216862671 ecr 3638342820], length 111
05:22:20.722265 ens5  Out IP 172.31.25.213.9651 > 34.195.184.106.40004: Flags [P.], seq 4190650845:4190650956, ack 876994009, win 9935, options [nop,nop,TS val 371109445 ecr 1678487015], length 111
05:22:20.722266 ens5  Out IP 172.31.25.213.9651 > 165.227.179.96.35058: Flags [P.], seq 1484719965:1484720076, ack 4233593990, win 442, options [nop,nop,TS val 1789279368 ecr 2078564872], length 111
05:22:20.722275 ens5  Out IP 172.31.25.213.9651 > 54.224.250.2.52504: Flags [P.], seq 1:112, ack 111, win 8387, options [nop,nop,TS val 1393044791 ecr 3910919644], length 111
05:22:20.722277 ens5  Out IP 172.31.25.213.41218 > 54.197.102.41.9651: Flags [P.], seq 4060178904:4060179015, ack 488912053, win 443, options [nop,nop,TS val 790578999 ecr 604250461], length 111
05:22:20.722284 ens5  Out IP 172.31.25.213.48976 > 3.225.79.249.9651: Flags [P.], seq 950696581:950696692, ack 1825268026, win 7817, options [nop,nop,TS val 2279781922 ecr 1442739558], length 111
05:22:20.722288 ens5  Out IP 172.31.25.213.9651 > 52.54.223.196.46968: Flags [P.], seq 3000239412:3000239523, ack 2334065761, win 7390, options [nop,nop,TS val 763771449 ecr 4266886654], length 111
05:22:20.722291 ens5  Out IP 172.31.25.213.38474 > 98.82.251.216.9651: Flags [P.], seq 138:249, ack 111, win 7108, options [nop,nop,TS val 3418155325 ecr 2599729235], length 111
05:22:20.722293 ens5  Out IP 172.31.25.213.47536 > 23.21.204.131.9651: Flags [P.], seq 1163194092:1163194292, ack 1852043318, win 8288, options [nop,nop,TS val 249826213 ecr 3041511613], length 200
05:22:20.722296 ens5  Out IP 172.31.25.213.9651 > 44.223.151.51.59402: Flags [P.], seq 138:249, ack 111, win 7833, options [nop,nop,TS val 2860203928 ecr 1531447520], length 111
05:22:20.722305 ens5  Out IP 172.31.25.213.9651 > 35.169.184.86.58222: Flags [P.], seq 3841248126:3841248237, ack 943353128, win 11209, options [nop,nop,TS val 1794076244 ecr 3966923923], length 111
05:22:20.722305 ens5  In  IP 3.93.84.116.34796 > 172.31.25.213.9651: Flags [P.], seq 111:222, ack 138, win 15076, options [nop,nop,TS val 3759393077 ecr 1168637412], length 111
05:22:20.722312 ens5  In  IP 34.197.104.250.35138 > 172.31.25.213.9651: Flags [P.], seq 3574043860:3574043971, ack 3375941872, win 13551, options [nop,nop,TS val 1228288451 ecr 2593997044], length 111
05:22:20.722316 ens5  Out IP 172.31.25.213.52540 > 98.80.46.175.9651: Flags [P.], seq 1037335874:1037335985, ack 2494764514, win 8388, options [nop,nop,TS val 983593500 ecr 2632997662], length 111
05:22:20.722320 ens5  Out IP 172.31.25.213.9651 > 3.228.129.216.48920: Flags [P.], seq 138:249, ack 111, win 10589, options [nop,nop,TS val 2443654648 ecr 3020344130], length 111
05:22:20.722327 ens5  Out IP 172.31.25.213.9651 > 54.158.175.165.53366: Flags [P.], seq 1112002724:1112002835, ack 3248001448, win 20919, options [nop,nop,TS val 696877658 ecr 425377486], length 111
05:22:20.722329 ens5  Out IP 172.31.25.213.9651 > 3.217.115.114.35162: Flags [P.], seq 228025966:228026077, ack 3966659717, win 9822, options [nop,nop,TS val 517864619 ecr 2851287929], length 111
05:22:20.722332 ens5  Out IP 172.31.25.213.9651 > 34.197.148.157.34024: Flags [P.], seq 1524567322:1524567433, ack 2733029617, win 8144, options [nop,nop,TS val 2989274886 ecr 1653906598], length 111
05:22:20.722340 ens5  In  IP 23.22.195.89.9651 > 172.31.25.213.45388: Flags [P.], seq 129822813:129822924, ack 1991565269, win 9849, options [nop,nop,TS val 2264066829 ecr 935907776], length 111
05:22:20.722343 ens5  Out IP 172.31.25.213.9651 > 165.227.179.96.35058: Flags [P.], seq 111:222, ack 1, win 442, options [nop,nop,TS val 1789279368 ecr 2078564872], length 111
05:22:20.722353 ens5  Out IP 172.31.25.213.9651 > 34.197.104.250.35138: Flags [.], ack 111, win 8735, options [nop,nop,TS val 2593997050 ecr 1228288445], length 0
05:22:20.722366 ens5  In  IP 54.226.62.214.9651 > 172.31.25.213.36338: Flags [P.], seq 1066102280:1066102391, ack 640362745, win 13427, options [nop,nop,TS val 3817155568 ecr 1113916778], length 111
05:22:20.722403 ens5  In  IP 23.21.27.140.33464 > 172.31.25.213.9651: Flags [P.], seq 2538854032:2538854143, ack 1679004154, win 6814, options [nop,nop,TS val 3961978084 ecr 373708631], length 111
05:22:20.722410 ens5  Out IP 172.31.25.213.36338 > 54.226.62.214.9651: Flags [P.], seq 1:112, ack 111, win 11242, options [nop,nop,TS val 1113916785 ecr 3817155568], length 111
05:22:20.722413 ens5  Out IP 172.31.25.213.45388 > 23.22.195.89.9651: Flags [.], ack 111, win 6386, options [nop,nop,TS val 935907798 ecr 2264066819], length 0
05:22:20.722423 ens5  Out IP 172.31.25.213.9651 > 44.214.160.107.55806: Flags [P.], seq 2160071847:2160071958, ack 150674065, win 8728, options [nop,nop,TS val 3456760342 ecr 3268076789], length 111
05:22:20.722425 ens5  Out IP 172.31.25.213.9651 > 44.219.130.13.47744: Flags [P.], seq 741941055:741941166, ack 252777137, win 2943, options [nop,nop,TS val 1922146928 ecr 4692829], length 111
05:22:20.722432 ens5  Out IP 172.31.25.213.9651 > 23.21.27.140.33464: Flags [.], ack 111, win 12401, options [nop,nop,TS val 373708637 ecr 3961978078], length 0
05:22:20.722440 ens5  Out IP 172.31.25.213.41218 > 54.197.102.41.9651: Flags [P.], seq 111:222, ack 1, win 443, options [nop,nop,TS val 790578999 ecr 604250461], length 111
05:22:20.722441 ens5  In  IP 18.207.74.220.53268 > 172.31.25.213.9651: Flags [.], ack 249, win 7925, options [nop,nop,TS val 3590317161 ecr 3563584163], length 0
05:22:20.722441 ens5  In  IP 165.227.179.96.35058 > 172.31.25.213.9651: Flags [.], ack 4294967185, win 1376, options [nop,nop,TS val 2078564876 ecr 1789279361], length 0
05:22:20.722445 ens5  In  IP 54.197.102.41.9651 > 172.31.25.213.41218: Flags [.], ack 111, win 442, options [nop,nop,TS val 604250475 ecr 790578996], length 0
05:22:20.722449 ens5  Out IP 172.31.25.213.9651 > 54.224.250.2.52504: Flags [P.], seq 112:249, ack 111, win 8387, options [nop,nop,TS val 1393044791 ecr 3910919644], length 137
05:22:20.722481 ens5  In  IP 18.233.119.27.52330 > 172.31.25.213.9651: Flags [.], ack 249, win 12168, options [nop,nop,TS val 2443395221 ecr 3784373347], length 0
05:22:20.722487 ens5  In  IP 34.197.125.83.40440 > 172.31.25.213.9651: Flags [.], ack 111, win 14564, options [nop,nop,TS val 3638342830 ecr 1216862661], length 0
05:22:20.722487 ens5  In  IP 107.23.180.98.54598 > 172.31.25.213.9651: Flags [P.], seq 1788690141:1788690251, ack 627565552, win 443, options [nop,nop,TS val 2441977903 ecr 3276294372], length 110
05:22:20.722487 ens5  In  IP 18.207.74.220.53268 > 172.31.25.213.9651: Flags [P.], seq 111:248, ack 249, win 7925, options [nop,nop,TS val 3590317161 ecr 3563584163], length 137
05:22:20.722501 ens5  In  IP 44.219.130.13.47744 > 172.31.25.213.9651: Flags [P.], seq 1:112, ack 0, win 443, options [nop,nop,TS val 4692838 ecr 1922146920], length 111
05:22:20.722501 ens5  In  IP 34.195.184.106.40004 > 172.31.25.213.9651: Flags [P.], seq 1:138, ack 111, win 14068, options [nop,nop,TS val 1678487025 ecr 371109445], length 137
05:22:20.722502 ens5  In  IP 54.158.175.165.53366 > 172.31.25.213.9651: Flags [.], ack 111, win 11027, options [nop,nop,TS val 425377490 ecr 696877655], length 0
05:22:20.722502 ens5  In  IP 3.225.79.249.9651 > 172.31.25.213.48976: Flags [P.], seq 1:112, ack 0, win 9545, options [nop,nop,TS val 1442739584 ecr 2279781897], length 111
05:22:20.722502 ens5  In  IP 35.169.184.86.58222 > 172.31.25.213.9651: Flags [P.], seq 1:138, ack 111, win 10512, options [nop,nop,TS val 3966923941 ecr 1794076244], length 137
05:22:20.722513 ens5  In  IP 54.197.102.41.9651 > 172.31.25.213.41218: Flags [P.], seq 1:138, ack 111, win 442, options [nop,nop,TS val 604250475 ecr 790578996], length 137
05:22:20.722530 ens5  In  IP 18.233.119.27.52330 > 172.31.25.213.9651: Flags [P.], seq 111:248, ack 249, win 12168, options [nop,nop,TS val 2443395221 ecr 3784373347], length 137
05:22:20.722539 ens5  Out IP 172.31.25.213.9651 > 3.93.84.116.34796: Flags [P.], seq 138:275, ack 222, win 9190, options [nop,nop,TS val 1168637414 ecr 3759393077], length 137
05:22:20.722547 ens5  In  IP 34.197.125.83.40440 > 172.31.25.213.9651: Flags [P.], seq 1:138, ack 111, win 14564, options [nop,nop,TS val 3638342830 ecr 1216862661], length 137
05:22:20.722547 ens5  Out IP 172.31.25.213.36338 > 54.226.62.214.9651: Flags [P.], seq 112:249, ack 111, win 11242, options [nop,nop,TS val 1113916785 ecr 3817155568], length 137
05:22:20.722551 ens5  Out IP 172.31.25.213.9651 > 34.197.104.250.35138: Flags [P.], seq 1:138, ack 111, win 8735, options [nop,nop,TS val 2593997050 ecr 1228288445], length 137
05:22:20.722563 ens5  In  IP 44.223.151.51.59402 > 172.31.25.213.9651: Flags [.], ack 249, win 8853, options [nop,nop,TS val 1531447527 ecr 2860203926], length 0
05:22:20.722595 ens5  In  IP 3.228.129.216.48920 > 172.31.25.213.9651: Flags [.], ack 249, win 8214, options [nop,nop,TS val 3020344132 ecr 2443654646], length 0
05:22:20.722608 ens5  In  IP 54.146.211.74.60018 > 172.31.25.213.9651: Flags [.], ack 111, win 19253, options [nop,nop,TS val 3082250526 ecr 3448743277], length 0
05:22:20.722608 ens5  In  IP 54.174.93.130.38004 > 172.31.25.213.9651: Flags [.], ack 111, win 9817, options [nop,nop,TS val 3919926092 ecr 802227517], length 0
05:22:20.722608 ens5  In  IP 98.82.251.216.9651 > 172.31.25.213.38474: Flags [.], ack 249, win 10663, options [nop,nop,TS val 2599729240 ecr 3418155323], length 0
05:22:20.722608 ens5  In  IP 54.146.211.74.60018 > 172.31.25.213.9651: Flags [P.], seq 1:138, ack 111, win 19253, options [nop,nop,TS val 3082250526 ecr 3448743277], length 137
05:22:20.722608 ens5  In  IP 34.197.148.157.34024 > 172.31.25.213.9651: Flags [.], ack 111, win 11645, options [nop,nop,TS val 1653906609 ecr 2989274876], length 0
05:22:20.722608 ens5  In  IP 98.82.251.216.9651 > 172.31.25.213.38474: Flags [P.], seq 111:248, ack 249, win 10663, options [nop,nop,TS val 2599729240 ecr 3418155323], length 137
05:22:20.722608 ens5  In  IP 54.174.93.130.38004 > 172.31.25.213.9651: Flags [P.], seq 1:138, ack 111, win 9817, options [nop,nop,TS val 3919926092 ecr 802227517], length 137
05:22:20.722608 ens5  In  IP 3.218.45.144.60810 > 172.31.25.213.9651: Flags [P.], seq 1:138, ack 111, win 11142, options [nop,nop,TS val 1969809528 ecr 2809680273], length 137
05:22:20.722614 ens5  In  IP 23.21.204.131.9651 > 172.31.25.213.47536: Flags [.], ack 200, win 9633, options [nop,nop,TS val 3041511616 ecr 249826211], length 0
05:22:20.722619 ens5  In  IP 44.223.151.51.59402 > 172.31.25.213.9651: Flags [P.], seq 111:248, ack 249, win 8853, options [nop,nop,TS val 1531447527 ecr 2860203926], length 137
05:22:20.722619 ens5  In  IP 54.158.175.165.53366 > 172.31.25.213.9651: Flags [P.], seq 1:227, ack 111, win 11027, options [nop,nop,TS val 425377490 ecr 696877655], length 226
05:22:20.722629 ens5  Out IP 172.31.25.213.45388 > 23.22.195.89.9651: Flags [P.], seq 1:138, ack 111, win 6386, options [nop,nop,TS val 935907799 ecr 2264066819], length 137
05:22:20.722630 ens5  In  IP 44.210.177.215.40994 > 172.31.25.213.9651: Flags [P.], seq 1:138, ack 111, win 7734, options [nop,nop,TS val 2577861116 ecr 1372069136], length 137
05:22:20.722632 ens5  Out IP 172.31.25.213.9651 > 107.23.180.98.54598: Flags [.], ack 110, win 442, options [nop,nop,TS val 3276294383 ecr 2441977893], length 0
05:22:20.722644 ens5  Out IP 172.31.25.213.9651 > 23.21.27.140.33464: Flags [P.], seq 1:138, ack 111, win 12401, options [nop,nop,TS val 373708638 ecr 3961978078], length 137
05:22:20.722645 ens5  In  IP 3.228.129.216.48920 > 172.31.25.213.9651: Flags [P.], seq 111:248, ack 249, win 8214, options [nop,nop,TS val 3020344132 ecr 2443654646], length 137
05:22:20.722668 ens5  In  IP 23.21.204.131.9651 > 172.31.25.213.47536: Flags [P.], seq 1:253, ack 200, win 9633, options [nop,nop,TS val 3041511616 ecr 249826211], length 252
05:22:20.722676 ens5  In  IP 54.197.102.41.9651 > 172.31.25.213.41218: Flags [P.], seq 138:275, ack 222, win 442, options [nop,nop,TS val 604250476 ecr 790578999], length 137
05:22:20.722679 ens5  In  IP 52.54.223.196.46968 > 172.31.25.213.9651: Flags [P.], seq 1:138, ack 111, win 12923, options [nop,nop,TS val 4266886659 ecr 763771449], length 137
05:22:20.722704 ens5  Out IP 172.31.25.213.9651 > 107.23.180.98.54598: Flags [P.], seq 1:137, ack 110, win 442, options [nop,nop,TS val 3276294383 ecr 2441977893], length 136
05:22:20.722722 ens5  Out IP 172.31.25.213.41218 > 54.197.102.41.9651: Flags [.], ack 275, win 443, options [nop,nop,TS val 790579000 ecr 604250475], length 0
05:22:20.722732 ens5  Out IP 172.31.25.213.48976 > 3.225.79.249.9651: Flags [P.], seq 111:248, ack 112, win 7817, options [nop,nop,TS val 2279781923 ecr 1442739584], length 137
05:22:20.722757 ens5  In  IP 44.219.130.13.47744 > 172.31.25.213.9651: Flags [P.], seq 112:249, ack 111, win 443, options [nop,nop,TS val 4692839 ecr 1922146928], length 137
05:22:20.722757 ens5  In  IP 44.214.160.107.55806 > 172.31.25.213.9651: Flags [P.], seq 1:138, ack 111, win 7580, options [nop,nop,TS val 3268076794 ecr 3456760342], length 137
05:22:20.722782 ens5  Out IP 172.31.25.213.9651 > 44.219.130.13.47744: Flags [.], ack 249, win 2943, options [nop,nop,TS val 1922146929 ecr 4692838], length 0
05:22:20.722800 ens5  Out IP 172.31.25.213.9651 > 44.219.130.13.47744: Flags [P.], seq 111:248, ack 249, win 2943, options [nop,nop,TS val 1922146929 ecr 4692838], length 137
05:22:20.722806 ens5  In  IP 3.217.115.114.35162 > 172.31.25.213.9651: Flags [P.], seq 1:138, ack 111, win 10481, options [nop,nop,TS val 2851287944 ecr 517864619], length 137
05:22:20.722807 ens5  In  IP 54.226.62.214.9651 > 172.31.25.213.36338: Flags [P.], seq 111:248, ack 112, win 13427, options [nop,nop,TS val 3817155569 ecr 1113916785], length 137
05:22:20.722807 ens5  In  IP 3.225.79.249.9651 > 172.31.25.213.48976: Flags [P.], seq 112:249, ack 111, win 9545, options [nop,nop,TS val 1442739585 ecr 2279781922], length 137
05:22:20.722837 ens5  In  IP 98.80.46.175.9651 > 172.31.25.213.52540: Flags [P.], seq 1:138, ack 111, win 12583, options [nop,nop,TS val 2632997667 ecr 983593500], length 137
05:22:20.722837 ens5  In  IP 34.197.148.157.34024 > 172.31.25.213.9651: Flags [P.], seq 1:138, ack 111, win 11645, options [nop,nop,TS val 1653906609 ecr 2989274876], length 137
05:22:20.722846 ens5  In  IP 54.224.250.2.52504 > 172.31.25.213.9651: Flags [.], ack 249, win 8067, options [nop,nop,TS val 3910919650 ecr 1393044791], length 0
05:22:20.722869 ens5  In  IP 3.217.115.114.35162 > 172.31.25.213.9651: Flags [P.], seq 138:249, ack 111, win 10481, options [nop,nop,TS val 2851287944 ecr 517864619], length 111
05:22:20.722896 ens5  Out IP 172.31.25.213.9651 > 3.217.115.114.35162: Flags [.], ack 249, win 9822, options [nop,nop,TS val 517864620 ecr 2851287944], length 0
05:22:20.722909 ens5  In  IP 104.236.110.97.9651 > 172.31.25.213.56148: Flags [P.], seq 137:274, ack 112, win 1306, options [nop,nop,TS val 2406915409 ecr 1778892465], length 137
05:22:20.723015 ens5  Out IP 172.31.25.213.9651 > 54.158.175.165.53366: Flags [P.], seq 111:248, ack 227, win 20919, options [nop,nop,TS val 696877659 ecr 425377490], length 137
05:22:20.723048 ens5  Out IP 172.31.25.213.9651 > 3.217.115.114.35162: Flags [P.], seq 111:280, ack 249, win 9822, options [nop,nop,TS val 517864620 ecr 2851287944], length 169
05:22:20.723112 ens5  In  IP 54.224.250.2.52504 > 172.31.25.213.9651: Flags [P.], seq 111:248, ack 249, win 8067, options [nop,nop,TS val 3910919650 ecr 1393044791], length 137
05:22:20.723244 ens5  In  IP 52.54.223.196.46968 > 172.31.25.213.9651: Flags [P.], seq 138:249, ack 111, win 12923, options [nop,nop,TS val 4266886659 ecr 763771449], length 111
05:22:20.723261 ens5  Out IP 172.31.25.213.9651 > 52.54.223.196.46968: Flags [.], ack 249, win 7390, options [nop,nop,TS val 763771450 ecr 4266886659], length 0
05:22:20.723313 ens5  Out IP 172.31.25.213.9651 > 52.54.223.196.46968: Flags [P.], seq 111:248, ack 249, win 7390, options [nop,nop,TS val 763771450 ecr 4266886659], length 137
05:22:20.723334 ens5  In  IP 165.227.179.96.35058 > 172.31.25.213.9651: Flags [P.], seq 1:138, ack 4294967185, win 1376, options [nop,nop,TS val 2078564877 ecr 1789279361], length 137
05:22:20.723432 ens5  In  IP 3.217.115.114.35162 > 172.31.25.213.9651: Flags [P.], seq 249:360, ack 280, win 10481, options [nop,nop,TS val 2851287944 ecr 517864620], length 111
05:22:20.723521 ens5  In  IP 18.215.11.46.40984 > 172.31.25.213.9651: Flags [P.], seq 1406322720:1406322831, ack 39069281, win 10358, options [nop,nop,TS val 2310872105 ecr 1661578298], length 111
05:22:20.723531 ens5  Out IP 172.31.25.213.9651 > 3.218.45.144.60810: Flags [P.], seq 111:222, ack 138, win 8611, options [nop,nop,TS val 2809680274 ecr 1969809528], length 111
05:22:20.723542 ens5  Out IP 172.31.25.213.9651 > 54.174.93.130.38004: Flags [P.], seq 111:222, ack 138, win 12033, options [nop,nop,TS val 802227526 ecr 3919926092], length 111
05:22:20.723552 ens5  Out IP 172.31.25.213.33046 > 18.235.252.133.9651: Flags [P.], seq 3292954402:3292954513, ack 212128203, win 8915, options [nop,nop,TS val 567152780 ecr 979932814], length 111
05:22:20.723553 ens5  Out IP 172.31.25.213.56148 > 104.236.110.97.9651: Flags [P.], seq 112:223, ack 274, win 443, options [nop,nop,TS val 1778892472 ecr 2406915409], length 111
05:22:20.723555 ens5  Out IP 172.31.25.213.9651 > 18.215.11.46.40984: Flags [.], ack 111, win 10897, options [nop,nop,TS val 1661578306 ecr 2310872099], length 0
05:22:20.723566 ens5  Out IP 172.31.25.213.9651 > 35.169.184.86.58222: Flags [P.], seq 111:222, ack 138, win 11209, options [nop,nop,TS val 1794076245 ecr 3966923941], length 111
05:22:20.723571 ens5  Out IP 172.31.25.213.9651 > 44.214.160.107.55806: Flags [P.], seq 111:222, ack 138, win 8728, options [nop,nop,TS val 3456760343 ecr 3268076794], length 111
05:22:20.723578 ens5  Out IP 172.31.25.213.38474 > 98.82.251.216.9651: Flags [P.], seq 249:360, ack 248, win 7108, options [nop,nop,TS val 3418155326 ecr 2599729240], length 111
05:22:20.723584 ens5  Out IP 172.31.25.213.9651 > 107.23.180.98.54598: Flags [P.], seq 137:248, ack 110, win 442, options [nop,nop,TS val 3276294383 ecr 2441977893], length 111
05:22:20.723596 ens5  Out IP 172.31.25.213.9651 > 23.21.27.140.33464: Flags [P.], seq 138:249, ack 111, win 12401, options [nop,nop,TS val 373708638 ecr 3961978078], length 111
05:22:20.723609 ens5  Out IP 172.31.25.213.36798 > 50.19.116.199.9651: Flags [P.], seq 232116613:232116724, ack 503571628, win 8188, options [nop,nop,TS val 2535127663 ecr 3039162089], length 111
05:22:20.723621 ens5  Out IP 172.31.25.213.9651 > 165.227.179.96.35058: Flags [P.], seq 222:333, ack 138, win 442, options [nop,nop,TS val 1789279370 ecr 2078564877], length 111
05:22:20.723623 ens5  Out IP 172.31.25.213.9651 > 44.210.177.215.40994: Flags [P.], seq 111:222, ack 138, win 11142, options [nop,nop,TS val 1372069138 ecr 2577861116], length 111
05:22:20.723629 ens5  Out IP 172.31.25.213.58534 > 18.235.227.173.9651: Flags [P.], seq 2524870968:2524871079, ack 1231663601, win 443, options [nop,nop,TS val 2098984531 ecr 3318655332], length 111
05:22:20.723654 ens5  Out IP 172.31.25.213.9651 > 18.215.11.46.40984: Flags [P.], seq 1:138, ack 111, win 10897, options [nop,nop,TS val 1661578307 ecr 2310872099], length 137
05:22:20.723664 ens5  Out IP 172.31.25.213.9651 > 3.217.115.114.35162: Flags [P.], seq 280:747, ack 360, win 9822, options [nop,nop,TS val 517864621 ecr 2851287944], length 467
05:22:20.723749 ens5  In  IP 23.21.27.140.33464 > 172.31.25.213.9651: Flags [.], ack 249, win 6814, options [nop,nop,TS val 3961978086 ecr 373708638], length 0
05:22:20.723764 ens5  In  IP 35.169.184.86.58222 > 172.31.25.213.9651: Flags [P.], seq 138:275, ack 222, win 10512, options [nop,nop,TS val 3966923942 ecr 1794076245], length 137
05:22:20.723780 ens5  In  IP 18.235.227.173.9651 > 172.31.25.213.58534: Flags [.], ack 111, win 442, options [nop,nop,TS val 3318655338 ecr 2098984525], length 0
05:22:20.723793 ens5  In  IP 23.21.27.140.33464 > 172.31.25.213.9651: Flags [P.], seq 111:248, ack 249, win 6814, options [nop,nop,TS val 3961978086 ecr 373708638], length 137
05:22:20.723844 ens5  In  IP 18.235.252.133.9651 > 172.31.25.213.33046: Flags [P.], seq 1:138, ack 111, win 7375, options [nop,nop,TS val 979932820 ecr 567152780], length 137
05:22:20.723844 ens5  In  IP 44.214.160.107.55806 > 172.31.25.213.9651: Flags [P.], seq 138:275, ack 222, win 7580, options [nop,nop,TS val 3268076795 ecr 3456760343], length 137
05:22:20.723846 ens5  In  IP 18.235.227.173.9651 > 172.31.25.213.58534: Flags [P.], seq 1:138, ack 111, win 442, options [nop,nop,TS val 3318655338 ecr 2098984525], length 137
05:22:20.723846 ens5  In  IP 107.23.180.98.54598 > 172.31.25.213.9651: Flags [.], ack 248, win 443, options [nop,nop,TS val 2441977904 ecr 3276294383], length 0
05:22:20.723920 ens5  In  IP 98.82.251.216.9651 > 172.31.25.213.38474: Flags [P.], seq 248:385, ack 360, win 10663, options [nop,nop,TS val 2599729241 ecr 3418155326], length 137
05:22:20.723920 ens5  In  IP 54.174.93.130.38004 > 172.31.25.213.9651: Flags [P.], seq 138:275, ack 222, win 9817, options [nop,nop,TS val 3919926093 ecr 802227526], length 137
05:22:20.723950 ens5  In  IP 50.19.116.199.9651 > 172.31.25.213.36798: Flags [P.], seq 1:138, ack 111, win 9997, options [nop,nop,TS val 3039162117 ecr 2535127663], length 137
05:22:20.723986 ens5  In  IP 44.210.177.215.40994 > 172.31.25.213.9651: Flags [P.], seq 138:275, ack 222, win 7734, options [nop,nop,TS val 2577861117 ecr 1372069138], length 137
05:22:20.724049 ens5  In  IP 3.217.115.114.35162 > 172.31.25.213.9651: Flags [P.], seq 360:471, ack 747, win 10481, options [nop,nop,TS val 2851287945 ecr 517864621], length 111
05:22:20.724141 ens5  In  IP 34.227.72.239.51504 > 172.31.25.213.9651: Flags [P.], seq 229619356:229619467, ack 252441790, win 29184, options [nop,nop,TS val 3484040183 ecr 3239284766], length 111
05:22:20.724162 ens5  In  IP 107.23.180.98.54598 > 172.31.25.213.9651: Flags [P.], seq 110:247, ack 248, win 443, options [nop,nop,TS val 2441977905 ecr 3276294383], length 137
05:22:20.724172 ens5  In  IP 3.218.45.144.60810 > 172.31.25.213.9651: Flags [P.], seq 138:364, ack 222, win 11142, options [nop,nop,TS val 1969809529 ecr 2809680274], length 226
05:22:20.724192 ens5  Out IP 172.31.25.213.9651 > 3.217.115.114.35162: Flags [P.], seq 747:1395, ack 471, win 9822, options [nop,nop,TS val 517864621 ecr 2851287945], length 648
05:22:20.724240 ens5  Out IP 172.31.25.213.9651 > 3.218.45.144.60810: Flags [P.], seq 222:359, ack 364, win 8611, options [nop,nop,TS val 2809680275 ecr 1969809529], length 137
05:22:20.724241 ens5  Out IP 172.31.25.213.9651 > 34.227.72.239.51504: Flags [P.], seq 1:138, ack 111, win 9032, options [nop,nop,TS val 3239284798 ecr 3484040183], length 137
05:22:20.724253 ens5  In  IP 18.215.213.100.9651 > 172.31.25.213.46268: Flags [P.], seq 3116917585:3116917696, ack 3467604897, win 11382, options [nop,nop,TS val 3351728958 ecr 3464893747], length 111
05:22:20.724270 ens5  Out IP 172.31.25.213.46268 > 18.215.213.100.9651: Flags [.], ack 111, win 13146, options [nop,nop,TS val 3464893754 ecr 3351728951], length 0
05:22:20.724282 ens5  In  IP 35.169.184.86.58222 > 172.31.25.213.9651: Flags [P.], seq 275:386, ack 222, win 10512, options [nop,nop,TS val 3966923942 ecr 1794076245], length 111
05:22:20.724292 ens5  Out IP 172.31.25.213.9651 > 35.169.184.86.58222: Flags [.], ack 386, win 11209, options [nop,nop,TS val 1794076246 ecr 3966923942], length 0
05:22:20.724356 ens5  Out IP 172.31.25.213.9651 > 35.169.184.86.58222: Flags [P.], seq 222:359, ack 386, win 11209, options [nop,nop,TS val 1794076246 ecr 3966923942], length 137
05:22:20.724365 ens5  Out IP 172.31.25.213.46268 > 18.215.213.100.9651: Flags [P.], seq 1:138, ack 111, win 13146, options [nop,nop,TS val 3464893754 ecr 3351728951], length 137
05:22:20.724487 ens5  In  IP 18.215.213.100.9651 > 172.31.25.213.46268: Flags [P.], seq 111:222, ack 1, win 11382, options [nop,nop,TS val 3351728958 ecr 3464893747], length 111
05:22:20.724504 ens5  In  IP 54.226.62.214.9651 > 172.31.25.213.36338: Flags [P.], seq 248:359, ack 249, win 13427, options [nop,nop,TS val 3817155570 ecr 1113916785], length 111
05:22:20.724536 ens5  Out IP 172.31.25.213.36338 > 54.226.62.214.9651: Flags [.], ack 359, win 11242, options [nop,nop,TS val 1113916787 ecr 3817155569], length 0
05:22:20.724550 ens5  Out IP 172.31.25.213.46268 > 18.215.213.100.9651: Flags [P.], seq 138:275, ack 222, win 13146, options [nop,nop,TS val 3464893754 ecr 3351728958], length 137
05:22:20.724564 ens5  In  IP 52.3.14.29.53588 > 172.31.25.213.9651: Flags [P.], seq 1754715443:1754715552, ack 3628686567, win 636, options [nop,nop,TS val 1300948943 ecr 3460758520], length 109
05:22:20.724585 ens5  Out IP 172.31.25.213.36338 > 54.226.62.214.9651: Flags [P.], seq 249:386, ack 359, win 11242, options [nop,nop,TS val 1113916787 ecr 3817155569], length 137
05:22:20.724636 ens5  Out IP 172.31.25.213.9651 > 52.3.14.29.53588: Flags [P.], seq 1:136, ack 109, win 442, options [nop,nop,TS val 3460758530 ecr 1300948943], length 135
05:22:20.724787 ens5  In  IP 18.215.213.100.9651 > 172.31.25.213.46268: Flags [.], ack 275, win 11382, options [nop,nop,TS val 3351728959 ecr 3464893754], length 0
05:22:20.724880 ens5  In  IP 18.235.252.133.9651 > 172.31.25.213.33046: Flags [P.], seq 138:249, ack 111, win 7375, options [nop,nop,TS val 979932821 ecr 567152780], length 111
05:22:20.724898 ens5  Out IP 172.31.25.213.33046 > 18.235.252.133.9651: Flags [.], ack 249, win 8915, options [nop,nop,TS val 567152782 ecr 979932820], length 0
05:22:20.724937 ens5  In  IP 52.70.38.106.38132 > 172.31.25.213.9651: Flags [P.], seq 2026476727:2026476838, ack 3000300496, win 10326, options [nop,nop,TS val 1498821823 ecr 2765180393], length 111
05:22:20.724952 ens5  Out IP 172.31.25.213.33046 > 18.235.252.133.9651: Flags [P.], seq 111:248, ack 249, win 8915, options [nop,nop,TS val 567152782 ecr 979932820], length 137
05:22:20.724955 ens5  In  IP 3.218.45.144.60810 > 172.31.25.213.9651: Flags [P.], seq 364:475, ack 359, win 11142, options [nop,nop,TS val 1969809530 ecr 2809680275], length 111
05:22:20.724979 ens5  In  IP 3.217.115.114.35162 > 172.31.25.213.9651: Flags [P.], seq 471:582, ack 1395, win 10481, options [nop,nop,TS val 2851287946 ecr 517864621], length 111
05:22:20.724997 ens5  Out IP 172.31.25.213.9651 > 52.70.38.106.38132: Flags [P.], seq 1:138, ack 111, win 8625, options [nop,nop,TS val 2765180421 ecr 1498821823], length 137
05:22:20.725015 ens5  Out IP 172.31.25.213.9651 > 3.218.45.144.60810: Flags [P.], seq 359:496, ack 475, win 8611, options [nop,nop,TS val 2809680276 ecr 1969809530], length 137
05:22:20.725045 ens5  In  IP 34.228.222.195.58300 > 172.31.25.213.9651: Flags [P.], seq 3448207776:3448207886, ack 1665956921, win 12244, options [nop,nop,TS val 256510253 ecr 2368013383], length 110
05:22:20.725089 ens5  Out IP 172.31.25.213.9651 > 3.217.115.114.35162: Flags [P.], seq 1395:1862, ack 582, win 9822, options [nop,nop,TS val 517864622 ecr 2851287946], length 467
05:22:20.725106 ens5  Out IP 172.31.25.213.9651 > 34.228.222.195.58300: Flags [P.], seq 1:137, ack 110, win 11309, options [nop,nop,TS val 2368013393 ecr 256510253], length 136
05:22:20.725268 ens5  In  IP 35.169.184.86.58222 > 172.31.25.213.9651: Flags [P.], seq 386:497, ack 359, win 10512, options [nop,nop,TS val 3966923943 ecr 1794076246], length 111
05:22:20.725339 ens5  Out IP 172.31.25.213.9651 > 35.169.184.86.58222: Flags [P.], seq 359:496, ack 497, win 11209, options [nop,nop,TS val 1794076247 ecr 3966923943], length 137
05:22:20.725379 ens5  In  IP 54.225.236.76.52722 > 172.31.25.213.9651: Flags [P.], seq 1072681778:1072681888, ack 4000294551, win 443, options [nop,nop,TS val 2118128761 ecr 2944214807], length 110
05:22:20.725396 ens5  Out IP 172.31.25.213.9651 > 54.225.236.76.52722: Flags [.], ack 110, win 442, options [nop,nop,TS val 2944214827 ecr 2118128742], length 0
05:22:20.725451 ens5  Out IP 172.31.25.213.9651 > 54.225.236.76.52722: Flags [P.], seq 1:137, ack 110, win 442, options [nop,nop,TS val 2944214827 ecr 2118128742], length 136
05:22:20.725684 ens5  In  IP 52.45.71.227.40116 > 172.31.25.213.9651: Flags [P.], seq 2918555529:2918555640, ack 3537482129, win 7853, options [nop,nop,TS val 4077218755 ecr 282541975], length 111
05:22:20.725704 ens5  Out IP 172.31.25.213.9651 > 52.45.71.227.40116: Flags [.], ack 111, win 24361, options [nop,nop,TS val 282541991 ecr 4077218742], length 0
05:22:20.725761 ens5  Out IP 172.31.25.213.9651 > 52.45.71.227.40116: Flags [P.], seq 1:138, ack 111, win 24361, options [nop,nop,TS val 282541991 ecr 4077218742], length 137
05:22:20.725872 ens5  In  IP 165.227.179.96.35058 > 172.31.25.213.9651: Flags [P.], seq 138:275, ack 0, win 1376, options [nop,nop,TS val 2078564879 ecr 1789279363], length 137
05:22:20.725930 ens5  In  IP 3.217.115.114.35162 > 172.31.25.213.9651: Flags [P.], seq 582:693, ack 1862, win 10481, options [nop,nop,TS val 2851287947 ecr 517864622], length 111
05:22:20.726050 ens5  Out IP 172.31.25.213.59198 > 107.20.201.207.9651: Flags [P.], seq 3699636864:3699636975, ack 443499984, win 6684, options [nop,nop,TS val 3639323629 ecr 3776065007], length 111
05:22:20.726063 ens5  Out IP 172.31.25.213.9651 > 98.82.240.103.60350: Flags [P.], seq 1675321614:1675321725, ack 252223289, win 9839, options [nop,nop,TS val 725475036 ecr 1365328252], length 111
05:22:20.726072 ens5  Out IP 172.31.25.213.51372 > 18.207.171.20.9651: Flags [P.], seq 3835063966:3835064077, ack 694358494, win 12781, options [nop,nop,TS val 2912041511 ecr 399861744], length 111
05:22:20.726072 ens5  Out IP 172.31.25.213.9651 > 18.206.17.246.44744: Flags [P.], seq 3121222638:3121222749, ack 651633311, win 10143, options [nop,nop,TS val 746641493 ecr 2420813061], length 111
05:22:20.726073 ens5  Out IP 172.31.25.213.35954 > 3.230.225.34.9651: Flags [P.], seq 2735579063:2735579174, ack 2183390178, win 18359, options [nop,nop,TS val 152876330 ecr 3916138317], length 111
05:22:20.726083 ens5  Out IP 172.31.25.213.9651 > 3.228.129.216.48920: Flags [P.], seq 249:360, ack 248, win 10589, options [nop,nop,TS val 2443654652 ecr 3020344132], length 111
05:22:20.726085 ens5  Out IP 172.31.25.213.56148 > 104.236.110.97.9651: Flags [P.], seq 223:334, ack 274, win 443, options [nop,nop,TS val 1778892475 ecr 2406915409], length 111
05:22:20.726091 ens5  Out IP 172.31.25.213.9651 > 54.224.250.2.52504: Flags [P.], seq 249:360, ack 248, win 8387, options [nop,nop,TS val 1393044795 ecr 3910919650], length 111
05:22:20.726099 ens5  Out IP 172.31.25.213.9651 > 165.227.179.96.35058: Flags [P.], seq 333:444, ack 275, win 442, options [nop,nop,TS val 1789279372 ecr 2078564879], length 111
05:22:20.726103 ens5  Out IP 172.31.25.213.41218 > 54.197.102.41.9651: Flags [P.], seq 222:333, ack 275, win 443, options [nop,nop,TS val 790579003 ecr 604250475], length 111
05:22:20.726104 ens5  Out IP 172.31.25.213.52540 > 98.80.46.175.9651: Flags [P.], seq 111:222, ack 138, win 8388, options [nop,nop,TS val 983593504 ecr 2632997667], length 111
05:22:20.726109 ens5  Out IP 172.31.25.213.9651 > 3.218.45.144.60810: Flags [P.], seq 496:607, ack 475, win 8611, options [nop,nop,TS val 2809680277 ecr 1969809530], length 111
05:22:20.726114 ens5  Out IP 172.31.25.213.9651 > 44.210.177.215.40994: Flags [P.], seq 222:333, ack 275, win 11142, options [nop,nop,TS val 1372069140 ecr 2577861117], length 111
05:22:20.726117 ens5  Out IP 172.31.25.213.9651 > 3.217.115.114.35162: Flags [P.], seq 1862:2398, ack 693, win 9822, options [nop,nop,TS val 517864623 ecr 2851287947], length 536
05:22:20.726125 ens5  Out IP 172.31.25.213.9651 > 44.214.160.107.55806: Flags [P.], seq 222:333, ack 275, win 8728, options [nop,nop,TS val 3456760346 ecr 3268076795], length 111
05:22:20.726163 ens5  In  IP 34.195.184.106.40004 > 172.31.25.213.9651: Flags [P.], seq 138:249, ack 111, win 14068, options [nop,nop,TS val 1678487029 ecr 371109445], length 111
05:22:20.726177 ens5  Out IP 172.31.25.213.9651 > 34.195.184.106.40004: Flags [.], ack 249, win 9935, options [nop,nop,TS val 371109449 ecr 1678487025], length 0
05:22:20.726245 ens5  Out IP 172.31.25.213.9651 > 34.195.184.106.40004: Flags [P.], seq 111:248, ack 249, win 9935, options [nop,nop,TS val 371109449 ecr 1678487025], length 137
05:22:20.726257 ens5  In  IP 98.82.240.103.60350 > 172.31.25.213.9651: Flags [.], ack 111, win 13440, options [nop,nop,TS val 1365328263 ecr 725475025], length 0
05:22:20.726259 ens5  In  IP 18.206.17.246.44744 > 172.31.25.213.9651: Flags [.], ack 111, win 11788, options [nop,nop,TS val 2420813081 ecr 746641474], length 0
