tcpdump: data link type LINUX_SLL2
tcpdump: verbose output suppressed, use -v[v]... for full protocol decode
listening on any, link-type LINUX_SLL2 (Linux cooked v2), snapshot length 262144 bytes
05:18:08.441891 ens5  In  IP 18.235.252.133.9651 > 172.31.25.79.56562: Flags [.], ack 3028334794, win 8343, options [nop,nop,TS val 1789964765 ecr 2645034947], length 0
05:18:08.441918 ens5  Out IP 172.31.25.79.9651 > 34.202.198.117.59188: Flags [P.], seq 2225280711:2225280822, ack 980335197, win 6361, options [nop,nop,TS val 1363307735 ecr 642783807], length 111
05:18:08.441932 ens5  Out IP 172.31.25.79.9651 > 35.169.66.196.54922: Flags [P.], seq 3185328164:3185328275, ack 455762512, win 9977, options [nop,nop,TS val 2447130920 ecr 2528804555], length 111
05:18:08.441938 ens5  In  IP 3.93.84.116.47252 > 172.31.25.79.9651: Flags [.], ack 2551744754, win 22598, options [nop,nop,TS val 1540786097 ecr 1884980920], length 0
05:18:08.441940 ens5  In  IP 18.235.252.133.9651 > 172.31.25.79.56562: Flags [P.], seq 0:137, ack 1, win 8343, options [nop,nop,TS val 1789964765 ecr 2645034947], length 137
05:18:08.441948 ens5  In  IP 54.224.250.2.43566 > 172.31.25.79.9651: Flags [.], ack 3958065316, win 12293, options [nop,nop,TS val 1011542501 ecr 4085062110], length 0
05:18:08.441956 ens5  Out IP 172.31.25.79.9651 > 165.227.179.96.41342: Flags [P.], seq 2202148660:2202148771, ack 275860027, win 14028, options [nop,nop,TS val 1229149593 ecr 2360523631], length 111
05:18:08.441971 ens5  In  IP 50.19.116.199.9651 > 172.31.25.79.34942: Flags [.], ack 56812864, win 9076, options [nop,nop,TS val 703835447 ecr 2822669652], length 0
05:18:08.441971 ens5  In  IP 107.21.238.130.9651 > 172.31.25.79.41180: Flags [P.], seq 3687866922:3687867059, ack 1206939781, win 11073, options [nop,nop,TS val 1231097495 ecr 1016425161], length 137
05:18:08.441971 ens5  In  IP 34.234.4.103.9651 > 172.31.25.79.41832: Flags [P.], seq 552542703:552542840, ack 1338912710, win 14841, options [nop,nop,TS val 1850352164 ecr 1987708919], length 137
05:18:08.441983 ens5  Out IP 172.31.25.79.60820 > 98.82.240.103.9651: Flags [P.], seq 3399086061:3399086172, ack 2893820038, win 14787, options [nop,nop,TS val 2826819397 ecr 655579277], length 111
05:18:08.441984 ens5  In  IP 44.223.151.51.55172 > 172.31.25.79.9651: Flags [.], ack 2110342851, win 10415, options [nop,nop,TS val 216371077 ecr 1731391723], length 0
05:18:08.441993 ens5  Out IP 172.31.25.79.52452 > 3.230.225.34.9651: Flags [P.], seq 967353112:967353223, ack 3630787152, win 10153, options [nop,nop,TS val 1532984688 ecr 3008537833], length 111
05:18:08.442000 ens5  In  IP 18.206.17.246.41792 > 172.31.25.79.9651: Flags [P.], seq 3178874453:3178874705, ack 2837325072, win 6097, options [nop,nop,TS val 2038807695 ecr 434690870], length 252
05:18:08.442010 ens5  Out IP 172.31.25.79.9651 > 18.233.204.144.52630: Flags [P.], seq 3313013026:3313013137, ack 1177203750, win 10325, options [nop,nop,TS val 4074829496 ecr 4138181570], length 111
05:18:08.442020 ens5  Out IP 172.31.25.79.53766 > 18.235.227.173.9651: Flags [P.], seq 424307963:424308074, ack 2211381900, win 443, options [nop,nop,TS val 4278077242 ecr 1527718593], length 111
05:18:08.442036 ens5  In  IP 23.22.195.89.9651 > 172.31.25.79.55452: Flags [P.], seq 2460751544:2460751681, ack 2169120928, win 9437, options [nop,nop,TS val 2785038578 ecr 3299350794], length 137
05:18:08.442036 ens5  In  IP 44.223.151.51.55172 > 172.31.25.79.9651: Flags [P.], seq 0:137, ack 1, win 10415, options [nop,nop,TS val 216371077 ecr 1731391723], length 137
05:18:08.442039 ens5  In  IP 44.219.130.13.56906 > 172.31.25.79.9651: Flags [.], ack 2607325680, win 443, options [nop,nop,TS val 675486766 ecr 3084476910], length 0
05:18:08.442039 ens5  In  IP 34.196.243.223.57036 > 172.31.25.79.9651: Flags [P.], seq 481285565:481285676, ack 1693905777, win 10404, options [nop,nop,TS val 1935400235 ecr 3224526036], length 111
05:18:08.442039 ens5  In  IP 54.224.250.2.43566 > 172.31.25.79.9651: Flags [P.], seq 0:137, ack 1, win 12293, options [nop,nop,TS val 1011542501 ecr 4085062110], length 137
05:18:08.442039 ens5  In  IP 23.21.204.131.9651 > 172.31.25.79.33712: Flags [P.], seq 1781389603:1781389740, ack 3846448442, win 8780, options [nop,nop,TS val 1819479692 ecr 4033216868], length 137
05:18:08.442039 ens5  In  IP 44.219.130.13.56906 > 172.31.25.79.9651: Flags [P.], seq 0:137, ack 1, win 443, options [nop,nop,TS val 675486766 ecr 3084476910], length 137
05:18:08.442047 ens5  In  IP 50.19.116.199.9651 > 172.31.25.79.34942: Flags [P.], seq 0:137, ack 1, win 9076, options [nop,nop,TS val 703835447 ecr 2822669652], length 137
05:18:08.442047 ens5  In  IP 18.235.252.133.9651 > 172.31.25.79.56562: Flags [P.], seq 137:274, ack 112, win 8343, options [nop,nop,TS val 1789964765 ecr 2645034968], length 137
05:18:08.442051 ens5  Out IP 172.31.25.79.9651 > 34.196.243.223.57036: Flags [.], ack 111, win 12113, options [nop,nop,TS val 3224526074 ecr 1935400198], length 0
05:18:08.442058 ens5  Out IP 172.31.25.79.9651 > 18.215.11.46.46864: Flags [P.], seq 2805002932:2805003043, ack 1844738358, win 15367, options [nop,nop,TS val 2037490727 ecr 827527068], length 111
05:18:08.442072 ens5  Out IP 172.31.25.79.9651 > 52.3.189.202.52798: Flags [P.], seq 922513411:922513611, ack 2727475156, win 9765, options [nop,nop,TS val 3928441590 ecr 718959750], length 200
05:18:08.442081 ens5  Out IP 172.31.25.79.9651 > 54.197.102.41.54984: Flags [P.], seq 103634367:103634478, ack 2326258999, win 4088, options [nop,nop,TS val 2755710967 ecr 87947419], length 111
05:18:08.442082 ens5  In  IP 98.80.46.175.9651 > 172.31.25.79.58522: Flags [P.], seq 825682577:825682714, ack 3854022957, win 16925, options [nop,nop,TS val 328611551 ecr 2237684560], length 137
05:18:08.442084 ens5  In  IP 34.202.198.117.59188 > 172.31.25.79.9651: Flags [P.], seq 1:112, ack 0, win 7962, options [nop,nop,TS val 642783844 ecr 1363307708], length 111
05:18:08.442084 ens5  In  IP 3.93.84.116.47252 > 172.31.25.79.9651: Flags [P.], seq 0:137, ack 1, win 22598, options [nop,nop,TS val 1540786098 ecr 1884980920], length 137
05:18:08.442084 ens5  In  IP 3.223.220.64.9651 > 172.31.25.79.33340: Flags [P.], seq 3399168021:3399168158, ack 682339197, win 11936, options [nop,nop,TS val 3546652239 ecr 3716155228], length 137
05:18:08.442091 ens5  Out IP 172.31.25.79.33434 > 54.236.131.114.9651: Flags [P.], seq 2412644378:2412644489, ack 1946988262, win 443, options [nop,nop,TS val 2753590070 ecr 4258455807], length 111
05:18:08.442104 ens5  In  IP 54.226.62.214.9651 > 172.31.25.79.34586: Flags [P.], seq 2021991281:2021991418, ack 4199447220, win 8030, options [nop,nop,TS val 3163410634 ecr 747327104], length 137
05:18:08.442111 ens5  Out IP 172.31.25.79.38700 > 54.225.236.76.9651: Flags [P.], seq 1175556205:1175556316, ack 1608077473, win 443, options [nop,nop,TS val 2458223353 ecr 1020402883], length 111
05:18:08.442120 ens5  In  IP 35.168.79.8.41888 > 172.31.25.79.9651: Flags [P.], seq 1616662188:1616662325, ack 1926392640, win 11241, options [nop,nop,TS val 3917058517 ecr 2228863520], length 137
05:18:08.442122 ens5  Out IP 172.31.25.79.9651 > 104.236.110.97.36418: Flags [P.], seq 3266733372:3266733572, ack 3202390947, win 9293, options [nop,nop,TS val 1177408842 ecr 2353205466], length 200
05:18:08.442132 ens5  Out IP 172.31.25.79.60148 > 18.207.171.20.9651: Flags [P.], seq 3802454841:3802454952, ack 3027558627, win 10430, options [nop,nop,TS val 2924535087 ecr 2538693077], length 111
05:18:08.442142 ens5  In  IP 34.202.198.117.59188 > 172.31.25.79.9651: Flags [P.], seq 112:223, ack 111, win 7962, options [nop,nop,TS val 642783844 ecr 1363307735], length 111
05:18:08.442156 ens5  Out IP 172.31.25.79.9651 > 34.197.104.250.48606: Flags [P.], seq 3820424606:3820424717, ack 1168002412, win 11940, options [nop,nop,TS val 1977576573 ecr 812608176], length 111
05:18:08.442165 ens5  Out IP 172.31.25.79.9651 > 34.202.198.117.59188: Flags [.], ack 223, win 6361, options [nop,nop,TS val 1363307735 ecr 642783844], length 0
05:18:08.442166 ens5  Out IP 172.31.25.79.9651 > 54.227.196.194.46108: Flags [P.], seq 2986484122:2986484233, ack 3031842436, win 14194, options [nop,nop,TS val 757684748 ecr 915170500], length 111
05:18:08.442174 ens5  In  IP 107.20.201.207.9651 > 172.31.25.79.34770: Flags [P.], seq 3685298576:3685298713, ack 633556384, win 8485, options [nop,nop,TS val 4240149730 ecr 307881683], length 137
05:18:08.442174 ens5  In  IP 98.82.240.103.9651 > 172.31.25.79.60820: Flags [.], ack 0, win 19186, options [nop,nop,TS val 655579303 ecr 2826819372], length 0
05:18:08.442181 ens5  Out IP 172.31.25.79.9651 > 35.174.148.147.40210: Flags [P.], seq 1088141351:1088141462, ack 3666803004, win 7055, options [nop,nop,TS val 4284277996 ecr 2075371661], length 111
05:18:08.442190 ens5  Out IP 172.31.25.79.9651 > 34.202.198.117.59188: Flags [P.], seq 111:222, ack 223, win 6361, options [nop,nop,TS val 1363307735 ecr 642783844], length 111
05:18:08.442199 ens5  Out IP 172.31.25.79.40116 > 34.206.101.137.9651: Flags [P.], seq 2914658419:2914658530, ack 3531396470, win 7853, options [nop,nop,TS val 4076966472 ecr 282289678], length 111
05:18:08.442209 ens5  Out IP 172.31.25.79.49936 > 98.83.188.107.9651: Flags [P.], seq 1214863729:1214863840, ack 2524489916, win 9996, options [nop,nop,TS val 2359435113 ecr 2874830817], length 111
05:18:08.442218 ens5  Out IP 172.31.25.79.9651 > 52.200.197.163.44042: Flags [P.], seq 569938224:569938335, ack 2130536484, win 14340, options [nop,nop,TS val 3243756918 ecr 1541096731], length 111
05:18:08.442218 ens5  Out IP 172.31.25.79.56562 > 18.235.252.133.9651: Flags [.], ack 274, win 9822, options [nop,nop,TS val 2645034968 ecr 1789964765], length 0
05:18:08.442227 ens5  Out IP 172.31.25.79.9651 > 23.22.40.156.39966: Flags [P.], seq 797211768:797211879, ack 3360570455, win 18414, options [nop,nop,TS val 9284762 ecr 1108061039], length 111
05:18:08.442230 ens5  In  IP 18.235.227.173.9651 > 172.31.25.79.53766: Flags [P.], seq 1:138, ack 111, win 442, options [nop,nop,TS val 1527718630 ecr 4278077242], length 137
05:18:08.442236 ens5  Out IP 172.31.25.79.60624 > 18.215.213.100.9651: Flags [P.], seq 692835213:692835324, ack 175848766, win 9532, options [nop,nop,TS val 3839596595 ecr 374192907], length 111
05:18:08.442246 ens5  In  IP 98.82.240.103.9651 > 172.31.25.79.60820: Flags [P.], seq 1:138, ack 0, win 19186, options [nop,nop,TS val 655579303 ecr 2826819372], length 137
05:18:08.442246 ens5  In  IP 35.169.66.196.54922 > 172.31.25.79.9651: Flags [.], ack 111, win 11048, options [nop,nop,TS val 2528804581 ecr 2447130895], length 0
05:18:08.442246 ens5  In  IP 18.233.204.144.52630 > 172.31.25.79.9651: Flags [.], ack 111, win 11630, options [nop,nop,TS val 4138181587 ecr 4074829479], length 0
05:18:08.442252 ens5  Out IP 172.31.25.79.9651 > 54.174.93.130.53908: Flags [P.], seq 1987931986:1987932097, ack 1289540607, win 13236, options [nop,nop,TS val 1529807356 ecr 1458982097], length 111
05:18:08.442261 ens5  Out IP 172.31.25.79.9651 > 165.227.179.96.41342: Flags [P.], seq 111:222, ack 1, win 14028, options [nop,nop,TS val 1229149593 ecr 2360523631], length 111
05:18:08.442270 ens5  Out IP 172.31.25.79.55452 > 23.22.195.89.9651: Flags [P.], seq 1:112, ack 137, win 11317, options [nop,nop,TS val 3299350794 ecr 2785038578], length 111
05:18:08.442281 ens5  In  IP 3.230.225.34.9651 > 172.31.25.79.52452: Flags [P.], seq 1:138, ack 111, win 15573, options [nop,nop,TS val 3008537879 ecr 1532984688], length 137
05:18:08.442292 ens5  In  IP 107.23.226.228.9651 > 172.31.25.79.55242: Flags [P.], seq 720772868:720772979, ack 1751569049, win 7152, options [nop,nop,TS val 2254887806 ecr 3133669611], length 111
05:18:08.442335 ens5  Out IP 172.31.25.79.55242 > 107.23.226.228.9651: Flags [.], ack 111, win 6698, options [nop,nop,TS val 3133669639 ecr 2254887779], length 0
05:18:08.442345 ens5  In  IP 18.233.204.144.52630 > 172.31.25.79.9651: Flags [P.], seq 1:138, ack 111, win 11630, options [nop,nop,TS val 4138181587 ecr 4074829479], length 137
05:18:08.442345 ens5  Out IP 172.31.25.79.52452 > 3.230.225.34.9651: Flags [.], ack 138, win 10153, options [nop,nop,TS val 1532984688 ecr 3008537879], length 0
05:18:08.442345 ens5  In  IP 35.169.66.196.54922 > 172.31.25.79.9651: Flags [P.], seq 1:138, ack 111, win 11048, options [nop,nop,TS val 2528804582 ecr 2447130895], length 137
05:18:08.442345 ens5  In  IP 98.82.240.103.9651 > 172.31.25.79.60820: Flags [P.], seq 138:275, ack 111, win 19186, options [nop,nop,TS val 655579303 ecr 2826819397], length 137
05:18:08.442362 ens5  In  IP 52.3.189.202.52798 > 172.31.25.79.9651: Flags [P.], seq 1:253, ack 200, win 9528, options [nop,nop,TS val 718959768 ecr 3928441590], length 252
05:18:08.442362 ens5  In  IP 34.206.101.137.9651 > 172.31.25.79.40116: Flags [.], ack 111, win 24361, options [nop,nop,TS val 282289707 ecr 4076966447], length 0
05:18:08.442393 ens5  Out IP 172.31.25.79.41832 > 34.234.4.103.9651: Flags [P.], seq 1:112, ack 137, win 11756, options [nop,nop,TS val 1987708919 ecr 1850352164], length 111
05:18:08.442423 ens5  In  IP 34.206.101.137.9651 > 172.31.25.79.40116: Flags [P.], seq 1:138, ack 111, win 24361, options [nop,nop,TS val 282289707 ecr 4076966447], length 137
05:18:08.442423 ens5  In  IP 34.197.148.157.58920 > 172.31.25.79.9651: Flags [P.], seq 1974899496:1974899607, ack 3325604286, win 12461, options [nop,nop,TS val 1218584545 ecr 2599195469], length 111
05:18:08.442444 ens5  In  IP 23.22.40.156.39966 > 172.31.25.79.9651: Flags [P.], seq 1:138, ack 111, win 30236, options [nop,nop,TS val 1108061065 ecr 9284762], length 137
05:18:08.442445 ens5  In  IP 98.83.188.107.9651 > 172.31.25.79.49936: Flags [.], ack 111, win 14019, options [nop,nop,TS val 2874830845 ecr 2359435085], length 0
05:18:08.442445 ens5  In  IP 54.225.236.76.9651 > 172.31.25.79.38700: Flags [P.], seq 1:138, ack 111, win 3087, options [nop,nop,TS val 1020402902 ecr 2458223353], length 137
05:18:08.442465 ens5  Out IP 172.31.25.79.60820 > 98.82.240.103.9651: Flags [.], ack 275, win 14787, options [nop,nop,TS val 2826819397 ecr 655579303], length 0
05:18:08.442478 ens5  In  IP 18.215.11.46.46864 > 172.31.25.79.9651: Flags [P.], seq 1:138, ack 111, win 11464, options [nop,nop,TS val 827527105 ecr 2037490727], length 137
05:18:08.442478 ens5  In  IP 54.236.131.114.9651 > 172.31.25.79.33434: Flags [P.], seq 1:138, ack 111, win 2574, options [nop,nop,TS val 4258455835 ecr 2753590070], length 137
05:18:08.442478 ens5  In  IP 18.207.171.20.9651 > 172.31.25.79.60148: Flags [P.], seq 1:138, ack 111, win 11124, options [nop,nop,TS val 2538693115 ecr 2924535087], length 137
05:18:08.442478 ens5  In  IP 54.227.196.194.46108 > 172.31.25.79.9651: Flags [P.], seq 1:138, ack 111, win 8057, options [nop,nop,TS val 915170538 ecr 757684748], length 137
05:18:08.442478 ens5  In  IP 52.200.197.163.44042 > 172.31.25.79.9651: Flags [P.], seq 1:138, ack 111, win 14224, options [nop,nop,TS val 1541096749 ecr 3243756918], length 137
05:18:08.442508 ens5  In  IP 35.174.148.147.40210 > 172.31.25.79.9651: Flags [.], ack 111, win 11921, options [nop,nop,TS val 2075371683 ecr 4284277974], length 0
05:18:08.442508 ens5  In  IP 34.197.104.250.48606 > 172.31.25.79.9651: Flags [.], ack 111, win 19626, options [nop,nop,TS val 812608188 ecr 1977576561], length 0
05:18:08.442508 ens5  In  IP 18.215.213.100.9651 > 172.31.25.79.60624: Flags [P.], seq 1:112, ack 111, win 9963, options [nop,nop,TS val 374192926 ecr 3839596595], length 111
05:18:08.442508 ens5  In  IP 98.83.188.107.9651 > 172.31.25.79.49936: Flags [P.], seq 1:138, ack 111, win 14019, options [nop,nop,TS val 2874830846 ecr 2359435085], length 137
05:18:08.442511 ens5  Out IP 172.31.25.79.9651 > 34.202.198.117.59188: Flags [P.], seq 222:474, ack 223, win 6361, options [nop,nop,TS val 1363307735 ecr 642783844], length 252
05:18:08.442534 ens5  In  IP 3.227.69.165.33672 > 172.31.25.79.9651: Flags [P.], seq 1819144675:1819144786, ack 648186327, win 11342, options [nop,nop,TS val 469503617 ecr 3486266014], length 111
05:18:08.442565 ens5  Out IP 172.31.25.79.9651 > 3.227.69.165.33672: Flags [.], ack 111, win 9925, options [nop,nop,TS val 3486266053 ecr 469503598], length 0
05:18:08.442582 ens5  In  IP 54.174.93.130.53908 > 172.31.25.79.9651: Flags [.], ack 111, win 8350, options [nop,nop,TS val 1458982124 ecr 1529807330], length 0
05:18:08.442595 ens5  In  IP 34.197.104.250.48606 > 172.31.25.79.9651: Flags [P.], seq 1:138, ack 111, win 19626, options [nop,nop,TS val 812608188 ecr 1977576561], length 137
05:18:08.442595 ens5  In  IP 23.22.195.89.9651 > 172.31.25.79.55452: Flags [P.], seq 137:274, ack 112, win 9437, options [nop,nop,TS val 2785038578 ecr 3299350794], length 137
05:18:08.442601 ens5  In  IP 54.158.175.165.40876 > 172.31.25.79.9651: Flags [P.], seq 380514008:380514145, ack 3377680562, win 13150, options [nop,nop,TS val 2343204738 ecr 1464561475], length 137
05:18:08.442629 ens5  In  IP 34.202.198.117.59188 > 172.31.25.79.9651: Flags [P.], seq 223:360, ack 222, win 7962, options [nop,nop,TS val 642783845 ecr 1363307735], length 137
05:18:08.442661 ens5  In  IP 34.234.4.103.9651 > 172.31.25.79.41832: Flags [P.], seq 137:306, ack 112, win 14841, options [nop,nop,TS val 1850352164 ecr 1987708919], length 169
05:18:08.442678 ens5  In  IP 54.174.93.130.53908 > 172.31.25.79.9651: Flags [P.], seq 1:138, ack 111, win 8350, options [nop,nop,TS val 1458982124 ecr 1529807330], length 137
05:18:08.442702 ens5  In  IP 18.215.213.100.9651 > 172.31.25.79.60624: Flags [P.], seq 112:223, ack 111, win 9963, options [nop,nop,TS val 374192927 ecr 3839596595], length 111
05:18:08.442723 ens5  Out IP 172.31.25.79.60624 > 18.215.213.100.9651: Flags [.], ack 223, win 9532, options [nop,nop,TS val 3839596596 ecr 374192926], length 0
05:18:08.442792 ens5  In  IP 3.225.79.249.9651 > 172.31.25.79.60096: Flags [P.], seq 3121837918:3121838055, ack 99549711, win 14966, options [nop,nop,TS val 2059963374 ecr 3347947120], length 137
05:18:08.442818 ens5  Out IP 172.31.25.79.55242 > 107.23.226.228.9651: Flags [P.], seq 1:138, ack 111, win 6698, options [nop,nop,TS val 3133669640 ecr 2254887779], length 137
05:18:08.442850 ens5  In  IP 54.197.102.41.54984 > 172.31.25.79.9651: Flags [P.], seq 1:138, ack 111, win 443, options [nop,nop,TS val 87947449 ecr 2755710967], length 137
05:18:08.442862 ens5  Out IP 172.31.25.79.9651 > 34.196.243.223.57036: Flags [P.], seq 1:138, ack 111, win 12114, options [nop,nop,TS val 3224526075 ecr 1935400198], length 137
05:18:08.442882 ens5  Out IP 172.31.25.79.9651 > 34.197.148.157.58920: Flags [P.], seq 1:138, ack 111, win 11439, options [nop,nop,TS val 2599195485 ecr 1218584545], length 137
05:18:08.442936 ens5  In  IP 18.215.213.100.9651 > 172.31.25.79.60624: Flags [P.], seq 223:360, ack 111, win 9963, options [nop,nop,TS val 374192927 ecr 3839596595], length 137
05:18:08.442954 ens5  Out IP 172.31.25.79.9651 > 3.227.69.165.33672: Flags [P.], seq 1:138, ack 111, win 9925, options [nop,nop,TS val 3486266054 ecr 469503598], length 137
05:18:08.442990 ens5  In  IP 34.202.198.117.59188 > 172.31.25.79.9651: Flags [P.], seq 360:497, ack 474, win 7962, options [nop,nop,TS val 642783845 ecr 1363307735], length 137
05:18:08.443013 ens5  Out IP 172.31.25.79.9651 > 34.202.198.117.59188: Flags [.], ack 497, win 6361, options [nop,nop,TS val 1363307736 ecr 642783845], length 0
05:18:08.443091 ens5  Out IP 172.31.25.79.60624 > 18.215.213.100.9651: Flags [P.], seq 248:385, ack 360, win 9532, options [nop,nop,TS val 3839596596 ecr 374192927], length 137
05:18:08.443316 ens5  In  IP 18.215.213.100.9651 > 172.31.25.79.60624: Flags [.], ack 385, win 9963, options [nop,nop,TS val 374192927 ecr 3839596596], length 0
05:18:08.443326 ens5  In  IP 34.234.4.103.9651 > 172.31.25.79.41832: Flags [P.], seq 306:773, ack 223, win 14841, options [nop,nop,TS val 1850352165 ecr 1987708920], length 467
05:18:08.443422 ens5  In  IP 35.174.148.147.40210 > 172.31.25.79.9651: Flags [P.], seq 1:138, ack 111, win 11921, options [nop,nop,TS val 2075371684 ecr 4284277974], length 137
05:18:08.443440 ens5  Out IP 172.31.25.79.41832 > 34.234.4.103.9651: Flags [P.], seq 223:334, ack 773, win 11756, options [nop,nop,TS val 1987708920 ecr 1850352165], length 111
05:18:08.443554 ens5  In  IP 3.232.45.182.9651 > 172.31.25.79.39764: Flags [P.], seq 2488324966:2488325077, ack 99926542, win 12386, options [nop,nop,TS val 2460883121 ecr 1688636193], length 111
05:18:08.443563 ens5  Out IP 172.31.25.79.39764 > 3.232.45.182.9651: Flags [.], ack 111, win 11090, options [nop,nop,TS val 1688636227 ecr 2460883090], length 0
05:18:08.443632 ens5  Out IP 172.31.25.79.39764 > 3.232.45.182.9651: Flags [P.], seq 1:138, ack 111, win 11091, options [nop,nop,TS val 1688636227 ecr 2460883090], length 137
05:18:08.443660 ens5  In  IP 54.197.55.84.9651 > 172.31.25.79.55116: Flags [P.], seq 1303039132:1303039243, ack 3200623355, win 15384, options [nop,nop,TS val 1391667377 ecr 3022483102], length 111
05:18:08.443664 ens5  In  IP 52.3.189.202.52798 > 172.31.25.79.9651: Flags [P.], seq 253:364, ack 200, win 9528, options [nop,nop,TS val 718959770 ecr 3928441590], length 111
05:18:08.443685 ens5  Out IP 172.31.25.79.9651 > 52.3.189.202.52798: Flags [.], ack 364, win 9765, options [nop,nop,TS val 3928441591 ecr 718959768], length 0
05:18:08.443707 ens5  In  IP 34.234.4.103.9651 > 172.31.25.79.41832: Flags [P.], seq 773:1421, ack 334, win 14841, options [nop,nop,TS val 1850352165 ecr 1987708920], length 648
05:18:08.443736 ens5  Out IP 172.31.25.79.55116 > 54.197.55.84.9651: Flags [P.], seq 1:138, ack 111, win 13433, options [nop,nop,TS val 3022483114 ecr 1391667377], length 137
05:18:08.443752 ens5  Out IP 172.31.25.79.9651 > 52.3.189.202.52798: Flags [P.], seq 200:337, ack 364, win 9765, options [nop,nop,TS val 3928441592 ecr 718959768], length 137
05:18:08.443793 ens5  In  IP 54.224.250.2.43566 > 172.31.25.79.9651: Flags [P.], seq 137:248, ack 1, win 12293, options [nop,nop,TS val 1011542503 ecr 4085062110], length 111
05:18:08.443793 ens5  In  IP 3.232.45.182.9651 > 172.31.25.79.39764: Flags [P.], seq 111:222, ack 1, win 12386, options [nop,nop,TS val 2460883122 ecr 1688636227], length 111
05:18:08.443818 ens5  Out IP 172.31.25.79.9651 > 54.224.250.2.43566: Flags [.], ack 248, win 7929, options [nop,nop,TS val 4085062129 ecr 1011542501], length 0
05:18:08.443834 ens5  Out IP 172.31.25.79.41832 > 34.234.4.103.9651: Flags [P.], seq 334:445, ack 1421, win 11756, options [nop,nop,TS val 1987708921 ecr 1850352165], length 111
05:18:08.443869 ens5  Out IP 172.31.25.79.9651 > 54.224.250.2.43566: Flags [P.], seq 1:138, ack 248, win 7929, options [nop,nop,TS val 4085062129 ecr 1011542501], length 137
05:18:08.443885 ens5  Out IP 172.31.25.79.39764 > 3.232.45.182.9651: Flags [P.], seq 138:275, ack 222, win 11091, options [nop,nop,TS val 1688636228 ecr 2460883122], length 137
05:18:08.443966 ens5  In  IP 18.235.252.133.9651 > 172.31.25.79.56562: Flags [P.], seq 274:385, ack 112, win 8343, options [nop,nop,TS val 1789964767 ecr 2645034968], length 111
05:18:08.444027 ens5  Out IP 172.31.25.79.56562 > 18.235.252.133.9651: Flags [P.], seq 112:249, ack 385, win 9822, options [nop,nop,TS val 2645034970 ecr 1789964767], length 137
05:18:08.444030 ens5  In  IP 98.80.46.175.9651 > 172.31.25.79.58522: Flags [P.], seq 137:248, ack 1, win 16925, options [nop,nop,TS val 328611553 ecr 2237684560], length 111
05:18:08.444042 ens5  Out IP 172.31.25.79.58522 > 98.80.46.175.9651: Flags [.], ack 248, win 10179, options [nop,nop,TS val 2237684562 ecr 328611551], length 0
05:18:08.444093 ens5  In  IP 3.232.45.182.9651 > 172.31.25.79.39764: Flags [.], ack 275, win 12386, options [nop,nop,TS val 2460883122 ecr 1688636227], length 0
05:18:08.444098 ens5  Out IP 172.31.25.79.58522 > 98.80.46.175.9651: Flags [P.], seq 1:138, ack 248, win 10179, options [nop,nop,TS val 2237684562 ecr 328611551], length 137
05:18:08.444109 ens5  In  IP 34.234.4.103.9651 > 172.31.25.79.41832: Flags [P.], seq 1421:1888, ack 445, win 14841, options [nop,nop,TS val 1850352166 ecr 1987708921], length 467
05:18:08.444204 ens5  Out IP 172.31.25.79.41832 > 34.234.4.103.9651: Flags [P.], seq 445:556, ack 1888, win 11756, options [nop,nop,TS val 1987708921 ecr 1850352166], length 111
05:18:08.444251 ens5  In  IP 52.71.181.255.9651 > 172.31.25.79.57770: Flags [P.], seq 3732788432:3732788543, ack 1977100978, win 7205, options [nop,nop,TS val 84288939 ecr 1173740920], length 111
05:18:08.444304 ens5  Out IP 172.31.25.79.57770 > 52.71.181.255.9651: Flags [P.], seq 1:138, ack 111, win 8532, options [nop,nop,TS val 1173740931 ecr 84288939], length 137
05:18:08.444379 ens5  In  IP 18.233.204.144.52630 > 172.31.25.79.9651: Flags [P.], seq 138:249, ack 111, win 11630, options [nop,nop,TS val 4138181590 ecr 4074829479], length 111
05:18:08.444394 ens5  Out IP 172.31.25.79.9651 > 18.233.204.144.52630: Flags [.], ack 249, win 10325, options [nop,nop,TS val 4074829498 ecr 4138181587], length 0
05:18:08.444444 ens5  Out IP 172.31.25.79.9651 > 18.233.204.144.52630: Flags [P.], seq 111:248, ack 249, win 10325, options [nop,nop,TS val 4074829498 ecr 4138181587], length 137
05:18:08.444478 ens5  In  IP 34.234.4.103.9651 > 172.31.25.79.41832: Flags [P.], seq 1888:2424, ack 556, win 14841, options [nop,nop,TS val 1850352166 ecr 1987708921], length 536
05:18:08.444645 ens5  In  IP 3.230.225.34.9651 > 172.31.25.79.52452: Flags [P.], seq 138:249, ack 111, win 15573, options [nop,nop,TS val 3008537881 ecr 1532984688], length 111
05:18:08.444658 ens5  Out IP 172.31.25.79.52452 > 3.230.225.34.9651: Flags [.], ack 249, win 10153, options [nop,nop,TS val 1532984690 ecr 3008537881], length 0
05:18:08.444745 ens5  Out IP 172.31.25.79.52452 > 3.230.225.34.9651: Flags [P.], seq 111:337, ack 249, win 10153, options [nop,nop,TS val 1532984691 ecr 3008537881], length 226
05:18:08.444802 ens5  In  IP 35.169.184.86.9651 > 172.31.25.79.54510: Flags [P.], seq 1598362205:1598362316, ack 1175397640, win 17993, options [nop,nop,TS val 3593307204 ecr 806788117], length 111
05:18:08.444810 ens5  Out IP 172.31.25.79.54510 > 35.169.184.86.9651: Flags [.], ack 111, win 11320, options [nop,nop,TS val 806788149 ecr 3593307175], length 0
05:18:08.444871 ens5  Out IP 172.31.25.79.54510 > 35.169.184.86.9651: Flags [P.], seq 1:138, ack 111, win 11321, options [nop,nop,TS val 806788149 ecr 3593307175], length 137
05:18:08.444938 ens5  In  IP 34.202.51.225.9651 > 172.31.25.79.39828: Flags [P.], seq 3338220220:3338220331, ack 2010498127, win 12649, options [nop,nop,TS val 2042698498 ecr 148754802], length 111
05:18:08.445005 ens5  Out IP 172.31.25.79.39828 > 34.202.51.225.9651: Flags [P.], seq 1:138, ack 111, win 7545, options [nop,nop,TS val 148754830 ecr 2042698498], length 137
05:18:08.445034 ens5  In  IP 52.71.181.255.9651 > 172.31.25.79.57770: Flags [P.], seq 111:222, ack 138, win 7205, options [nop,nop,TS val 84288940 ecr 1173740931], length 111
05:18:08.445079 ens5  In  IP 44.218.214.164.9651 > 172.31.25.79.51110: Flags [P.], seq 2669309583:2669309694, ack 1094581996, win 11761, options [nop,nop,TS val 3447253146 ecr 2658450780], length 111
05:18:08.445082 ens5  In  IP 3.230.225.34.9651 > 172.31.25.79.52452: Flags [P.], seq 249:418, ack 337, win 15573, options [nop,nop,TS val 3008537881 ecr 1532984691], length 169
05:18:08.445111 ens5  Out IP 172.31.25.79.57770 > 52.71.181.255.9651: Flags [P.], seq 138:275, ack 222, win 8532, options [nop,nop,TS val 1173740932 ecr 84288940], length 137
05:18:08.445197 ens5  Out IP 172.31.25.79.51110 > 44.218.214.164.9651: Flags [P.], seq 1:138, ack 111, win 8640, options [nop,nop,TS val 2658450796 ecr 3447253146], length 137
05:18:08.445208 ens5  Out IP 172.31.25.79.52452 > 3.230.225.34.9651: Flags [P.], seq 337:448, ack 418, win 10153, options [nop,nop,TS val 1532984691 ecr 3008537881], length 111
05:18:08.445497 ens5  In  IP 3.230.225.34.9651 > 172.31.25.79.52452: Flags [P.], seq 418:885, ack 448, win 15573, options [nop,nop,TS val 3008537882 ecr 1532984691], length 467
05:18:08.445605 ens5  Out IP 172.31.25.79.52452 > 3.230.225.34.9651: Flags [P.], seq 448:559, ack 885, win 10153, options [nop,nop,TS val 1532984691 ecr 3008537882], length 111
05:18:08.445729 ens5  In  IP 107.23.180.98.9651 > 172.31.25.79.47310: Flags [P.], seq 533681121:533681231, ack 2408492678, win 2974, options [nop,nop,TS val 321001936 ecr 1367947015], length 110
05:18:08.445774 ens5  In  IP 98.83.188.107.9651 > 172.31.25.79.49936: Flags [P.], seq 138:249, ack 111, win 14019, options [nop,nop,TS val 2874830849 ecr 2359435085], length 111
05:18:08.445790 ens5  In  IP 50.19.116.199.9651 > 172.31.25.79.34942: Flags [P.], seq 137:248, ack 1, win 9076, options [nop,nop,TS val 703835451 ecr 2822669652], length 111
05:18:08.445791 ens5  Out IP 172.31.25.79.49936 > 98.83.188.107.9651: Flags [.], ack 249, win 9996, options [nop,nop,TS val 2359435117 ecr 2874830846], length 0
05:18:08.445794 ens5  Out IP 172.31.25.79.47310 > 107.23.180.98.9651: Flags [P.], seq 1:137, ack 110, win 2379, options [nop,nop,TS val 1367947028 ecr 321001936], length 136
05:18:08.445805 ens5  Out IP 172.31.25.79.34942 > 50.19.116.199.9651: Flags [.], ack 248, win 7544, options [nop,nop,TS val 2822669670 ecr 703835447], length 0
05:18:08.445862 ens5  Out IP 172.31.25.79.34942 > 50.19.116.199.9651: Flags [P.], seq 1:138, ack 248, win 7544, options [nop,nop,TS val 2822669670 ecr 703835447], length 137
05:18:08.445869 ens5  In  IP 50.19.116.199.9651 > 172.31.25.79.34942: Flags [P.], seq 248:359, ack 1, win 9076, options [nop,nop,TS val 703835451 ecr 2822669652], length 111
05:18:08.445874 ens5  Out IP 172.31.25.79.49936 > 98.83.188.107.9651: Flags [P.], seq 111:248, ack 249, win 9996, options [nop,nop,TS val 2359435117 ecr 2874830846], length 137
05:18:08.445904 ens5  In  IP 3.230.225.34.9651 > 172.31.25.79.52452: Flags [P.], seq 885:1533, ack 559, win 15573, options [nop,nop,TS val 3008537882 ecr 1532984691], length 648
05:18:08.445956 ens5  In  IP 18.207.171.20.9651 > 172.31.25.79.60148: Flags [P.], seq 138:249, ack 111, win 11124, options [nop,nop,TS val 2538693118 ecr 2924535087], length 111
05:18:08.445959 ens5  Out IP 172.31.25.79.34942 > 50.19.116.199.9651: Flags [P.], seq 138:275, ack 359, win 7544, options [nop,nop,TS val 2822669670 ecr 703835451], length 137
05:18:08.445970 ens5  Out IP 172.31.25.79.60148 > 18.207.171.20.9651: Flags [.], ack 249, win 10430, options [nop,nop,TS val 2924535091 ecr 2538693115], length 0
05:18:08.446035 ens5  Out IP 172.31.25.79.60148 > 18.207.171.20.9651: Flags [P.], seq 111:248, ack 249, win 10430, options [nop,nop,TS val 2924535091 ecr 2538693115], length 137
05:18:08.446044 ens5  Out IP 172.31.25.79.52452 > 3.230.225.34.9651: Flags [P.], seq 559:670, ack 1533, win 10153, options [nop,nop,TS val 1532984692 ecr 3008537882], length 111
05:18:08.446234 ens5  In  IP 44.214.160.107.56518 > 172.31.25.79.9651: Flags [P.], seq 1716596520:1716596631, ack 3038384461, win 15271, options [nop,nop,TS val 1171550941 ecr 1906149709], length 111
05:18:08.446252 ens5  In  IP 52.70.38.106.9651 > 172.31.25.79.56458: Flags [P.], seq 3140635985:3140636096, ack 748366789, win 12035, options [nop,nop,TS val 1285792385 ecr 1127481566], length 111
05:18:08.446295 ens5  Out IP 172.31.25.79.9651 > 44.214.160.107.56518: Flags [P.], seq 1:138, ack 111, win 12231, options [nop,nop,TS val 1906149740 ecr 1171550941], length 137
05:18:08.446321 ens5  In  IP 3.230.225.34.9651 > 172.31.25.79.52452: Flags [P.], seq 1533:2000, ack 670, win 15573, options [nop,nop,TS val 3008537883 ecr 1532984692], length 467
05:18:08.446329 ens5  Out IP 172.31.25.79.56458 > 52.70.38.106.9651: Flags [P.], seq 1:138, ack 111, win 10988, options [nop,nop,TS val 1127481584 ecr 1285792385], length 137
05:18:08.446441 ens5  Out IP 172.31.25.79.52452 > 3.230.225.34.9651: Flags [P.], seq 670:781, ack 2000, win 10153, options [nop,nop,TS val 1532984692 ecr 3008537883], length 111
05:18:08.446552 ens5  In  IP 50.19.116.199.9651 > 172.31.25.79.34942: Flags [.], ack 275, win 9076, options [nop,nop,TS val 703835451 ecr 2822669670], length 0
05:18:08.446563 ens5  In  IP 34.195.184.106.9651 > 172.31.25.79.56706: Flags [P.], seq 2945027687:2945027798, ack 2459176055, win 15936, options [nop,nop,TS val 2579306130 ecr 2006267316], length 111
05:18:08.446568 ens5  Out IP 172.31.25.79.56706 > 34.195.184.106.9651: Flags [.], ack 111, win 14975, options [nop,nop,TS val 2006267348 ecr 2579306099], length 0
05:18:08.446625 ens5  Out IP 172.31.25.79.56706 > 34.195.184.106.9651: Flags [P.], seq 1:138, ack 111, win 14976, options [nop,nop,TS val 2006267348 ecr 2579306099], length 137
05:18:08.446668 ens5  In  IP 3.230.225.34.9651 > 172.31.25.79.52452: Flags [P.], seq 2000:2536, ack 781, win 15573, options [nop,nop,TS val 3008537883 ecr 1532984692], length 536
05:18:08.446703 ens5  Out IP 172.31.25.79.9651 > 34.205.163.144.59490: Flags [.], ack 4237141753, win 34752, options [nop,nop,TS val 1762995239 ecr 406414779], length 0
05:18:08.446711 ens5  In  IP 34.195.184.106.9651 > 172.31.25.79.56706: Flags [P.], seq 111:222, ack 1, win 15936, options [nop,nop,TS val 2579306130 ecr 2006267316], length 111
05:18:08.446722 ens5  In  IP 44.210.177.215.9651 > 172.31.25.79.45396: Flags [P.], seq 2589748303:2589748414, ack 1817003986, win 12299, options [nop,nop,TS val 2933861519 ecr 1499496422], length 111
05:18:08.446823 ens5  In  IP 54.146.211.74.56718 > 172.31.25.79.9651: Flags [P.], seq 1986052662:1986052773, ack 1023267931, win 17811, options [nop,nop,TS val 1590270338 ecr 1744634358], length 111
05:18:08.446909 ens5  Out IP 172.31.25.79.9651 > 54.146.211.74.56718: Flags [P.], seq 1:138, ack 111, win 19845, options [nop,nop,TS val 1744634372 ecr 1590270338], length 137
05:18:08.446909 ens5  In  IP 54.225.236.76.9651 > 172.31.25.79.38700: Flags [P.], seq 138:248, ack 111, win 3087, options [nop,nop,TS val 1020402906 ecr 2458223353], length 110
05:18:08.446920 ens5  Out IP 172.31.25.79.45396 > 44.210.177.215.9651: Flags [P.], seq 1:227, ack 111, win 10891, options [nop,nop,TS val 1499496453 ecr 2933861519], length 226
05:18:08.446923 ens5  Out IP 172.31.25.79.38700 > 54.225.236.76.9651: Flags [.], ack 248, win 443, options [nop,nop,TS val 2458223358 ecr 1020402902], length 0
05:18:08.446934 ens5  Out IP 172.31.25.79.56706 > 34.195.184.106.9651: Flags [P.], seq 138:275, ack 222, win 14976, options [nop,nop,TS val 2006267349 ecr 2579306130], length 137
05:18:08.446969 ens5  Out IP 172.31.25.79.38700 > 54.225.236.76.9651: Flags [P.], seq 111:247, ack 248, win 443, options [nop,nop,TS val 2458223358 ecr 1020402902], length 136
05:18:08.446981 ens5  In  IP 34.227.72.239.52918 > 172.31.25.79.9651: Flags [P.], seq 3959453941:3959454052, ack 1050729847, win 28618, options [nop,nop,TS val 4112578067 ecr 1997806641], length 111
05:18:08.446988 ens5  In  IP 18.206.17.246.41792 > 172.31.25.79.9651: Flags [P.], seq 252:363, ack 1, win 6097, options [nop,nop,TS val 2038807700 ecr 434690870], length 111
05:18:08.447001 ens5  In  IP 34.197.104.250.48606 > 172.31.25.79.9651: Flags [P.], seq 138:249, ack 111, win 19626, options [nop,nop,TS val 812608193 ecr 1977576561], length 111
05:18:08.447008 ens5  Out IP 172.31.25.79.9651 > 18.206.17.246.41792: Flags [.], ack 363, win 9858, options [nop,nop,TS val 434690875 ecr 2038807695], length 0
05:18:08.447014 ens5  Out IP 172.31.25.79.9651 > 34.197.104.250.48606: Flags [.], ack 249, win 11940, options [nop,nop,TS val 1977576578 ecr 812608188], length 0
05:18:08.447084 ens5  Out IP 172.31.25.79.9651 > 34.197.104.250.48606: Flags [P.], seq 111:248, ack 249, win 11940, options [nop,nop,TS val 1977576578 ecr 812608188], length 137
05:18:08.447092 ens5  Out IP 172.31.25.79.9651 > 34.227.72.239.52918: Flags [P.], seq 1:138, ack 111, win 10056, options [nop,nop,TS val 1997806682 ecr 4112578067], length 137
05:18:08.447105 ens5  Out IP 172.31.25.79.9651 > 18.206.17.246.41792: Flags [P.], seq 1:138, ack 363, win 9858, options [nop,nop,TS val 434690875 ecr 2038807695], length 137
05:18:08.447192 ens5  In  IP 34.195.184.106.9651 > 172.31.25.79.56706: Flags [.], ack 275, win 15936, options [nop,nop,TS val 2579306131 ecr 2006267348], length 0
05:18:08.447224 ens5  In  IP 174.129.137.236.55960 > 172.31.25.79.9651: Flags [P.], seq 4202898894:4202899005, ack 3031786234, win 12401, options [nop,nop,TS val 3479247498 ecr 2488465307], length 111
05:18:08.447240 ens5  In  IP 98.82.240.103.9651 > 172.31.25.79.60820: Flags [P.], seq 275:386, ack 111, win 19186, options [nop,nop,TS val 655579308 ecr 2826819397], length 111
05:18:08.447243 ens5  Out IP 172.31.25.79.9651 > 174.129.137.236.55960: Flags [.], ack 111, win 8804, options [nop,nop,TS val 2488465316 ecr 3479247498], length 0
05:18:08.447316 ens5  Out IP 172.31.25.79.60820 > 98.82.240.103.9651: Flags [P.], seq 111:248, ack 386, win 14787, options [nop,nop,TS val 2826819402 ecr 655579308], length 137
05:18:08.447325 ens5  Out IP 172.31.25.79.9651 > 174.129.137.236.55960: Flags [P.], seq 1:138, ack 111, win 8804, options [nop,nop,TS val 2488465316 ecr 3479247498], length 137
05:18:08.447326 ens5  In  IP 3.228.129.216.42868 > 172.31.25.79.9651: Flags [P.], seq 1478524125:1478524236, ack 2130994682, win 10039, options [nop,nop,TS val 1154326377 ecr 1600207888], length 111
05:18:08.447377 ens5  In  IP 44.210.177.215.9651 > 172.31.25.79.45396: Flags [P.], seq 111:280, ack 227, win 12299, options [nop,nop,TS val 2933861519 ecr 1499496453], length 169
05:18:08.447385 ens5  Out IP 172.31.25.79.9651 > 3.228.129.216.42868: Flags [P.], seq 1:138, ack 111, win 13011, options [nop,nop,TS val 1600207919 ecr 1154326377], length 137
05:18:08.447476 ens5  Out IP 172.31.25.79.45396 > 44.210.177.215.9651: Flags [P.], seq 227:338, ack 280, win 10891, options [nop,nop,TS val 1499496453 ecr 2933861519], length 111
05:18:08.447481 ens5  In  IP 44.223.151.51.55172 > 172.31.25.79.9651: Flags [P.], seq 137:248, ack 1, win 10415, options [nop,nop,TS val 216371083 ecr 1731391723], length 111
05:18:08.447497 ens5  Out IP 172.31.25.79.9651 > 44.223.151.51.55172: Flags [.], ack 248, win 14123, options [nop,nop,TS val 1731391754 ecr 216371077], length 0
05:18:08.447546 ens5  Out IP 172.31.25.79.9651 > 44.223.151.51.55172: Flags [P.], seq 1:138, ack 248, win 14123, options [nop,nop,TS val 1731391754 ecr 216371077], length 137
05:18:08.447844 ens5  In  IP 44.210.177.215.9651 > 172.31.25.79.45396: Flags [P.], seq 280:747, ack 338, win 12299, options [nop,nop,TS val 2933861520 ecr 1499496453], length 467
05:18:08.447891 ens5  In  IP 165.227.179.96.41342 > 172.31.25.79.9651: Flags [.], ack 4294967185, win 3556, options [nop,nop,TS val 2360523638 ecr 1229149588], length 0
05:18:08.447966 ens5  Out IP 172.31.25.79.45396 > 44.210.177.215.9651: Flags [P.], seq 338:449, ack 747, win 10891, options [nop,nop,TS val 1499496454 ecr 2933861520], length 111
05:18:08.448337 ens5  In  IP 44.210.177.215.9651 > 172.31.25.79.45396: Flags [P.], seq 747:1395, ack 449, win 12299, options [nop,nop,TS val 2933861520 ecr 1499496454], length 648
05:18:08.448376 ens5  In  IP 104.236.110.97.36418 > 172.31.25.79.9651: Flags [.], ack 0, win 7507, options [nop,nop,TS val 2353205478 ecr 1177408837], length 0
05:18:08.448457 ens5  Out IP 172.31.25.79.45396 > 44.210.177.215.9651: Flags [P.], seq 449:560, ack 1395, win 10891, options [nop,nop,TS val 1499496454 ecr 2933861520], length 111
05:18:08.448534 ens5  In  IP 165.227.179.96.41342 > 172.31.25.79.9651: Flags [P.], seq 1:138, ack 0, win 3556, options [nop,nop,TS val 2360523638 ecr 1229149593], length 137
05:18:08.448565 ens5  In  IP 104.236.110.97.36418 > 172.31.25.79.9651: Flags [P.], seq 1:483, ack 200, win 7507, options [nop,nop,TS val 2353205478 ecr 1177408842], length 482
05:18:08.448602 ens5  In  IP 165.227.179.96.41342 > 172.31.25.79.9651: Flags [P.], seq 138:275, ack 111, win 3556, options [nop,nop,TS val 2360523638 ecr 1229149593], length 137
05:18:08.448615 ens5  Out IP 172.31.25.79.9651 > 165.227.179.96.41342: Flags [.], ack 275, win 14028, options [nop,nop,TS val 1229149599 ecr 2360523638], length 0
